                                
                                
Station: localhost.localdomain
Date   : 1999-12-31 19:58:48
Version: V0.0.00(BFT1-EVT)
                                
19:58:49.01 ##############################################################
19:58:49.01 Section: PCIe List Check
19:58:49.01 Subsection:  PCIE List Check
19:58:49.01 Send = lspci
19:58:49.01 Rece = 
00:00.0 Host bridge: Intel Corporation Device 2020 (rev 04)
00:04.0 System peripheral: Intel Corporation Sky Lake-E CBDMA Registers (rev 04)
00:04.1 System peripheral: Intel Corporation Sky Lake-E CBDMA Registers (rev 04)
00:04.2 System peripheral: Intel Corporation Sky Lake-E CBDMA Registers (rev 04)
00:04.3 System peripheral: Intel Corporation Sky Lake-E CBDMA Registers (rev 04)
00:04.4 System peripheral: Intel Corporation Sky Lake-E CBDMA Registers (rev 04)
00:04.5 System peripheral: Intel Corporation Sky Lake-E CBDMA Registers (rev 04)
00:04.6 System peripheral: Intel Corporation Sky Lake-E CBDMA Registers (rev 04)
00:04.7 System peripheral: Intel Corporation Sky Lake-E CBDMA Registers (rev 04)
00:05.0 System peripheral: Intel Corporation Sky Lake-E MM/Vt-d Configuration Registers (rev 04)
00:05.2 System peripheral: Intel Corporation Device 2025 (rev 04)
00:05.4 PIC: Intel Corporation Device 2026 (rev 04)
00:08.0 System peripheral: Intel Corporation Sky Lake-E Ubox Registers (rev 04)
00:08.1 Performance counters: Intel Corporation Sky Lake-E Ubox Registers (rev 04)
00:08.2 System peripheral: Intel Corporation Sky Lake-E Ubox Registers (rev 04)
00:11.0 Unassigned class [ff00]: Intel Corporation Device a1ec (rev 09)
00:11.1 Unassigned class [ff00]: Intel Corporation Device a1ed (rev 09)
00:11.5 SATA controller: Intel Corporation Lewisburg SSATA Controller [AHCI mode] (rev 09)
00:14.0 USB controller: Intel Corporation Lewisburg USB 3.0 xHCI Controller (rev 09)
00:14.2 Signal processing controller: Intel Corporation Device a1b1 (rev 09)
00:16.0 Communication controller: Intel Corporation Lewisburg CSME: HECI #1 (rev 09)
00:16.1 Communication controller: Intel Corporation Lewisburg CSME: HECI #2 (rev 09)
00:16.4 Communication controller: Intel Corporation Lewisburg CSME: HECI #3 (rev 09)
00:17.0 SATA controller: Intel Corporation Lewisburg SATA Controller [AHCI mode] (rev 09)
00:1c.0 PCI bridge: Intel Corporation Lewisburg PCI Express Root Port #1 (rev f9)
00:1c.4 PCI bridge: Intel Corporation Lewisburg PCI Express Root Port #5 (rev f9)
00:1f.0 ISA bridge: Intel Corporation Lewisburg LPC Controller (rev 09)
00:1f.2 Memory controller: Intel Corporation Lewisburg PMC (rev 09)
00:1f.4 SMBus: Intel Corporation Lewisburg SMBus (rev 09)
00:1f.5 Serial bus controller [0c80]: Intel Corporation Lewisburg SPI Controller (rev 09)
02:00.0 PCI bridge: ASPEED Technology, Inc. AST1150 PCI-to-PCI Bridge (rev 04)
03:00.0 VGA compatible controller: ASPEED Technology, Inc. ASPEED Graphics Family (rev 41)
17:00.0 PCI bridge: Intel Corporation Sky Lake-E PCI Express Root Port 1A (rev 04)
17:02.0 PCI bridge: Intel Corporation Sky Lake-E PCI Express Root Port 1C (rev 04)
17:05.0 System peripheral: Intel Corporation Device 2034 (rev 04)
17:05.2 System peripheral: Intel Corporation Sky Lake-E RAS Configuration Registers (rev 04)
17:05.4 PIC: Intel Corporation Device 2036 (rev 04)
17:08.0 System peripheral: Intel Corporation Sky Lake-E CHA Registers (rev 04)
17:08.1 System peripheral: Intel Corporation Sky Lake-E CHA Registers (rev 04)
17:08.2 System peripheral: Intel Corporation Sky Lake-E CHA Registers (rev 04)
17:08.3 System peripheral: Intel Corporation Sky Lake-E CHA Registers (rev 04)
17:08.4 System peripheral: Intel Corporation Sky Lake-E CHA Registers (rev 04)
17:08.5 System peripheral: Intel Corporation Sky Lake-E CHA Registers (rev 04)
17:08.6 System peripheral: Intel Corporation Sky Lake-E CHA Registers (rev 04)
17:08.7 System peripheral: Intel Corporation Sky Lake-E CHA Registers (rev 04)
17:09.0 System peripheral: Intel Corporation Sky Lake-E CHA Registers (rev 04)
17:09.1 System peripheral: Intel Corporation Sky Lake-E CHA Registers (rev 04)
17:09.2 System peripheral: Intel Corporation Sky Lake-E CHA Registers (rev 04)
17:09.3 System peripheral: Intel Corporation Sky Lake-E CHA Registers (rev 04)
17:09.4 System peripheral: Intel Corporation Sky Lake-E CHA Registers (rev 04)
17:09.5 System peripheral: Intel Corporation Sky Lake-E CHA Registers (rev 04)
17:09.6 System peripheral: Intel Corporation Sky Lake-E CHA Registers (rev 04)
17:09.7 System peripheral: Intel Corporation Sky Lake-E CHA Registers (rev 04)
17:0a.0 System peripheral: Intel Corporation Sky Lake-E CHA Registers (rev 04)
17:0a.1 System peripheral: Intel Corporation Sky Lake-E CHA Registers (rev 04)
17:0a.2 System peripheral: Intel Corporation Sky Lake-E CHA Registers (rev 04)
17:0a.3 System peripheral: Intel Corporation Sky Lake-E CHA Registers (rev 04)
17:0a.4 System peripheral: Intel Corporation Sky Lake-E CHA Registers (rev 04)
17:0a.5 System peripheral: Intel Corporation Sky Lake-E CHA Registers (rev 04)
17:0a.6 System peripheral: Intel Corporation Sky Lake-E CHA Registers (rev 04)
17:0a.7 System peripheral: Intel Corporation Sky Lake-E CHA Registers (rev 04)
17:0b.0 System peripheral: Intel Corporation Sky Lake-E CHA Registers (rev 04)
17:0b.1 System peripheral: Intel Corporation Sky Lake-E CHA Registers (rev 04)
17:0b.2 System peripheral: Intel Corporation Sky Lake-E CHA Registers (rev 04)
17:0b.3 System peripheral: Intel Corporation Sky Lake-E CHA Registers (rev 04)
17:0e.0 System peripheral: Intel Corporation Sky Lake-E CHA Registers (rev 04)
17:0e.1 System peripheral: Intel Corporation Sky Lake-E CHA Registers (rev 04)
17:0e.2 System peripheral: Intel Corporation Sky Lake-E CHA Registers (rev 04)
17:0e.3 System peripheral: Intel Corporation Sky Lake-E CHA Registers (rev 04)
17:0e.4 System peripheral: Intel Corporation Sky Lake-E CHA Registers (rev 04)
17:0e.5 System peripheral: Intel Corporation Sky Lake-E CHA Registers (rev 04)
17:0e.6 System peripheral: Intel Corporation Sky Lake-E CHA Registers (rev 04)
17:0e.7 System peripheral: Intel Corporation Sky Lake-E CHA Registers (rev 04)
17:0f.0 System peripheral: Intel Corporation Sky Lake-E CHA Registers (rev 04)
17:0f.1 System peripheral: Intel Corporation Sky Lake-E CHA Registers (rev 04)
17:0f.2 System peripheral: Intel Corporation Sky Lake-E CHA Registers (rev 04)
17:0f.3 System peripheral: Intel Corporation Sky Lake-E CHA Registers (rev 04)
17:0f.4 System peripheral: Intel Corporation Sky Lake-E CHA Registers (rev 04)
17:0f.5 System peripheral: Intel Corporation Sky Lake-E CHA Registers (rev 04)
17:0f.6 System peripheral: Intel Corporation Sky Lake-E CHA Registers (rev 04)
17:0f.7 System peripheral: Intel Corporation Sky Lake-E CHA Registers (rev 04)
17:10.0 System peripheral: Intel Corporation Sky Lake-E CHA Registers (rev 04)
17:10.1 System peripheral: Intel Corporation Sky Lake-E CHA Registers (rev 04)
17:10.2 System peripheral: Intel Corporation Sky Lake-E CHA Registers (rev 04)
17:10.3 System peripheral: Intel Corporation Sky Lake-E CHA Registers (rev 04)
17:10.4 System peripheral: Intel Corporation Sky Lake-E CHA Registers (rev 04)
17:10.5 System peripheral: Intel Corporation Sky Lake-E CHA Registers (rev 04)
17:10.6 System peripheral: Intel Corporation Sky Lake-E CHA Registers (rev 04)
17:10.7 System peripheral: Intel Corporation Sky Lake-E CHA Registers (rev 04)
17:11.0 System peripheral: Intel Corporation Sky Lake-E CHA Registers (rev 04)
17:11.1 System peripheral: Intel Corporation Sky Lake-E CHA Registers (rev 04)
17:11.2 System peripheral: Intel Corporation Sky Lake-E CHA Registers (rev 04)
17:11.3 System peripheral: Intel Corporation Sky Lake-E CHA Registers (rev 04)
17:1d.0 System peripheral: Intel Corporation Sky Lake-E CHA Registers (rev 04)
17:1d.1 System peripheral: Intel Corporation Sky Lake-E CHA Registers (rev 04)
17:1d.2 System peripheral: Intel Corporation Sky Lake-E CHA Registers (rev 04)
17:1d.3 System peripheral: Intel Corporation Sky Lake-E CHA Registers (rev 04)
17:1e.0 System peripheral: Intel Corporation Sky Lake-E PCU Registers (rev 04)
17:1e.1 System peripheral: Intel Corporation Sky Lake-E PCU Registers (rev 04)
17:1e.2 System peripheral: Intel Corporation Sky Lake-E PCU Registers (rev 04)
17:1e.3 System peripheral: Intel Corporation Sky Lake-E PCU Registers (rev 04)
17:1e.4 System peripheral: Intel Corporation Sky Lake-E PCU Registers (rev 04)
17:1e.5 System peripheral: Intel Corporation Sky Lake-E PCU Registers (rev 04)
17:1e.6 System peripheral: Intel Corporation Sky Lake-E PCU Registers (rev 04)
18:00.0 Mass storage controller: Device 1c36:1031
18:00.1 Mass storage controller: Device 1c36:1031
18:00.2 Ethernet controller: Device 1c36:1001
19:00.0 Mass storage controller: Device 1c36:1031
19:00.1 Mass storage controller: Device 1c36:1031
19:00.2 Ethernet controller: Device 1c36:1001
3a:00.0 PCI bridge: Intel Corporation Sky Lake-E PCI Express Root Port 1A (rev 04)
3a:02.0 PCI bridge: Intel Corporation Sky Lake-E PCI Express Root Port 1C (rev 04)
3a:05.0 System peripheral: Intel Corporation Device 2034 (rev 04)
3a:05.2 System peripheral: Intel Corporation Sky Lake-E RAS Configuration Registers (rev 04)
3a:05.4 PIC: Intel Corporation Device 2036 (rev 04)
3a:08.0 System peripheral: Intel Corporation Device 2066 (rev 04)
3a:09.0 System peripheral: Intel Corporation Device 2066 (rev 04)
3a:0a.0 System peripheral: Intel Corporation Device 2040 (rev 04)
3a:0a.1 System peripheral: Intel Corporation Device 2041 (rev 04)
3a:0a.2 System peripheral: Intel Corporation Device 2042 (rev 04)
3a:0a.3 System peripheral: Intel Corporation Device 2043 (rev 04)
3a:0a.4 System peripheral: Intel Corporation Device 2044 (rev 04)
3a:0a.5 System peripheral: Intel Corporation Device 2045 (rev 04)
3a:0a.6 System peripheral: Intel Corporation Device 2046 (rev 04)
3a:0a.7 System peripheral: Intel Corporation Device 2047 (rev 04)
3a:0b.0 System peripheral: Intel Corporation Device 2048 (rev 04)
3a:0b.1 System peripheral: Intel Corporation Device 2049 (rev 04)
3a:0b.2 System peripheral: Intel Corporation Device 204a (rev 04)
3a:0b.3 System peripheral: Intel Corporation Device 204b (rev 04)
3a:0c.0 System peripheral: Intel Corporation Device 2040 (rev 04)
3a:0c.1 System peripheral: Intel Corporation Device 2041 (rev 04)
3a:0c.2 System peripheral: Intel Corporation Device 2042 (rev 04)
3a:0c.3 System peripheral: Intel Corporation Device 2043 (rev 04)
3a:0c.4 System peripheral: Intel Corporation Device 2044 (rev 04)
3a:0c.5 System peripheral: Intel Corporation Device 2045 (rev 04)
3a:0c.6 System peripheral: Intel Corporation Device 2046 (rev 04)
3a:0c.7 System peripheral: Intel Corporation Device 2047 (rev 04)
3a:0d.0 System peripheral: Intel Corporation Device 2048 (rev 04)
3a:0d.1 System peripheral: Intel Corporation Device 2049 (rev 04)
3a:0d.2 System peripheral: Intel Corporation Device 204a (rev 04)
3a:0d.3 System peripheral: Intel Corporation Device 204b (rev 04)
3b:00.0 Ethernet controller: Device 1c36:1022
3b:00.1 Ethernet controller: Device 1c36:1022
3b:00.2 Ethernet controller: Device 1c36:1001
3c:00.0 Ethernet controller: Device 1c36:8889
3c:00.1 Ethernet controller: Device 1c36:8889
3c:00.2 Ethernet controller: Device 1c36:1001
5d:00.0 PCI bridge: Intel Corporation Sky Lake-E PCI Express Root Port 1A (rev 04)
5d:02.0 PCI bridge: Intel Corporation Sky Lake-E PCI Express Root Port 1C (rev 04)
5d:05.0 System peripheral: Intel Corporation Device 2034 (rev 04)
5d:05.2 System peripheral: Intel Corporation Sky Lake-E RAS Configuration Registers (rev 04)
5d:05.4 PIC: Intel Corporation Device 2036 (rev 04)
5d:0e.0 Performance counters: Intel Corporation Device 2058 (rev 04)
5d:0e.1 System peripheral: Intel Corporation Device 2059 (rev 04)
5d:0f.0 Performance counters: Intel Corporation Device 2058 (rev 04)
5d:0f.1 System peripheral: Intel Corporation Device 2059 (rev 04)
5d:10.0 Performance counters: Intel Corporation Device 2058 (rev 04)
5d:10.1 System peripheral: Intel Corporation Device 2059 (rev 04)
5d:12.0 Performance counters: Intel Corporation Sky Lake-E M3KTI Registers (rev 04)
5d:12.1 Performance counters: Intel Corporation Sky Lake-E M3KTI Registers (rev 04)
5d:12.2 System peripheral: Intel Corporation Sky Lake-E M3KTI Registers (rev 04)
5d:12.4 Performance counters: Intel Corporation Sky Lake-E M3KTI Registers (rev 04)
5d:12.5 Performance counters: Intel Corporation Sky Lake-E M3KTI Registers (rev 04)
5d:15.0 System peripheral: Intel Corporation Sky Lake-E M2PCI Registers (rev 04)
5d:16.0 System peripheral: Intel Corporation Sky Lake-E M2PCI Registers (rev 04)
5d:16.4 System peripheral: Intel Corporation Sky Lake-E M2PCI Registers (rev 04)
5d:17.0 System peripheral: Intel Corporation Sky Lake-E M2PCI Registers (rev 04)
5e:00.0 Ethernet controller: Device 1c36:1022
5e:00.1 Ethernet controller: Device 1c36:1022
5e:00.2 Ethernet controller: Device 1c36:1001
5f:00.0 Ethernet controller: Device 1c36:8889
5f:00.1 Ethernet controller: Device 1c36:8889
5f:00.2 Ethernet controller: Device 1c36:1001
80:00.0 PCI bridge: Intel Corporation Sky Lake-E PCI Express Root Port 1A (rev 04)
80:04.0 System peripheral: Intel Corporation Sky Lake-E CBDMA Registers (rev 04)
80:04.1 System peripheral: Intel Corporation Sky Lake-E CBDMA Registers (rev 04)
80:04.2 System peripheral: Intel Corporation Sky Lake-E CBDMA Registers (rev 04)
80:04.3 System peripheral: Intel Corporation Sky Lake-E CBDMA Registers (rev 04)
80:04.4 System peripheral: Intel Corporation Sky Lake-E CBDMA Registers (rev 04)
80:04.5 System peripheral: Intel Corporation Sky Lake-E CBDMA Registers (rev 04)
80:04.6 System peripheral: Intel Corporation Sky Lake-E CBDMA Registers (rev 04)
80:04.7 System peripheral: Intel Corporation Sky Lake-E CBDMA Registers (rev 04)
80:05.0 System peripheral: Intel Corporation Sky Lake-E MM/Vt-d Configuration Registers (rev 04)
80:05.2 System peripheral: Intel Corporation Device 2025 (rev 04)
80:05.4 PIC: Intel Corporation Device 2026 (rev 04)
80:08.0 System peripheral: Intel Corporation Sky Lake-E Ubox Registers (rev 04)
80:08.1 Performance counters: Intel Corporation Sky Lake-E Ubox Registers (rev 04)
80:08.2 System peripheral: Intel Corporation Sky Lake-E Ubox Registers (rev 04)
81:00.0 Non-Volatile memory controller: Samsung Electronics Co Ltd Device a804
85:05.0 System peripheral: Intel Corporation Device 2034 (rev 04)
85:05.2 System peripheral: Intel Corporation Sky Lake-E RAS Configuration Registers (rev 04)
85:05.4 PIC: Intel Corporation Device 2036 (rev 04)
85:08.0 System peripheral: Intel Corporation Sky Lake-E CHA Registers (rev 04)
85:08.1 System peripheral: Intel Corporation Sky Lake-E CHA Registers (rev 04)
85:08.2 System peripheral: Intel Corporation Sky Lake-E CHA Registers (rev 04)
85:08.3 System peripheral: Intel Corporation Sky Lake-E CHA Registers (rev 04)
85:08.4 System peripheral: Intel Corporation Sky Lake-E CHA Registers (rev 04)
85:08.5 System peripheral: Intel Corporation Sky Lake-E CHA Registers (rev 04)
85:08.6 System peripheral: Intel Corporation Sky Lake-E CHA Registers (rev 04)
85:08.7 System peripheral: Intel Corporation Sky Lake-E CHA Registers (rev 04)
85:09.0 System peripheral: Intel Corporation Sky Lake-E CHA Registers (rev 04)
85:09.1 System peripheral: Intel Corporation Sky Lake-E CHA Registers (rev 04)
85:09.2 System peripheral: Intel Corporation Sky Lake-E CHA Registers (rev 04)
85:09.3 System peripheral: Intel Corporation Sky Lake-E CHA Registers (rev 04)
85:09.4 System peripheral: Intel Corporation Sky Lake-E CHA Registers (rev 04)
85:09.5 System peripheral: Intel Corporation Sky Lake-E CHA Registers (rev 04)
85:09.6 System peripheral: Intel Corporation Sky Lake-E CHA Registers (rev 04)
85:09.7 System peripheral: Intel Corporation Sky Lake-E CHA Registers (rev 04)
85:0a.0 System peripheral: Intel Corporation Sky Lake-E CHA Registers (rev 04)
85:0a.1 System peripheral: Intel Corporation Sky Lake-E CHA Registers (rev 04)
85:0a.2 System peripheral: Intel Corporation Sky Lake-E CHA Registers (rev 04)
85:0a.3 System peripheral: Intel Corporation Sky Lake-E CHA Registers (rev 04)
85:0a.4 System peripheral: Intel Corporation Sky Lake-E CHA Registers (rev 04)
85:0a.5 System peripheral: Intel Corporation Sky Lake-E CHA Registers (rev 04)
85:0a.6 System peripheral: Intel Corporation Sky Lake-E CHA Registers (rev 04)
85:0a.7 System peripheral: Intel Corporation Sky Lake-E CHA Registers (rev 04)
85:0b.0 System peripheral: Intel Corporation Sky Lake-E CHA Registers (rev 04)
85:0b.1 System peripheral: Intel Corporation Sky Lake-E CHA Registers (rev 04)
85:0b.2 System peripheral: Intel Corporation Sky Lake-E CHA Registers (rev 04)
85:0b.3 System peripheral: Intel Corporation Sky Lake-E CHA Registers (rev 04)
85:0e.0 System peripheral: Intel Corporation Sky Lake-E CHA Registers (rev 04)
85:0e.1 System peripheral: Intel Corporation Sky Lake-E CHA Registers (rev 04)
85:0e.2 System peripheral: Intel Corporation Sky Lake-E CHA Registers (rev 04)
85:0e.3 System peripheral: Intel Corporation Sky Lake-E CHA Registers (rev 04)
85:0e.4 System peripheral: Intel Corporation Sky Lake-E CHA Registers (rev 04)
85:0e.5 System peripheral: Intel Corporation Sky Lake-E CHA Registers (rev 04)
85:0e.6 System peripheral: Intel Corporation Sky Lake-E CHA Registers (rev 04)
85:0e.7 System peripheral: Intel Corporation Sky Lake-E CHA Registers (rev 04)
85:0f.0 System peripheral: Intel Corporation Sky Lake-E CHA Registers (rev 04)
85:0f.1 System peripheral: Intel Corporation Sky Lake-E CHA Registers (rev 04)
85:0f.2 System peripheral: Intel Corporation Sky Lake-E CHA Registers (rev 04)
85:0f.3 System peripheral: Intel Corporation Sky Lake-E CHA Registers (rev 04)
85:0f.4 System peripheral: Intel Corporation Sky Lake-E CHA Registers (rev 04)
85:0f.5 System peripheral: Intel Corporation Sky Lake-E CHA Registers (rev 04)
85:0f.6 System peripheral: Intel Corporation Sky Lake-E CHA Registers (rev 04)
85:0f.7 System peripheral: Intel Corporation Sky Lake-E CHA Registers (rev 04)
85:10.0 System peripheral: Intel Corporation Sky Lake-E CHA Registers (rev 04)
85:10.1 System peripheral: Intel Corporation Sky Lake-E CHA Registers (rev 04)
85:10.2 System peripheral: Intel Corporation Sky Lake-E CHA Registers (rev 04)
85:10.3 System peripheral: Intel Corporation Sky Lake-E CHA Registers (rev 04)
85:10.4 System peripheral: Intel Corporation Sky Lake-E CHA Registers (rev 04)
85:10.5 System peripheral: Intel Corporation Sky Lake-E CHA Registers (rev 04)
85:10.6 System peripheral: Intel Corporation Sky Lake-E CHA Registers (rev 04)
85:10.7 System peripheral: Intel Corporation Sky Lake-E CHA Registers (rev 04)
85:11.0 System peripheral: Intel Corporation Sky Lake-E CHA Registers (rev 04)
85:11.1 System peripheral: Intel Corporation Sky Lake-E CHA Registers (rev 04)
85:11.2 System peripheral: Intel Corporation Sky Lake-E CHA Registers (rev 04)
85:11.3 System peripheral: Intel Corporation Sky Lake-E CHA Registers (rev 04)
85:1d.0 System peripheral: Intel Corporation Sky Lake-E CHA Registers (rev 04)
85:1d.1 System peripheral: Intel Corporation Sky Lake-E CHA Registers (rev 04)
85:1d.2 System peripheral: Intel Corporation Sky Lake-E CHA Registers (rev 04)
85:1d.3 System peripheral: Intel Corporation Sky Lake-E CHA Registers (rev 04)
85:1e.0 System peripheral: Intel Corporation Sky Lake-E PCU Registers (rev 04)
85:1e.1 System peripheral: Intel Corporation Sky Lake-E PCU Registers (rev 04)
85:1e.2 System peripheral: Intel Corporation Sky Lake-E PCU Registers (rev 04)
85:1e.3 System peripheral: Intel Corporation Sky Lake-E PCU Registers (rev 04)
85:1e.4 System peripheral: Intel Corporation Sky Lake-E PCU Registers (rev 04)
85:1e.5 System peripheral: Intel Corporation Sky Lake-E PCU Registers (rev 04)
85:1e.6 System peripheral: Intel Corporation Sky Lake-E PCU Registers (rev 04)
ae:05.0 System peripheral: Intel Corporation Device 2034 (rev 04)
ae:05.2 System peripheral: Intel Corporation Sky Lake-E RAS Configuration Registers (rev 04)
ae:05.4 PIC: Intel Corporation Device 2036 (rev 04)
ae:08.0 System peripheral: Intel Corporation Device 2066 (rev 04)
ae:09.0 System peripheral: Intel Corporation Device 2066 (rev 04)
ae:0a.0 System peripheral: Intel Corporation Device 2040 (rev 04)
ae:0a.1 System peripheral: Intel Corporation Device 2041 (rev 04)
ae:0a.2 System peripheral: Intel Corporation Device 2042 (rev 04)
ae:0a.3 System peripheral: Intel Corporation Device 2043 (rev 04)
ae:0a.4 System peripheral: Intel Corporation Device 2044 (rev 04)
ae:0a.5 System peripheral: Intel Corporation Device 2045 (rev 04)
ae:0a.6 System peripheral: Intel Corporation Device 2046 (rev 04)
ae:0a.7 System peripheral: Intel Corporation Device 2047 (rev 04)
ae:0b.0 System peripheral: Intel Corporation Device 2048 (rev 04)
ae:0b.1 System peripheral: Intel Corporation Device 2049 (rev 04)
ae:0b.2 System peripheral: Intel Corporation Device 204a (rev 04)
ae:0b.3 System peripheral: Intel Corporation Device 204b (rev 04)
ae:0c.0 System peripheral: Intel Corporation Device 2040 (rev 04)
ae:0c.1 System peripheral: Intel Corporation Device 2041 (rev 04)
ae:0c.2 System peripheral: Intel Corporation Device 2042 (rev 04)
ae:0c.3 System peripheral: Intel Corporation Device 2043 (rev 04)
ae:0c.4 System peripheral: Intel Corporation Device 2044 (rev 04)
ae:0c.5 System peripheral: Intel Corporation Device 2045 (rev 04)
ae:0c.6 System peripheral: Intel Corporation Device 2046 (rev 04)
ae:0c.7 System peripheral: Intel Corporation Device 2047 (rev 04)
ae:0d.0 System peripheral: Intel Corporation Device 2048 (rev 04)
ae:0d.1 System peripheral: Intel Corporation Device 2049 (rev 04)
ae:0d.2 System peripheral: Intel Corporation Device 204a (rev 04)
ae:0d.3 System peripheral: Intel Corporation Device 204b (rev 04)
d7:05.0 System peripheral: Intel Corporation Device 2034 (rev 04)
d7:05.2 System peripheral: Intel Corporation Sky Lake-E RAS Configuration Registers (rev 04)
d7:05.4 PIC: Intel Corporation Device 2036 (rev 04)
d7:0e.0 Performance counters: Intel Corporation Device 2058 (rev 04)
d7:0e.1 System peripheral: Intel Corporation Device 2059 (rev 04)
d7:0f.0 Performance counters: Intel Corporation Device 2058 (rev 04)
d7:0f.1 System peripheral: Intel Corporation Device 2059 (rev 04)
d7:10.0 Performance counters: Intel Corporation Device 2058 (rev 04)
d7:10.1 System peripheral: Intel Corporation Device 2059 (rev 04)
d7:12.0 Performance counters: Intel Corporation Sky Lake-E M3KTI Registers (rev 04)
d7:12.1 Performance counters: Intel Corporation Sky Lake-E M3KTI Registers (rev 04)
d7:12.2 System peripheral: Intel Corporation Sky Lake-E M3KTI Registers (rev 04)
d7:12.4 Performance counters: Intel Corporation Sky Lake-E M3KTI Registers (rev 04)
d7:12.5 Performance counters: Intel Corporation Sky Lake-E M3KTI Registers (rev 04)
d7:15.0 System peripheral: Intel Corporation Sky Lake-E M2PCI Registers (rev 04)
d7:16.0 System peripheral: Intel Corporation Sky Lake-E M2PCI Registers (rev 04)
d7:16.4 System peripheral: Intel Corporation Sky Lake-E M2PCI Registers (rev 04)
d7:17.0 System peripheral: Intel Corporation Sky Lake-E M2PCI Registers (rev 04)
19:58:49.09 PASS,all compnent in lspci check list
19:58:49.09 Tester Chk => OK: PCIe List Verified
19:58:49.10 ##############################################################
19:58:49.10 Subsection: ButterFly1_Ethernet_Ctrl1 Speed and Width Check
19:58:49.10 Send = lspci -s 3b:00.0 -vvn
19:58:49.10 Rece = 
3b:00.0 0200: 1c36:1022
	Subsystem: 0102:abce
	Control: I/O- Mem+ BusMaster+ SpecCycle- MemWINV- VGASnoop- ParErr- Stepping- SERR+ FastB2B- DisINTx-
	Status: Cap+ 66MHz- UDF- FastB2B- ParErr- DEVSEL=fast >TAbort- <TAbort- <MAbort- >SERR- <PERR- INTx-
	Latency: 0, Cache Line Size: 32 bytes
	Interrupt: pin A routed to IRQ 11
	NUMA node: 0
	Region 0: Memory at 8a024000 (64-bit, non-prefetchable) [size=16K]
	Region 4: Memory at 80000000 (32-bit, non-prefetchable) [size=64M]
	Region 5: Memory at 88000000 (32-bit, non-prefetchable) [size=32M]
	Expansion ROM at 8a000000 [disabled] [size=128K]
	Capabilities: [40] Power Management version 3
		Flags: PMEClk- DSI- D1- D2- AuxCurrent=375mA PME(D0+,D1-,D2-,D3hot-,D3cold-)
		Status: D0 NoSoftRst- PME-Enable- DSel=0 DScale=0 PME-
	Capabilities: [70] Express (v2) Endpoint, MSI 00
		DevCap:	MaxPayload 256 bytes, PhantFunc 0, Latency L0s <1us, L1 <8us
			ExtTag- AttnBtn- AttnInd- PwrInd- RBE+ FLReset+ SlotPowerLimit 75.000W
		DevCtl:	Report errors: Correctable- Non-Fatal- Fatal- Unsupported-
			RlxdOrd+ ExtTag- PhantFunc- AuxPwr- NoSnoop+ FLReset-
			MaxPayload 256 bytes, MaxReadReq 512 bytes
		DevSta:	CorrErr- UncorrErr- FatalErr- UnsuppReq- AuxPwr- TransPend-
		LnkCap:	Port #0, Speed 8GT/s, Width x8, ASPM not supported, Exit Latency L0s <1us, L1 <64us
			ClockPM- Surprise- LLActRep- BwNot- ASPMOptComp+
		LnkCtl:	ASPM Disabled; RCB 64 bytes Disabled- CommClk+
			ExtSynch- ClockPM- AutWidDis- BWInt- AutBWInt-
		LnkSta:	Speed 8GT/s, Width x8, TrErr- Train- SlotClk+ DLActive- BWMgmt- ABWMgmt-
		DevCap2: Completion Timeout: Range ABCD, TimeoutDis+, LTR-, OBFF Not Supported
		DevCtl2: Completion Timeout: 50us to 50ms, TimeoutDis-, LTR-, OBFF Disabled
		LnkCtl2: Target Link Speed: 8GT/s, EnterCompliance- SpeedDis-
			 Transmit Margin: Normal Operating Range, EnterModifiedCompliance- ComplianceSOS-
			 Compliance De-emphasis: -6dB
		LnkSta2: Current De-emphasis Level: -3.5dB, EqualizationComplete+, EqualizationPhase1+
			 EqualizationPhase2+, EqualizationPhase3+, LinkEqualizationRequest-
	Capabilities: [b0] MSI-X: Enable- Count=64 Masked-
		Vector table: BAR=5 offset=0005d000
		PBA: BAR=5 offset=0005dff0
	Capabilities: [c0] Vital Product Data
		Product Name: Annapurna Labs Alpine AL5+
		Read-only fields:
			[PN] Part number: N08AP6VFN008A
			[SN] Serial number: A715041789
			[EC] Engineering changes: 1E
			[V0] Vendor specific: FF
			[V1] Vendor specific: 14:4F:D7:0F:82:36
			[V2] Vendor specific: 14:4F:D7:0F:82:37
			[V3] Vendor specific: 14:4F:D7:0F:82:38
			[V4] Vendor specific: FF:FF:FF:FF:FF:FF
		End
	Capabilities: [100 v1] Alternative Routing-ID Interpretation (ARI)
		ARICap:	MFVC- ACS-, Next Function: 1
		ARICtl:	MFVC- ACS-, Function Group: 0
	Capabilities: [140 v1] Device Serial Number 9a-bc-de-f0-12-34-56-78
	Capabilities: [150 v1] #19
	Capabilities: [178 v1] Transaction Processing Hints
		Device specific mode supported
		No steering table available
	Capabilities: [200 v2] Advanced Error Reporting
		UESta:	DLP- SDES- TLP- FCP- CmpltTO- CmpltAbrt- UnxCmplt- RxOF- MalfTLP- ECRC- UnsupReq- ACSViol-
		UEMsk:	DLP- SDES- TLP- FCP- CmpltTO- CmpltAbrt- UnxCmplt- RxOF- MalfTLP- ECRC- UnsupReq- ACSViol-
		UESvrt:	DLP+ SDES+ TLP- FCP+ CmpltTO- CmpltAbrt- UnxCmplt- RxOF+ MalfTLP+ ECRC- UnsupReq- ACSViol-
		CESta:	RxErr- BadTLP- BadDLLP- Rollover- Timeout- NonFatalErr-
		CEMsk:	RxErr- BadTLP- BadDLLP- Rollover- Timeout- NonFatalErr+
		AERCap:	First Error Pointer: 00, GenCap+ CGenEn- ChkCap+ ChkEn-

19:58:49.14 PASS: ButterFly1_Ethernet_Ctrl1 PCIe link speed 8
19:58:49.14 PASS: ButterFly1_Ethernet_Ctrl1 PCIe link Width is 8
19:58:49.14 Subsection: ButterFly1_Ethernet_Ctrl2 Speed and Width Check
19:58:49.14 Send = lspci -s 3b:00.1 -vvn
19:58:49.14 Rece = 
3b:00.1 0200: 1c36:1022
	Subsystem: 0102:abce
	Control: I/O- Mem+ BusMaster+ SpecCycle- MemWINV- VGASnoop- ParErr- Stepping- SERR+ FastB2B- DisINTx-
	Status: Cap+ 66MHz- UDF- FastB2B- ParErr- DEVSEL=fast >TAbort- <TAbort- <MAbort- >SERR- <PERR- INTx-
	Latency: 0, Cache Line Size: 32 bytes
	Interrupt: pin A routed to IRQ 11
	NUMA node: 0
	Region 0: Memory at 8a020000 (64-bit, non-prefetchable) [size=16K]
	Region 5: Memory at 86000000 (32-bit, non-prefetchable) [size=32M]
	Capabilities: [40] Power Management version 3
		Flags: PMEClk- DSI- D1- D2- AuxCurrent=375mA PME(D0+,D1-,D2-,D3hot-,D3cold-)
		Status: D0 NoSoftRst- PME-Enable- DSel=0 DScale=0 PME-
	Capabilities: [70] Express (v2) Endpoint, MSI 00
		DevCap:	MaxPayload 256 bytes, PhantFunc 0, Latency L0s <1us, L1 <8us
			ExtTag- AttnBtn- AttnInd- PwrInd- RBE+ FLReset+ SlotPowerLimit 75.000W
		DevCtl:	Report errors: Correctable- Non-Fatal- Fatal- Unsupported-
			RlxdOrd+ ExtTag- PhantFunc- AuxPwr- NoSnoop+ FLReset-
			MaxPayload 256 bytes, MaxReadReq 512 bytes
		DevSta:	CorrErr- UncorrErr- FatalErr- UnsuppReq- AuxPwr- TransPend-
		LnkCap:	Port #0, Speed 8GT/s, Width x8, ASPM not supported, Exit Latency L0s <1us, L1 <64us
			ClockPM- Surprise- LLActRep- BwNot- ASPMOptComp+
		LnkCtl:	ASPM Disabled; RCB 64 bytes Disabled- CommClk+
			ExtSynch- ClockPM- AutWidDis- BWInt- AutBWInt-
		LnkSta:	Speed 8GT/s, Width x8, TrErr- Train- SlotClk+ DLActive- BWMgmt- ABWMgmt-
		DevCap2: Completion Timeout: Range ABCD, TimeoutDis+, LTR-, OBFF Not Supported
		DevCtl2: Completion Timeout: 50us to 50ms, TimeoutDis-, LTR-, OBFF Disabled
		LnkSta2: Current De-emphasis Level: -3.5dB, EqualizationComplete-, EqualizationPhase1-
			 EqualizationPhase2-, EqualizationPhase3-, LinkEqualizationRequest-
	Capabilities: [b0] MSI-X: Enable- Count=64 Masked-
		Vector table: BAR=5 offset=0025d000
		PBA: BAR=5 offset=0025dff0
	Capabilities: [c0] Vital Product Data
		Product Name: Annapurna Labs Alpine AL5+
		Read-only fields:
			[PN] Part number: N08AP6VFN008A
			[SN] Serial number: A715041789
			[EC] Engineering changes: 1E
			[V0] Vendor specific: FF
			[V1] Vendor specific: 14:4F:D7:0F:82:36
			[V2] Vendor specific: 14:4F:D7:0F:82:37
			[V3] Vendor specific: 14:4F:D7:0F:82:38
			[V4] Vendor specific: FF:FF:FF:FF:FF:FF
		End
	Capabilities: [100 v1] Alternative Routing-ID Interpretation (ARI)
		ARICap:	MFVC- ACS-, Next Function: 2
		ARICtl:	MFVC- ACS-, Function Group: 0
	Capabilities: [140 v1] Device Serial Number 9a-bc-de-f0-12-34-56-78
	Capabilities: [150 v1] #19
	Capabilities: [178 v1] Transaction Processing Hints
		Device specific mode supported
		No steering table available
	Capabilities: [200 v2] Advanced Error Reporting
		UESta:	DLP- SDES- TLP- FCP- CmpltTO- CmpltAbrt- UnxCmplt- RxOF- MalfTLP- ECRC- UnsupReq- ACSViol-
		UEMsk:	DLP- SDES- TLP- FCP- CmpltTO- CmpltAbrt- UnxCmplt- RxOF- MalfTLP- ECRC- UnsupReq- ACSViol-
		UESvrt:	DLP+ SDES+ TLP- FCP+ CmpltTO- CmpltAbrt- UnxCmplt- RxOF+ MalfTLP+ ECRC- UnsupReq- ACSViol-
		CESta:	RxErr- BadTLP- BadDLLP- Rollover- Timeout- NonFatalErr-
		CEMsk:	RxErr- BadTLP- BadDLLP- Rollover- Timeout- NonFatalErr+
		AERCap:	First Error Pointer: 00, GenCap+ CGenEn- ChkCap+ ChkEn-

19:58:49.17 PASS: ButterFly1_Ethernet_Ctrl2 PCIe link speed 8
19:58:49.17 PASS: ButterFly1_Ethernet_Ctrl2 PCIe link Width is 8
19:58:49.17 Subsection: ButterFly1_Ethernet_Ctrl3 Speed and Width Check
19:58:49.17 Send = lspci -s 3b:00.2 -vvn
19:58:49.17 Rece = 
3b:00.2 0200: 1c36:1001
	Subsystem: 0102:abce
	Control: I/O- Mem+ BusMaster+ SpecCycle- MemWINV- VGASnoop- ParErr- Stepping- SERR+ FastB2B- DisINTx-
	Status: Cap+ 66MHz- UDF- FastB2B- ParErr- DEVSEL=fast >TAbort- <TAbort- <MAbort- >SERR- <PERR- INTx-
	Latency: 0, Cache Line Size: 32 bytes
	Interrupt: pin A routed to IRQ 11
	NUMA node: 0
	Region 5: Memory at 84000000 (32-bit, non-prefetchable) [size=32M]
	Capabilities: [40] Power Management version 3
		Flags: PMEClk- DSI- D1- D2- AuxCurrent=375mA PME(D0+,D1-,D2-,D3hot-,D3cold-)
		Status: D0 NoSoftRst- PME-Enable- DSel=0 DScale=0 PME-
	Capabilities: [70] Express (v2) Endpoint, MSI 00
		DevCap:	MaxPayload 256 bytes, PhantFunc 0, Latency L0s <1us, L1 <8us
			ExtTag- AttnBtn- AttnInd- PwrInd- RBE+ FLReset+ SlotPowerLimit 75.000W
		DevCtl:	Report errors: Correctable- Non-Fatal- Fatal- Unsupported-
			RlxdOrd+ ExtTag- PhantFunc- AuxPwr- NoSnoop+ FLReset-
			MaxPayload 256 bytes, MaxReadReq 512 bytes
		DevSta:	CorrErr- UncorrErr- FatalErr- UnsuppReq- AuxPwr- TransPend-
		LnkCap:	Port #0, Speed 8GT/s, Width x8, ASPM not supported, Exit Latency L0s <1us, L1 <64us
			ClockPM- Surprise- LLActRep- BwNot- ASPMOptComp+
		LnkCtl:	ASPM Disabled; RCB 64 bytes Disabled- CommClk+
			ExtSynch- ClockPM- AutWidDis- BWInt- AutBWInt-
		LnkSta:	Speed 8GT/s, Width x8, TrErr- Train- SlotClk+ DLActive- BWMgmt- ABWMgmt-
		DevCap2: Completion Timeout: Range ABCD, TimeoutDis+, LTR-, OBFF Not Supported
		DevCtl2: Completion Timeout: 50us to 50ms, TimeoutDis-, LTR-, OBFF Disabled
		LnkSta2: Current De-emphasis Level: -3.5dB, EqualizationComplete-, EqualizationPhase1-
			 EqualizationPhase2-, EqualizationPhase3-, LinkEqualizationRequest-
	Capabilities: [b0] MSI-X: Enable- Count=64 Masked-
		Vector table: BAR=5 offset=0013d000
		PBA: BAR=5 offset=0013dff0
	Capabilities: [c0] Vital Product Data
		Product Name: Annapurna Labs Alpine AL5+
		Read-only fields:
			[PN] Part number: N08AP6VFN008A
			[SN] Serial number: A715041789
			[EC] Engineering changes: 1E
			[V0] Vendor specific: FF
			[V1] Vendor specific: 14:4F:D7:0F:82:36
			[V2] Vendor specific: 14:4F:D7:0F:82:37
			[V3] Vendor specific: 14:4F:D7:0F:82:38
			[V4] Vendor specific: FF:FF:FF:FF:FF:FF
		End
	Capabilities: [100 v1] Alternative Routing-ID Interpretation (ARI)
		ARICap:	MFVC- ACS-, Next Function: 0
		ARICtl:	MFVC- ACS-, Function Group: 0
	Capabilities: [140 v1] Device Serial Number 9a-bc-de-f0-12-34-56-78
	Capabilities: [150 v1] #19
	Capabilities: [178 v1] Transaction Processing Hints
		Device specific mode supported
		No steering table available
	Capabilities: [200 v2] Advanced Error Reporting
		UESta:	DLP- SDES- TLP- FCP- CmpltTO- CmpltAbrt- UnxCmplt- RxOF- MalfTLP- ECRC- UnsupReq- ACSViol-
		UEMsk:	DLP- SDES- TLP- FCP- CmpltTO- CmpltAbrt- UnxCmplt- RxOF- MalfTLP- ECRC- UnsupReq- ACSViol-
		UESvrt:	DLP+ SDES+ TLP- FCP+ CmpltTO- CmpltAbrt- UnxCmplt- RxOF+ MalfTLP+ ECRC- UnsupReq- ACSViol-
		CESta:	RxErr- BadTLP- BadDLLP- Rollover- Timeout- NonFatalErr-
		CEMsk:	RxErr- BadTLP- BadDLLP- Rollover- Timeout- NonFatalErr+
		AERCap:	First Error Pointer: 00, GenCap+ CGenEn- ChkCap+ ChkEn-

19:58:49.20 PASS: ButterFly1_Ethernet_Ctrl3 PCIe link speed 8
19:58:49.20 PASS: ButterFly1_Ethernet_Ctrl3 PCIe link Width is 8
19:58:49.20 Subsection: ButterFly1_Ethernet_Ctrl1 Speed and Width Check
19:58:49.21 Send = lspci -s 3c:00.0 -vvn
19:58:49.21 Rece = 
3c:00.0 0200: 1c36:8889
	Subsystem: 0102:abce
	Control: I/O- Mem- BusMaster- SpecCycle- MemWINV- VGASnoop- ParErr- Stepping- SERR+ FastB2B- DisINTx-
	Status: Cap+ 66MHz- UDF- FastB2B- ParErr- DEVSEL=fast >TAbort- <TAbort- <MAbort- >SERR- <PERR- INTx-
	Interrupt: pin A routed to IRQ 11
	NUMA node: 0
	Region 0: Memory at 7e004000 (64-bit, non-prefetchable) [disabled] [size=16K]
	Region 4: Memory at 74000000 (32-bit, non-prefetchable) [disabled] [size=64M]
	Region 5: Memory at 7c000000 (32-bit, non-prefetchable) [disabled] [size=32M]
	Capabilities: [40] Power Management version 3
		Flags: PMEClk- DSI- D1- D2- AuxCurrent=375mA PME(D0+,D1-,D2-,D3hot-,D3cold-)
		Status: D0 NoSoftRst- PME-Enable- DSel=0 DScale=0 PME-
	Capabilities: [70] Express (v2) Endpoint, MSI 00
		DevCap:	MaxPayload 256 bytes, PhantFunc 0, Latency L0s <1us, L1 <8us
			ExtTag- AttnBtn- AttnInd- PwrInd- RBE+ FLReset+ SlotPowerLimit 75.000W
		DevCtl:	Report errors: Correctable- Non-Fatal- Fatal- Unsupported-
			RlxdOrd+ ExtTag- PhantFunc- AuxPwr- NoSnoop+ FLReset-
			MaxPayload 256 bytes, MaxReadReq 512 bytes
		DevSta:	CorrErr- UncorrErr- FatalErr- UnsuppReq- AuxPwr- TransPend-
		LnkCap:	Port #0, Speed 8GT/s, Width x8, ASPM not supported, Exit Latency L0s <1us, L1 <64us
			ClockPM- Surprise- LLActRep- BwNot- ASPMOptComp+
		LnkCtl:	ASPM Disabled; RCB 64 bytes Disabled- CommClk+
			ExtSynch- ClockPM- AutWidDis- BWInt- AutBWInt-
		LnkSta:	Speed 8GT/s, Width x8, TrErr- Train- SlotClk+ DLActive- BWMgmt- ABWMgmt-
		DevCap2: Completion Timeout: Range ABCD, TimeoutDis+, LTR-, OBFF Not Supported
		DevCtl2: Completion Timeout: 50us to 50ms, TimeoutDis-, LTR-, OBFF Disabled
		LnkCtl2: Target Link Speed: 8GT/s, EnterCompliance- SpeedDis-
			 Transmit Margin: Normal Operating Range, EnterModifiedCompliance- ComplianceSOS-
			 Compliance De-emphasis: -6dB
		LnkSta2: Current De-emphasis Level: -3.5dB, EqualizationComplete+, EqualizationPhase1+
			 EqualizationPhase2+, EqualizationPhase3+, LinkEqualizationRequest-
	Capabilities: [b0] MSI-X: Enable- Count=64 Masked-
		Vector table: BAR=5 offset=0005d000
		PBA: BAR=5 offset=0005dff0
	Capabilities: [c0] Vital Product Data
		Product Name: Annapurna Labs Alpine AL5+
		Read-only fields:
			[PN] Part number: N08AP6VFN008A
			[SN] Serial number: A715041789
			[EC] Engineering changes: 1E
			[V0] Vendor specific: FF
			[V1] Vendor specific: 14:4F:D7:0F:82:39
			[V2] Vendor specific: 14:4F:D7:0F:82:3A
			[V3] Vendor specific: 14:4F:D7:0F:82:3B
			[V4] Vendor specific: 14:4F:D7:0F:82:3C
		End
	Capabilities: [100 v1] Alternative Routing-ID Interpretation (ARI)
		ARICap:	MFVC- ACS-, Next Function: 1
		ARICtl:	MFVC- ACS-, Function Group: 0
	Capabilities: [140 v1] Device Serial Number 9a-bc-de-f0-12-34-56-78
	Capabilities: [150 v1] #19
	Capabilities: [178 v1] Transaction Processing Hints
		Device specific mode supported
		No steering table available
	Capabilities: [200 v2] Advanced Error Reporting
		UESta:	DLP- SDES- TLP- FCP- CmpltTO- CmpltAbrt- UnxCmplt- RxOF- MalfTLP- ECRC- UnsupReq- ACSViol-
		UEMsk:	DLP- SDES- TLP- FCP- CmpltTO- CmpltAbrt- UnxCmplt- RxOF- MalfTLP- ECRC- UnsupReq- ACSViol-
		UESvrt:	DLP+ SDES+ TLP- FCP+ CmpltTO- CmpltAbrt- UnxCmplt- RxOF+ MalfTLP+ ECRC- UnsupReq- ACSViol-
		CESta:	RxErr- BadTLP- BadDLLP- Rollover- Timeout- NonFatalErr-
		CEMsk:	RxErr- BadTLP- BadDLLP- Rollover- Timeout- NonFatalErr+
		AERCap:	First Error Pointer: 00, GenCap+ CGenEn- ChkCap+ ChkEn-

19:58:49.24 PASS: ButterFly1_Ethernet_Ctrl1 PCIe link speed 8
19:58:49.24 PASS: ButterFly1_Ethernet_Ctrl1 PCIe link Width is 8
19:58:49.24 Subsection: ButterFly1_Ethernet_Ctrl2 Speed and Width Check
19:58:49.24 Send = lspci -s 3c:00.1 -vvn
19:58:49.24 Rece = 
3c:00.1 0200: 1c36:8889
	Subsystem: 0102:abce
	Control: I/O- Mem- BusMaster- SpecCycle- MemWINV- VGASnoop- ParErr- Stepping- SERR+ FastB2B- DisINTx-
	Status: Cap+ 66MHz- UDF- FastB2B- ParErr- DEVSEL=fast >TAbort- <TAbort- <MAbort- >SERR- <PERR- INTx-
	Interrupt: pin A routed to IRQ 11
	NUMA node: 0
	Region 0: Memory at 7e000000 (64-bit, non-prefetchable) [disabled] [size=16K]
	Region 5: Memory at 7a000000 (32-bit, non-prefetchable) [disabled] [size=32M]
	Capabilities: [40] Power Management version 3
		Flags: PMEClk- DSI- D1- D2- AuxCurrent=375mA PME(D0+,D1-,D2-,D3hot-,D3cold-)
		Status: D0 NoSoftRst- PME-Enable- DSel=0 DScale=0 PME-
	Capabilities: [70] Express (v2) Endpoint, MSI 00
		DevCap:	MaxPayload 256 bytes, PhantFunc 0, Latency L0s <1us, L1 <8us
			ExtTag- AttnBtn- AttnInd- PwrInd- RBE+ FLReset+ SlotPowerLimit 75.000W
		DevCtl:	Report errors: Correctable- Non-Fatal- Fatal- Unsupported-
			RlxdOrd+ ExtTag- PhantFunc- AuxPwr- NoSnoop+ FLReset-
			MaxPayload 256 bytes, MaxReadReq 512 bytes
		DevSta:	CorrErr- UncorrErr- FatalErr- UnsuppReq- AuxPwr- TransPend-
		LnkCap:	Port #0, Speed 8GT/s, Width x8, ASPM not supported, Exit Latency L0s <1us, L1 <64us
			ClockPM- Surprise- LLActRep- BwNot- ASPMOptComp+
		LnkCtl:	ASPM Disabled; RCB 64 bytes Disabled- CommClk+
			ExtSynch- ClockPM- AutWidDis- BWInt- AutBWInt-
		LnkSta:	Speed 8GT/s, Width x8, TrErr- Train- SlotClk+ DLActive- BWMgmt- ABWMgmt-
		DevCap2: Completion Timeout: Range ABCD, TimeoutDis+, LTR-, OBFF Not Supported
		DevCtl2: Completion Timeout: 50us to 50ms, TimeoutDis-, LTR-, OBFF Disabled
		LnkSta2: Current De-emphasis Level: -3.5dB, EqualizationComplete-, EqualizationPhase1-
			 EqualizationPhase2-, EqualizationPhase3-, LinkEqualizationRequest-
	Capabilities: [b0] MSI-X: Enable- Count=64 Masked-
		Vector table: BAR=5 offset=0025d000
		PBA: BAR=5 offset=0025dff0
	Capabilities: [c0] Vital Product Data
		Product Name: Annapurna Labs Alpine AL5+
		Read-only fields:
			[PN] Part number: N08AP6VFN008A
			[SN] Serial number: A715041789
			[EC] Engineering changes: 1E
			[V0] Vendor specific: FF
			[V1] Vendor specific: 14:4F:D7:0F:82:39
			[V2] Vendor specific: 14:4F:D7:0F:82:3A
			[V3] Vendor specific: 14:4F:D7:0F:82:3B
			[V4] Vendor specific: 14:4F:D7:0F:82:3C
		End
	Capabilities: [100 v1] Alternative Routing-ID Interpretation (ARI)
		ARICap:	MFVC- ACS-, Next Function: 2
		ARICtl:	MFVC- ACS-, Function Group: 0
	Capabilities: [140 v1] Device Serial Number 9a-bc-de-f0-12-34-56-78
	Capabilities: [150 v1] #19
	Capabilities: [178 v1] Transaction Processing Hints
		Device specific mode supported
		No steering table available
	Capabilities: [200 v2] Advanced Error Reporting
		UESta:	DLP- SDES- TLP- FCP- CmpltTO- CmpltAbrt- UnxCmplt- RxOF- MalfTLP- ECRC- UnsupReq- ACSViol-
		UEMsk:	DLP- SDES- TLP- FCP- CmpltTO- CmpltAbrt- UnxCmplt- RxOF- MalfTLP- ECRC- UnsupReq- ACSViol-
		UESvrt:	DLP+ SDES+ TLP- FCP+ CmpltTO- CmpltAbrt- UnxCmplt- RxOF+ MalfTLP+ ECRC- UnsupReq- ACSViol-
		CESta:	RxErr- BadTLP- BadDLLP- Rollover- Timeout- NonFatalErr-
		CEMsk:	RxErr- BadTLP- BadDLLP- Rollover- Timeout- NonFatalErr+
		AERCap:	First Error Pointer: 00, GenCap+ CGenEn- ChkCap+ ChkEn-

19:58:49.27 PASS: ButterFly1_Ethernet_Ctrl2 PCIe link speed 8
19:58:49.27 PASS: ButterFly1_Ethernet_Ctrl2 PCIe link Width is 8
19:58:49.27 Subsection: ButterFly1_Ethernet_Ctrl3 Speed and Width Check
19:58:49.27 Send = lspci -s 3c:00.2 -vvn
19:58:49.27 Rece = 
3c:00.2 0200: 1c36:1001
	Subsystem: 0102:abce
	Control: I/O- Mem- BusMaster- SpecCycle- MemWINV- VGASnoop- ParErr- Stepping- SERR+ FastB2B- DisINTx-
	Status: Cap+ 66MHz- UDF- FastB2B- ParErr- DEVSEL=fast >TAbort- <TAbort- <MAbort- >SERR- <PERR- INTx-
	Interrupt: pin A routed to IRQ 11
	NUMA node: 0
	Region 5: Memory at 78000000 (32-bit, non-prefetchable) [disabled] [size=32M]
	Capabilities: [40] Power Management version 3
		Flags: PMEClk- DSI- D1- D2- AuxCurrent=375mA PME(D0+,D1-,D2-,D3hot-,D3cold-)
		Status: D0 NoSoftRst- PME-Enable- DSel=0 DScale=0 PME-
	Capabilities: [70] Express (v2) Endpoint, MSI 00
		DevCap:	MaxPayload 256 bytes, PhantFunc 0, Latency L0s <1us, L1 <8us
			ExtTag- AttnBtn- AttnInd- PwrInd- RBE+ FLReset+ SlotPowerLimit 75.000W
		DevCtl:	Report errors: Correctable- Non-Fatal- Fatal- Unsupported-
			RlxdOrd+ ExtTag- PhantFunc- AuxPwr- NoSnoop+ FLReset-
			MaxPayload 256 bytes, MaxReadReq 512 bytes
		DevSta:	CorrErr- UncorrErr- FatalErr- UnsuppReq- AuxPwr- TransPend-
		LnkCap:	Port #0, Speed 8GT/s, Width x8, ASPM not supported, Exit Latency L0s <1us, L1 <64us
			ClockPM- Surprise- LLActRep- BwNot- ASPMOptComp+
		LnkCtl:	ASPM Disabled; RCB 64 bytes Disabled- CommClk+
			ExtSynch- ClockPM- AutWidDis- BWInt- AutBWInt-
		LnkSta:	Speed 8GT/s, Width x8, TrErr- Train- SlotClk+ DLActive- BWMgmt- ABWMgmt-
		DevCap2: Completion Timeout: Range ABCD, TimeoutDis+, LTR-, OBFF Not Supported
		DevCtl2: Completion Timeout: 50us to 50ms, TimeoutDis-, LTR-, OBFF Disabled
		LnkSta2: Current De-emphasis Level: -3.5dB, EqualizationComplete-, EqualizationPhase1-
			 EqualizationPhase2-, EqualizationPhase3-, LinkEqualizationRequest-
	Capabilities: [b0] MSI-X: Enable- Count=64 Masked-
		Vector table: BAR=5 offset=0013d000
		PBA: BAR=5 offset=0013dff0
	Capabilities: [c0] Vital Product Data
		Product Name: Annapurna Labs Alpine AL5+
		Read-only fields:
			[PN] Part number: N08AP6VFN008A
			[SN] Serial number: A715041789
			[EC] Engineering changes: 1E
			[V0] Vendor specific: FF
			[V1] Vendor specific: 14:4F:D7:0F:82:39
			[V2] Vendor specific: 14:4F:D7:0F:82:3A
			[V3] Vendor specific: 14:4F:D7:0F:82:3B
			[V4] Vendor specific: 14:4F:D7:0F:82:3C
		End
	Capabilities: [100 v1] Alternative Routing-ID Interpretation (ARI)
		ARICap:	MFVC- ACS-, Next Function: 0
		ARICtl:	MFVC- ACS-, Function Group: 0
	Capabilities: [140 v1] Device Serial Number 9a-bc-de-f0-12-34-56-78
	Capabilities: [150 v1] #19
	Capabilities: [178 v1] Transaction Processing Hints
		Device specific mode supported
		No steering table available
	Capabilities: [200 v2] Advanced Error Reporting
		UESta:	DLP- SDES- TLP- FCP- CmpltTO- CmpltAbrt- UnxCmplt- RxOF- MalfTLP- ECRC- UnsupReq- ACSViol-
		UEMsk:	DLP- SDES- TLP- FCP- CmpltTO- CmpltAbrt- UnxCmplt- RxOF- MalfTLP- ECRC- UnsupReq- ACSViol-
		UESvrt:	DLP+ SDES+ TLP- FCP+ CmpltTO- CmpltAbrt- UnxCmplt- RxOF+ MalfTLP+ ECRC- UnsupReq- ACSViol-
		CESta:	RxErr- BadTLP- BadDLLP- Rollover- Timeout- NonFatalErr-
		CEMsk:	RxErr- BadTLP- BadDLLP- Rollover- Timeout- NonFatalErr+
		AERCap:	First Error Pointer: 00, GenCap+ CGenEn- ChkCap+ ChkEn-

19:58:49.30 PASS: ButterFly1_Ethernet_Ctrl3 PCIe link speed 8
19:58:49.30 PASS: ButterFly1_Ethernet_Ctrl3 PCIe link Width is 8
19:58:49.30 Subsection: ButterFly1_Ethernet_Ctrl1 Speed and Width Check
19:58:49.30 Send = lspci -s 5e:00.0 -vvn
19:58:49.30 Rece = 
5e:00.0 0200: 1c36:1022
	Subsystem: 0102:abce
	Control: I/O- Mem+ BusMaster+ SpecCycle- MemWINV- VGASnoop- ParErr- Stepping- SERR+ FastB2B- DisINTx-
	Status: Cap+ 66MHz- UDF- FastB2B- ParErr- DEVSEL=fast >TAbort- <TAbort- <MAbort- >SERR- <PERR- INTx-
	Latency: 0, Cache Line Size: 32 bytes
	Interrupt: pin A routed to IRQ 11
	NUMA node: 0
	Region 0: Memory at a2024000 (64-bit, non-prefetchable) [size=16K]
	Region 4: Memory at 98000000 (32-bit, non-prefetchable) [size=64M]
	Region 5: Memory at a0000000 (32-bit, non-prefetchable) [size=32M]
	Expansion ROM at a2000000 [disabled] [size=128K]
	Capabilities: [40] Power Management version 3
		Flags: PMEClk- DSI- D1- D2- AuxCurrent=375mA PME(D0+,D1-,D2-,D3hot-,D3cold-)
		Status: D0 NoSoftRst- PME-Enable- DSel=0 DScale=0 PME-
	Capabilities: [70] Express (v2) Endpoint, MSI 00
		DevCap:	MaxPayload 256 bytes, PhantFunc 0, Latency L0s <1us, L1 <8us
			ExtTag- AttnBtn- AttnInd- PwrInd- RBE+ FLReset+ SlotPowerLimit 75.000W
		DevCtl:	Report errors: Correctable- Non-Fatal- Fatal- Unsupported-
			RlxdOrd+ ExtTag- PhantFunc- AuxPwr- NoSnoop+ FLReset-
			MaxPayload 256 bytes, MaxReadReq 512 bytes
		DevSta:	CorrErr- UncorrErr- FatalErr- UnsuppReq- AuxPwr- TransPend-
		LnkCap:	Port #0, Speed 8GT/s, Width x8, ASPM not supported, Exit Latency L0s <1us, L1 <64us
			ClockPM- Surprise- LLActRep- BwNot- ASPMOptComp+
		LnkCtl:	ASPM Disabled; RCB 64 bytes Disabled- CommClk+
			ExtSynch- ClockPM- AutWidDis- BWInt- AutBWInt-
		LnkSta:	Speed 8GT/s, Width x8, TrErr- Train- SlotClk+ DLActive- BWMgmt- ABWMgmt-
		DevCap2: Completion Timeout: Range ABCD, TimeoutDis+, LTR-, OBFF Not Supported
		DevCtl2: Completion Timeout: 50us to 50ms, TimeoutDis-, LTR-, OBFF Disabled
		LnkCtl2: Target Link Speed: 8GT/s, EnterCompliance- SpeedDis-
			 Transmit Margin: Normal Operating Range, EnterModifiedCompliance- ComplianceSOS-
			 Compliance De-emphasis: -6dB
		LnkSta2: Current De-emphasis Level: -3.5dB, EqualizationComplete+, EqualizationPhase1+
			 EqualizationPhase2+, EqualizationPhase3+, LinkEqualizationRequest-
	Capabilities: [b0] MSI-X: Enable- Count=64 Masked-
		Vector table: BAR=5 offset=0005d000
		PBA: BAR=5 offset=0005dff0
	Capabilities: [c0] Vital Product Data
		Product Name: Annapurna Labs Alpine AL5+
		Read-only fields:
			[PN] Part number: N08AP6VFN008A
			[SN] Serial number: A715041951
			[EC] Engineering changes: 1E
			[V0] Vendor specific: FF
			[V1] Vendor specific: 14:4F:D7:0F:84:7B
			[V2] Vendor specific: 14:4F:D7:0F:84:7C
			[V3] Vendor specific: 14:4F:D7:0F:84:7D
			[V4] Vendor specific: FF:FF:FF:FF:FF:FF
		End
	Capabilities: [100 v1] Alternative Routing-ID Interpretation (ARI)
		ARICap:	MFVC- ACS-, Next Function: 1
		ARICtl:	MFVC- ACS-, Function Group: 0
	Capabilities: [140 v1] Device Serial Number 9a-bc-de-f0-12-34-56-78
	Capabilities: [150 v1] #19
	Capabilities: [178 v1] Transaction Processing Hints
		Device specific mode supported
		No steering table available
	Capabilities: [200 v2] Advanced Error Reporting
		UESta:	DLP- SDES- TLP- FCP- CmpltTO- CmpltAbrt- UnxCmplt- RxOF- MalfTLP- ECRC- UnsupReq- ACSViol-
		UEMsk:	DLP- SDES- TLP- FCP- CmpltTO- CmpltAbrt- UnxCmplt- RxOF- MalfTLP- ECRC- UnsupReq- ACSViol-
		UESvrt:	DLP+ SDES+ TLP- FCP+ CmpltTO- CmpltAbrt- UnxCmplt- RxOF+ MalfTLP+ ECRC- UnsupReq- ACSViol-
		CESta:	RxErr- BadTLP- BadDLLP- Rollover- Timeout- NonFatalErr-
		CEMsk:	RxErr- BadTLP- BadDLLP- Rollover- Timeout- NonFatalErr+
		AERCap:	First Error Pointer: 00, GenCap+ CGenEn- ChkCap+ ChkEn-

19:58:49.33 PASS: ButterFly1_Ethernet_Ctrl1 PCIe link speed 8
19:58:49.33 PASS: ButterFly1_Ethernet_Ctrl1 PCIe link Width is 8
19:58:49.33 Subsection: ButterFly1_Ethernet_Ctrl2 Speed and Width Check
19:58:49.34 Send = lspci -s 5e:00.1 -vvn
19:58:49.34 Rece = 
5e:00.1 0200: 1c36:1022
	Subsystem: 0102:abce
	Control: I/O- Mem+ BusMaster+ SpecCycle- MemWINV- VGASnoop- ParErr- Stepping- SERR+ FastB2B- DisINTx-
	Status: Cap+ 66MHz- UDF- FastB2B- ParErr- DEVSEL=fast >TAbort- <TAbort- <MAbort- >SERR- <PERR- INTx-
	Latency: 0, Cache Line Size: 32 bytes
	Interrupt: pin A routed to IRQ 11
	NUMA node: 0
	Region 0: Memory at a2020000 (64-bit, non-prefetchable) [size=16K]
	Region 5: Memory at 9e000000 (32-bit, non-prefetchable) [size=32M]
	Capabilities: [40] Power Management version 3
		Flags: PMEClk- DSI- D1- D2- AuxCurrent=375mA PME(D0+,D1-,D2-,D3hot-,D3cold-)
		Status: D0 NoSoftRst- PME-Enable- DSel=0 DScale=0 PME-
	Capabilities: [70] Express (v2) Endpoint, MSI 00
		DevCap:	MaxPayload 256 bytes, PhantFunc 0, Latency L0s <1us, L1 <8us
			ExtTag- AttnBtn- AttnInd- PwrInd- RBE+ FLReset+ SlotPowerLimit 75.000W
		DevCtl:	Report errors: Correctable- Non-Fatal- Fatal- Unsupported-
			RlxdOrd+ ExtTag- PhantFunc- AuxPwr- NoSnoop+ FLReset-
			MaxPayload 256 bytes, MaxReadReq 512 bytes
		DevSta:	CorrErr- UncorrErr- FatalErr- UnsuppReq- AuxPwr- TransPend-
		LnkCap:	Port #0, Speed 8GT/s, Width x8, ASPM not supported, Exit Latency L0s <1us, L1 <64us
			ClockPM- Surprise- LLActRep- BwNot- ASPMOptComp+
		LnkCtl:	ASPM Disabled; RCB 64 bytes Disabled- CommClk+
			ExtSynch- ClockPM- AutWidDis- BWInt- AutBWInt-
		LnkSta:	Speed 8GT/s, Width x8, TrErr- Train- SlotClk+ DLActive- BWMgmt- ABWMgmt-
		DevCap2: Completion Timeout: Range ABCD, TimeoutDis+, LTR-, OBFF Not Supported
		DevCtl2: Completion Timeout: 50us to 50ms, TimeoutDis-, LTR-, OBFF Disabled
		LnkSta2: Current De-emphasis Level: -3.5dB, EqualizationComplete-, EqualizationPhase1-
			 EqualizationPhase2-, EqualizationPhase3-, LinkEqualizationRequest-
	Capabilities: [b0] MSI-X: Enable- Count=64 Masked-
		Vector table: BAR=5 offset=0025d000
		PBA: BAR=5 offset=0025dff0
	Capabilities: [c0] Vital Product Data
		Product Name: Annapurna Labs Alpine AL5+
		Read-only fields:
			[PN] Part number: N08AP6VFN008A
			[SN] Serial number: A715041951
			[EC] Engineering changes: 1E
			[V0] Vendor specific: FF
			[V1] Vendor specific: 14:4F:D7:0F:84:7B
			[V2] Vendor specific: 14:4F:D7:0F:84:7C
			[V3] Vendor specific: 14:4F:D7:0F:84:7D
			[V4] Vendor specific: FF:FF:FF:FF:FF:FF
		End
	Capabilities: [100 v1] Alternative Routing-ID Interpretation (ARI)
		ARICap:	MFVC- ACS-, Next Function: 2
		ARICtl:	MFVC- ACS-, Function Group: 0
	Capabilities: [140 v1] Device Serial Number 9a-bc-de-f0-12-34-56-78
	Capabilities: [150 v1] #19
	Capabilities: [178 v1] Transaction Processing Hints
		Device specific mode supported
		No steering table available
	Capabilities: [200 v2] Advanced Error Reporting
		UESta:	DLP- SDES- TLP- FCP- CmpltTO- CmpltAbrt- UnxCmplt- RxOF- MalfTLP- ECRC- UnsupReq- ACSViol-
		UEMsk:	DLP- SDES- TLP- FCP- CmpltTO- CmpltAbrt- UnxCmplt- RxOF- MalfTLP- ECRC- UnsupReq- ACSViol-
		UESvrt:	DLP+ SDES+ TLP- FCP+ CmpltTO- CmpltAbrt- UnxCmplt- RxOF+ MalfTLP+ ECRC- UnsupReq- ACSViol-
		CESta:	RxErr- BadTLP- BadDLLP- Rollover- Timeout- NonFatalErr-
		CEMsk:	RxErr- BadTLP- BadDLLP- Rollover- Timeout- NonFatalErr+
		AERCap:	First Error Pointer: 00, GenCap+ CGenEn- ChkCap+ ChkEn-

19:58:49.37 PASS: ButterFly1_Ethernet_Ctrl2 PCIe link speed 8
19:58:49.37 PASS: ButterFly1_Ethernet_Ctrl2 PCIe link Width is 8
19:58:49.37 Subsection: ButterFly1_Ethernet_Ctrl3 Speed and Width Check
19:58:49.37 Send = lspci -s 5e:00.2 -vvn
19:58:49.37 Rece = 
5e:00.2 0200: 1c36:1001
	Subsystem: 0102:abce
	Control: I/O- Mem- BusMaster- SpecCycle- MemWINV- VGASnoop- ParErr- Stepping- SERR+ FastB2B- DisINTx-
	Status: Cap+ 66MHz- UDF- FastB2B- ParErr- DEVSEL=fast >TAbort- <TAbort- <MAbort- >SERR- <PERR- INTx-
	Interrupt: pin A routed to IRQ 11
	NUMA node: 0
	Region 5: Memory at 9c000000 (32-bit, non-prefetchable) [disabled] [size=32M]
	Capabilities: [40] Power Management version 3
		Flags: PMEClk- DSI- D1- D2- AuxCurrent=375mA PME(D0+,D1-,D2-,D3hot-,D3cold-)
		Status: D0 NoSoftRst- PME-Enable- DSel=0 DScale=0 PME-
	Capabilities: [70] Express (v2) Endpoint, MSI 00
		DevCap:	MaxPayload 256 bytes, PhantFunc 0, Latency L0s <1us, L1 <8us
			ExtTag- AttnBtn- AttnInd- PwrInd- RBE+ FLReset+ SlotPowerLimit 75.000W
		DevCtl:	Report errors: Correctable- Non-Fatal- Fatal- Unsupported-
			RlxdOrd+ ExtTag- PhantFunc- AuxPwr- NoSnoop+ FLReset-
			MaxPayload 256 bytes, MaxReadReq 512 bytes
		DevSta:	CorrErr- UncorrErr- FatalErr- UnsuppReq- AuxPwr- TransPend-
		LnkCap:	Port #0, Speed 8GT/s, Width x8, ASPM not supported, Exit Latency L0s <1us, L1 <64us
			ClockPM- Surprise- LLActRep- BwNot- ASPMOptComp+
		LnkCtl:	ASPM Disabled; RCB 64 bytes Disabled- CommClk+
			ExtSynch- ClockPM- AutWidDis- BWInt- AutBWInt-
		LnkSta:	Speed 8GT/s, Width x8, TrErr- Train- SlotClk+ DLActive- BWMgmt- ABWMgmt-
		DevCap2: Completion Timeout: Range ABCD, TimeoutDis+, LTR-, OBFF Not Supported
		DevCtl2: Completion Timeout: 50us to 50ms, TimeoutDis-, LTR-, OBFF Disabled
		LnkSta2: Current De-emphasis Level: -3.5dB, EqualizationComplete-, EqualizationPhase1-
			 EqualizationPhase2-, EqualizationPhase3-, LinkEqualizationRequest-
	Capabilities: [b0] MSI-X: Enable- Count=64 Masked-
		Vector table: BAR=5 offset=0013d000
		PBA: BAR=5 offset=0013dff0
	Capabilities: [c0] Vital Product Data
		Product Name: Annapurna Labs Alpine AL5+
		Read-only fields:
			[PN] Part number: N08AP6VFN008A
			[SN] Serial number: A715041951
			[EC] Engineering changes: 1E
			[V0] Vendor specific: FF
			[V1] Vendor specific: 14:4F:D7:0F:84:7B
			[V2] Vendor specific: 14:4F:D7:0F:84:7C
			[V3] Vendor specific: 14:4F:D7:0F:84:7D
			[V4] Vendor specific: FF:FF:FF:FF:FF:FF
		End
	Capabilities: [100 v1] Alternative Routing-ID Interpretation (ARI)
		ARICap:	MFVC- ACS-, Next Function: 0
		ARICtl:	MFVC- ACS-, Function Group: 0
	Capabilities: [140 v1] Device Serial Number 9a-bc-de-f0-12-34-56-78
	Capabilities: [150 v1] #19
	Capabilities: [178 v1] Transaction Processing Hints
		Device specific mode supported
		No steering table available
	Capabilities: [200 v2] Advanced Error Reporting
		UESta:	DLP- SDES- TLP- FCP- CmpltTO- CmpltAbrt- UnxCmplt- RxOF- MalfTLP- ECRC- UnsupReq- ACSViol-
		UEMsk:	DLP- SDES- TLP- FCP- CmpltTO- CmpltAbrt- UnxCmplt- RxOF- MalfTLP- ECRC- UnsupReq- ACSViol-
		UESvrt:	DLP+ SDES+ TLP- FCP+ CmpltTO- CmpltAbrt- UnxCmplt- RxOF+ MalfTLP+ ECRC- UnsupReq- ACSViol-
		CESta:	RxErr- BadTLP- BadDLLP- Rollover- Timeout- NonFatalErr-
		CEMsk:	RxErr- BadTLP- BadDLLP- Rollover- Timeout- NonFatalErr+
		AERCap:	First Error Pointer: 00, GenCap+ CGenEn- ChkCap+ ChkEn-

19:58:49.40 PASS: ButterFly1_Ethernet_Ctrl3 PCIe link speed 8
19:58:49.40 PASS: ButterFly1_Ethernet_Ctrl3 PCIe link Width is 8
19:58:49.40 Subsection: ButterFly1_Ethernet_Ctrl3 Speed and Width Check
19:58:49.40 Send = lspci -s 5f:00.0 -vvn
19:58:49.40 Rece = 
5f:00.0 0200: 1c36:8889
	Subsystem: 0102:abce
	Control: I/O- Mem- BusMaster- SpecCycle- MemWINV- VGASnoop- ParErr- Stepping- SERR+ FastB2B- DisINTx-
	Status: Cap+ 66MHz- UDF- FastB2B- ParErr- DEVSEL=fast >TAbort- <TAbort- <MAbort- >SERR- <PERR- INTx-
	Interrupt: pin A routed to IRQ 11
	NUMA node: 0
	Region 0: Memory at 96004000 (64-bit, non-prefetchable) [disabled] [size=16K]
	Region 4: Memory at 8c000000 (32-bit, non-prefetchable) [disabled] [size=64M]
	Region 5: Memory at 94000000 (32-bit, non-prefetchable) [disabled] [size=32M]
	Capabilities: [40] Power Management version 3
		Flags: PMEClk- DSI- D1- D2- AuxCurrent=375mA PME(D0+,D1-,D2-,D3hot-,D3cold-)
		Status: D0 NoSoftRst- PME-Enable- DSel=0 DScale=0 PME-
	Capabilities: [70] Express (v2) Endpoint, MSI 00
		DevCap:	MaxPayload 256 bytes, PhantFunc 0, Latency L0s <1us, L1 <8us
			ExtTag- AttnBtn- AttnInd- PwrInd- RBE+ FLReset+ SlotPowerLimit 75.000W
		DevCtl:	Report errors: Correctable- Non-Fatal- Fatal- Unsupported-
			RlxdOrd+ ExtTag- PhantFunc- AuxPwr- NoSnoop+ FLReset-
			MaxPayload 256 bytes, MaxReadReq 512 bytes
		DevSta:	CorrErr- UncorrErr- FatalErr- UnsuppReq- AuxPwr- TransPend-
		LnkCap:	Port #0, Speed 8GT/s, Width x8, ASPM not supported, Exit Latency L0s <1us, L1 <64us
			ClockPM- Surprise- LLActRep- BwNot- ASPMOptComp+
		LnkCtl:	ASPM Disabled; RCB 64 bytes Disabled- CommClk+
			ExtSynch- ClockPM- AutWidDis- BWInt- AutBWInt-
		LnkSta:	Speed 8GT/s, Width x8, TrErr- Train- SlotClk+ DLActive- BWMgmt- ABWMgmt-
		DevCap2: Completion Timeout: Range ABCD, TimeoutDis+, LTR-, OBFF Not Supported
		DevCtl2: Completion Timeout: 50us to 50ms, TimeoutDis-, LTR-, OBFF Disabled
		LnkCtl2: Target Link Speed: 8GT/s, EnterCompliance- SpeedDis-
			 Transmit Margin: Normal Operating Range, EnterModifiedCompliance- ComplianceSOS-
			 Compliance De-emphasis: -6dB
		LnkSta2: Current De-emphasis Level: -3.5dB, EqualizationComplete+, EqualizationPhase1+
			 EqualizationPhase2+, EqualizationPhase3+, LinkEqualizationRequest-
	Capabilities: [b0] MSI-X: Enable- Count=64 Masked-
		Vector table: BAR=5 offset=0005d000
		PBA: BAR=5 offset=0005dff0
	Capabilities: [c0] Vital Product Data
		Product Name: Annapurna Labs Alpine AL5+
		Read-only fields:
			[PN] Part number: N08AP6VFN008A
			[SN] Serial number: A715041951
			[EC] Engineering changes: 1E
			[V0] Vendor specific: FF
			[V1] Vendor specific: 14:4F:D7:0F:84:7E
			[V2] Vendor specific: 14:4F:D7:0F:84:7F
			[V3] Vendor specific: 14:4F:D7:0F:84:80
			[V4] Vendor specific: 14:4F:D7:0F:84:81
		End
	Capabilities: [100 v1] Alternative Routing-ID Interpretation (ARI)
		ARICap:	MFVC- ACS-, Next Function: 1
		ARICtl:	MFVC- ACS-, Function Group: 0
	Capabilities: [140 v1] Device Serial Number 9a-bc-de-f0-12-34-56-78
	Capabilities: [150 v1] #19
	Capabilities: [178 v1] Transaction Processing Hints
		Device specific mode supported
		No steering table available
	Capabilities: [200 v2] Advanced Error Reporting
		UESta:	DLP- SDES- TLP- FCP- CmpltTO- CmpltAbrt- UnxCmplt- RxOF- MalfTLP- ECRC- UnsupReq- ACSViol-
		UEMsk:	DLP- SDES- TLP- FCP- CmpltTO- CmpltAbrt- UnxCmplt- RxOF- MalfTLP- ECRC- UnsupReq- ACSViol-
		UESvrt:	DLP+ SDES+ TLP- FCP+ CmpltTO- CmpltAbrt- UnxCmplt- RxOF+ MalfTLP+ ECRC- UnsupReq- ACSViol-
		CESta:	RxErr- BadTLP- BadDLLP- Rollover- Timeout- NonFatalErr-
		CEMsk:	RxErr- BadTLP- BadDLLP- Rollover- Timeout- NonFatalErr+
		AERCap:	First Error Pointer: 00, GenCap+ CGenEn- ChkCap+ ChkEn-

19:58:49.43 PASS: ButterFly1_Ethernet_Ctrl3 PCIe link speed 8
19:58:49.43 PASS: ButterFly1_Ethernet_Ctrl3 PCIe link Width is 8
19:58:49.43 Subsection: ButterFly1_Ethernet_Ctrl3 Speed and Width Check
19:58:49.44 Send = lspci -s 5f:00.1 -vvn
19:58:49.44 Rece = 
5f:00.1 0200: 1c36:8889
	Subsystem: 0102:abce
	Control: I/O- Mem- BusMaster- SpecCycle- MemWINV- VGASnoop- ParErr- Stepping- SERR+ FastB2B- DisINTx-
	Status: Cap+ 66MHz- UDF- FastB2B- ParErr- DEVSEL=fast >TAbort- <TAbort- <MAbort- >SERR- <PERR- INTx-
	Interrupt: pin A routed to IRQ 11
	NUMA node: 0
	Region 0: Memory at 96000000 (64-bit, non-prefetchable) [disabled] [size=16K]
	Region 5: Memory at 92000000 (32-bit, non-prefetchable) [disabled] [size=32M]
	Capabilities: [40] Power Management version 3
		Flags: PMEClk- DSI- D1- D2- AuxCurrent=375mA PME(D0+,D1-,D2-,D3hot-,D3cold-)
		Status: D0 NoSoftRst- PME-Enable- DSel=0 DScale=0 PME-
	Capabilities: [70] Express (v2) Endpoint, MSI 00
		DevCap:	MaxPayload 256 bytes, PhantFunc 0, Latency L0s <1us, L1 <8us
			ExtTag- AttnBtn- AttnInd- PwrInd- RBE+ FLReset+ SlotPowerLimit 75.000W
		DevCtl:	Report errors: Correctable- Non-Fatal- Fatal- Unsupported-
			RlxdOrd+ ExtTag- PhantFunc- AuxPwr- NoSnoop+ FLReset-
			MaxPayload 256 bytes, MaxReadReq 512 bytes
		DevSta:	CorrErr- UncorrErr- FatalErr- UnsuppReq- AuxPwr- TransPend-
		LnkCap:	Port #0, Speed 8GT/s, Width x8, ASPM not supported, Exit Latency L0s <1us, L1 <64us
			ClockPM- Surprise- LLActRep- BwNot- ASPMOptComp+
		LnkCtl:	ASPM Disabled; RCB 64 bytes Disabled- CommClk+
			ExtSynch- ClockPM- AutWidDis- BWInt- AutBWInt-
		LnkSta:	Speed 8GT/s, Width x8, TrErr- Train- SlotClk+ DLActive- BWMgmt- ABWMgmt-
		DevCap2: Completion Timeout: Range ABCD, TimeoutDis+, LTR-, OBFF Not Supported
		DevCtl2: Completion Timeout: 50us to 50ms, TimeoutDis-, LTR-, OBFF Disabled
		LnkSta2: Current De-emphasis Level: -3.5dB, EqualizationComplete-, EqualizationPhase1-
			 EqualizationPhase2-, EqualizationPhase3-, LinkEqualizationRequest-
	Capabilities: [b0] MSI-X: Enable- Count=64 Masked-
		Vector table: BAR=5 offset=0025d000
		PBA: BAR=5 offset=0025dff0
	Capabilities: [c0] Vital Product Data
		Product Name: Annapurna Labs Alpine AL5+
		Read-only fields:
			[PN] Part number: N08AP6VFN008A
			[SN] Serial number: A715041951
			[EC] Engineering changes: 1E
			[V0] Vendor specific: FF
			[V1] Vendor specific: 14:4F:D7:0F:84:7E
			[V2] Vendor specific: 14:4F:D7:0F:84:7F
			[V3] Vendor specific: 14:4F:D7:0F:84:80
			[V4] Vendor specific: 14:4F:D7:0F:84:81
		End
	Capabilities: [100 v1] Alternative Routing-ID Interpretation (ARI)
		ARICap:	MFVC- ACS-, Next Function: 2
		ARICtl:	MFVC- ACS-, Function Group: 0
	Capabilities: [140 v1] Device Serial Number 9a-bc-de-f0-12-34-56-78
	Capabilities: [150 v1] #19
	Capabilities: [178 v1] Transaction Processing Hints
		Device specific mode supported
		No steering table available
	Capabilities: [200 v2] Advanced Error Reporting
		UESta:	DLP- SDES- TLP- FCP- CmpltTO- CmpltAbrt- UnxCmplt- RxOF- MalfTLP- ECRC- UnsupReq- ACSViol-
		UEMsk:	DLP- SDES- TLP- FCP- CmpltTO- CmpltAbrt- UnxCmplt- RxOF- MalfTLP- ECRC- UnsupReq- ACSViol-
		UESvrt:	DLP+ SDES+ TLP- FCP+ CmpltTO- CmpltAbrt- UnxCmplt- RxOF+ MalfTLP+ ECRC- UnsupReq- ACSViol-
		CESta:	RxErr- BadTLP- BadDLLP- Rollover- Timeout- NonFatalErr-
		CEMsk:	RxErr- BadTLP- BadDLLP- Rollover- Timeout- NonFatalErr+
		AERCap:	First Error Pointer: 00, GenCap+ CGenEn- ChkCap+ ChkEn-

19:58:49.47 PASS: ButterFly1_Ethernet_Ctrl3 PCIe link speed 8
19:58:49.47 PASS: ButterFly1_Ethernet_Ctrl3 PCIe link Width is 8
19:58:49.47 Subsection: ButterFly1_Ethernet_Ctrl3 Speed and Width Check
19:58:49.47 Send = lspci -s 5f:00.2 -vvn
19:58:49.47 Rece = 
5f:00.2 0200: 1c36:1001
	Subsystem: 0102:abce
	Control: I/O- Mem- BusMaster- SpecCycle- MemWINV- VGASnoop- ParErr- Stepping- SERR+ FastB2B- DisINTx-
	Status: Cap+ 66MHz- UDF- FastB2B- ParErr- DEVSEL=fast >TAbort- <TAbort- <MAbort- >SERR- <PERR- INTx-
	Interrupt: pin A routed to IRQ 11
	NUMA node: 0
	Region 5: Memory at 90000000 (32-bit, non-prefetchable) [disabled] [size=32M]
	Capabilities: [40] Power Management version 3
		Flags: PMEClk- DSI- D1- D2- AuxCurrent=375mA PME(D0+,D1-,D2-,D3hot-,D3cold-)
		Status: D0 NoSoftRst- PME-Enable- DSel=0 DScale=0 PME-
	Capabilities: [70] Express (v2) Endpoint, MSI 00
		DevCap:	MaxPayload 256 bytes, PhantFunc 0, Latency L0s <1us, L1 <8us
			ExtTag- AttnBtn- AttnInd- PwrInd- RBE+ FLReset+ SlotPowerLimit 75.000W
		DevCtl:	Report errors: Correctable- Non-Fatal- Fatal- Unsupported-
			RlxdOrd+ ExtTag- PhantFunc- AuxPwr- NoSnoop+ FLReset-
			MaxPayload 256 bytes, MaxReadReq 512 bytes
		DevSta:	CorrErr- UncorrErr- FatalErr- UnsuppReq- AuxPwr- TransPend-
		LnkCap:	Port #0, Speed 8GT/s, Width x8, ASPM not supported, Exit Latency L0s <1us, L1 <64us
			ClockPM- Surprise- LLActRep- BwNot- ASPMOptComp+
		LnkCtl:	ASPM Disabled; RCB 64 bytes Disabled- CommClk+
			ExtSynch- ClockPM- AutWidDis- BWInt- AutBWInt-
		LnkSta:	Speed 8GT/s, Width x8, TrErr- Train- SlotClk+ DLActive- BWMgmt- ABWMgmt-
		DevCap2: Completion Timeout: Range ABCD, TimeoutDis+, LTR-, OBFF Not Supported
		DevCtl2: Completion Timeout: 50us to 50ms, TimeoutDis-, LTR-, OBFF Disabled
		LnkSta2: Current De-emphasis Level: -3.5dB, EqualizationComplete-, EqualizationPhase1-
			 EqualizationPhase2-, EqualizationPhase3-, LinkEqualizationRequest-
	Capabilities: [b0] MSI-X: Enable- Count=64 Masked-
		Vector table: BAR=5 offset=0013d000
		PBA: BAR=5 offset=0013dff0
	Capabilities: [c0] Vital Product Data
		Product Name: Annapurna Labs Alpine AL5+
		Read-only fields:
			[PN] Part number: N08AP6VFN008A
			[SN] Serial number: A715041951
			[EC] Engineering changes: 1E
			[V0] Vendor specific: FF
			[V1] Vendor specific: 14:4F:D7:0F:84:7E
			[V2] Vendor specific: 14:4F:D7:0F:84:7F
			[V3] Vendor specific: 14:4F:D7:0F:84:80
			[V4] Vendor specific: 14:4F:D7:0F:84:81
		End
	Capabilities: [100 v1] Alternative Routing-ID Interpretation (ARI)
		ARICap:	MFVC- ACS-, Next Function: 0
		ARICtl:	MFVC- ACS-, Function Group: 0
	Capabilities: [140 v1] Device Serial Number 9a-bc-de-f0-12-34-56-78
	Capabilities: [150 v1] #19
	Capabilities: [178 v1] Transaction Processing Hints
		Device specific mode supported
		No steering table available
	Capabilities: [200 v2] Advanced Error Reporting
		UESta:	DLP- SDES- TLP- FCP- CmpltTO- CmpltAbrt- UnxCmplt- RxOF- MalfTLP- ECRC- UnsupReq- ACSViol-
		UEMsk:	DLP- SDES- TLP- FCP- CmpltTO- CmpltAbrt- UnxCmplt- RxOF- MalfTLP- ECRC- UnsupReq- ACSViol-
		UESvrt:	DLP+ SDES+ TLP- FCP+ CmpltTO- CmpltAbrt- UnxCmplt- RxOF+ MalfTLP+ ECRC- UnsupReq- ACSViol-
		CESta:	RxErr- BadTLP- BadDLLP- Rollover- Timeout- NonFatalErr-
		CEMsk:	RxErr- BadTLP- BadDLLP- Rollover- Timeout- NonFatalErr+
		AERCap:	First Error Pointer: 00, GenCap+ CGenEn- ChkCap+ ChkEn-

19:58:49.50 PASS: ButterFly1_Ethernet_Ctrl3 PCIe link speed 8
19:58:49.50 PASS: ButterFly1_Ethernet_Ctrl3 PCIe link Width is 8
19:58:49.50 Tester Chk => OK: PCIe Devices Link Speed and Width Verified
19:58:49.50 ##############################################################
19:58:49.50 Section: Bmc Sel Check
19:58:49.50 Send = ipmitool sel elist
19:58:49.50 Rece = 
   1 |  Pre-Init  |0028107880| Event Logging Disabled SYSTEM_EVENT_LOG | Log area reset/cleared | Asserted
   2 |  Pre-Init  |0028107881| OEM record d0 | 000001 | 030000000000
   3 | 01/01/2000 | 00:20:29 | Management Subsystem Health BMC_INIT | Controller access degraded or unavailable | Deasserted
   4 | 01/01/2000 | 00:20:30 | Unknown H20_CABLE_BROKEN | Predictive Failure Asserted | Asserted
   5 | 01/01/2000 | 00:20:30 | Unknown H20_LEAK | Predictive Failure Asserted | Asserted
   6 | 01/01/2000 | 00:20:30 | Cooling Device CPU0_PUMP_RPM_0 | Lower Critical going low  | Asserted | Reading 0 < Threshold 1001 RPM
   7 | 01/01/2000 | 00:20:30 | Cooling Device CPU0_PUMP_RPM_1 | Lower Critical going low  | Asserted | Reading 0 < Threshold 1001 RPM
   8 | 01/01/2000 | 00:20:31 | Cooling Device CPU1_PUMP_RPM_0 | Lower Critical going low  | Asserted | Reading 0 < Threshold 1001 RPM
   9 | 01/01/2000 | 00:20:31 | Cooling Device CPU1_PUMP_RPM_1 | Lower Critical going low  | Asserted | Reading 0 < Threshold 1001 RPM
   a | 01/01/2000 | 00:20:32 | Fan SYS_FAN_8A | Lower Critical going low  | Asserted | Reading 0 < Threshold 1001 RPM
   b | 01/01/2000 | 00:20:32 | Fan SYS_FAN_8B | Lower Critical going low  | Asserted | Reading 0 < Threshold 1001 RPM
   c | 01/01/2000 | 00:20:32 | Power Supply PDB_HSC_0_STATUS | Predictive failure | Asserted
   d | 01/01/2000 | 00:20:32 | Processor BMC_CPU_Util | Upper Non-critical going high | Asserted | Reading 91 > Threshold 85 percent
   e | 01/01/2000 | 00:20:39 | Cooling Device CPU0_PUMP_RPM_0 | Lower Critical going low  | Deasserted | Reading 13013 < Threshold 1001 RPM
   f | 01/01/2000 | 00:20:39 | Cooling Device CPU0_PUMP_RPM_1 | Lower Critical going low  | Deasserted | Reading 12831 < Threshold 1001 RPM
  10 | 01/01/2000 | 00:20:39 | Cooling Device CPU1_PUMP_RPM_0 | Lower Critical going low  | Deasserted | Reading 13832 < Threshold 1001 RPM
  11 | 01/01/2000 | 00:20:39 | Cooling Device CPU1_PUMP_RPM_1 | Lower Critical going low  | Deasserted | Reading 14014 < Threshold 1001 RPM
  12 | 01/01/2000 | 00:20:40 | Fan SYS_FAN_8A | Lower Critical going low  | Deasserted | Reading 5278 < Threshold 1001 RPM
  13 | 01/01/2000 | 00:20:40 | Fan SYS_FAN_8B | Lower Critical going low  | Deasserted | Reading 5824 < Threshold 1001 RPM
  14 | 01/01/2000 | 00:21:11 | Fan SYS_FAN_10B | Lower Critical going low  | Asserted | Reading 0 < Threshold 1001 RPM
  15 | 01/01/2000 | 00:21:13 | Unknown H20_CABLE_BROKEN | Predictive Failure Deasserted | Asserted
  16 | 01/01/2000 | 00:21:13 | Unknown H20_LEAK | Predictive Failure Deasserted | Asserted
  17 | 01/01/2000 | 00:21:15 | Fan SYS_FAN_10B | Lower Critical going low  | Deasserted | Reading 12922 < Threshold 1001 RPM
  18 | 01/01/2000 | 00:21:23 | OEM record d0 | 000001 | 010000000000
  19 | 01/01/2000 | 00:22:25 | Processor BMC_CPU_Util | Upper Non-critical going low  | Asserted | Reading 40 < Threshold 85 percent
  1a | 01/01/2000 | 00:31:09 | System ACPI Power State ACPI_POWER_STATE | S5/G2: soft-off | Asserted
  1b | 01/01/2000 | 00:31:09 | Microcontroller/Coprocessor #0x16 | Transition to Power Off | Asserted
  1c | 01/01/2000 | 00:31:10 | Power Unit PWR_UNIT_STATUS | Power off/down | Asserted
  1d | 01/01/2000 | 00:32:01 | Management Subsystem Health BMC_INIT | Controller access degraded or unavailable | Deasserted
  1e | 01/01/2000 | 00:32:02 | Cooling Device CPU0_PUMP_RPM_0 | Lower Critical going low  | Asserted | Reading 0 < Threshold 1001 RPM
  1f | 01/01/2000 | 00:32:02 | Processor BMC_CPU_Util | Upper Non-critical going high | Asserted | Reading 92 > Threshold 85 percent
  20 | 01/01/2000 | 00:32:10 | System ACPI Power State ACPI_POWER_STATE | S0/G0: working | Asserted
  21 | 01/01/2000 | 00:32:11 | Cooling Device CPU0_PUMP_RPM_1 | Lower Critical going low  | Asserted | Reading 0 < Threshold 1001 RPM
  22 | 01/01/2000 | 00:32:11 | Cooling Device CPU1_PUMP_RPM_0 | Lower Critical going low  | Asserted | Reading 546 < Threshold 1001 RPM
  23 | 01/01/2000 | 00:32:11 | Cooling Device CPU1_PUMP_RPM_1 | Lower Critical going low  | Asserted | Reading 546 < Threshold 1001 RPM
  24 | 01/01/2000 | 00:32:12 | Microcontroller/Coprocessor #0x16 | Transition to Running | Asserted
  25 | 01/01/2000 | 00:32:12 | Fan SYS_FAN_8A | Lower Critical going low  | Asserted | Reading 0 < Threshold 1001 RPM
  26 | 01/01/2000 | 00:32:12 | Fan SYS_FAN_8B | Lower Critical going low  | Asserted | Reading 0 < Threshold 1001 RPM
  27 | 01/01/2000 | 00:32:23 | System Event TIMESTAMP_SYNC | Timestamp Clock Sync | Asserted
  28 |  Pre-Init  |0028108567| System Event TIMESTAMP_SYNC | Timestamp Clock Sync | Asserted
  29 |  Pre-Init  |0028108594| System ACPI Power State ACPI_POWER_STATE | S5/G2: soft-off | Asserted
  2a |  Pre-Init  |0028108594| Power Unit PWR_UNIT_STATUS | Power off/down | Asserted
  2b |  Pre-Init  |0028108596| OEM record d0 | 000001 | 010000000000
  2c |  Pre-Init  |0028108598| System ACPI Power State ACPI_POWER_STATE | S0/G0: working | Asserted
  2d |  Pre-Init  |0028108633| System Event TIMESTAMP_SYNC | Timestamp Clock Sync | Asserted
  2e |  Pre-Init  |0028108633| System Event TIMESTAMP_SYNC | Timestamp Clock Sync | Asserted
  2f |  Pre-Init  |0028108637| Fan SYS_FAN_10B | Lower Critical going low  | Asserted | Reading 0 < Threshold 1001 RPM
  30 |  Pre-Init  |0028108640| Processor BMC_CPU_Util | Upper Non-critical going low  | Asserted | Reading 49 < Threshold 85 percent
  31 |  Pre-Init  |0028108659| System ACPI Power State ACPI_POWER_STATE | S5/G2: soft-off | Asserted
  32 |  Pre-Init  |0028108659| Power Unit PWR_UNIT_STATUS | Power off/down | Asserted
  33 |  Pre-Init  |0028108663| System ACPI Power State ACPI_POWER_STATE | S0/G0: working | Asserted
  34 |  Pre-Init  |0028108697| System Event TIMESTAMP_SYNC | Timestamp Clock Sync | Asserted
  35 |  Pre-Init  |0028108698| System Event TIMESTAMP_SYNC | Timestamp Clock Sync | Asserted
  36 |  Pre-Init  |0028108737| Fan SYS_FAN_0A | Lower Critical going low  | Asserted | Reading 0 < Threshold 1001 RPM
  37 |  Pre-Init  |0028108737| Fan SYS_FAN_0B | Lower Critical going low  | Asserted | Reading 0 < Threshold 1001 RPM
  38 |  Pre-Init  |0028108737| Fan SYS_FAN_1A | Lower Critical going low  | Asserted | Reading 0 < Threshold 1001 RPM
  39 |  Pre-Init  |0028108737| Fan SYS_FAN_1B | Lower Critical going low  | Asserted | Reading 0 < Threshold 1001 RPM
  3a |  Pre-Init  |0028108737| Fan SYS_FAN_2A | Lower Critical going low  | Asserted | Reading 0 < Threshold 1001 RPM
  3b |  Pre-Init  |0028108737| Fan SYS_FAN_2B | Lower Critical going low  | Asserted | Reading 0 < Threshold 1001 RPM
  3c |  Pre-Init  |0028108738| Fan SYS_FAN_3A | Lower Critical going low  | Asserted | Reading 0 < Threshold 1001 RPM
  3d |  Pre-Init  |0028108738| Fan SYS_FAN_3B | Lower Critical going low  | Asserted | Reading 0 < Threshold 1001 RPM
  3e |  Pre-Init  |0028108738| Fan SYS_FAN_4A | Lower Critical going low  | Asserted | Reading 0 < Threshold 1001 RPM
  3f |  Pre-Init  |0028108738| Fan SYS_FAN_4B | Lower Critical going low  | Asserted | Reading 0 < Threshold 1001 RPM
  40 |  Pre-Init  |0028108738| Fan SYS_FAN_5A | Lower Critical going low  | Asserted | Reading 0 < Threshold 1001 RPM
  41 |  Pre-Init  |0028108738| Fan SYS_FAN_5B | Lower Critical going low  | Asserted | Reading 0 < Threshold 1001 RPM
  42 |  Pre-Init  |0028108738| Fan SYS_FAN_6A | Lower Critical going low  | Asserted | Reading 0 < Threshold 1001 RPM
  43 |  Pre-Init  |0028108738| Fan SYS_FAN_6B | Lower Critical going low  | Asserted | Reading 0 < Threshold 1001 RPM
  44 |  Pre-Init  |0028108739| Fan SYS_FAN_7A | Lower Critical going low  | Asserted | Reading 0 < Threshold 1001 RPM
  45 |  Pre-Init  |0028108739| Fan SYS_FAN_7B | Lower Critical going low  | Asserted | Reading 0 < Threshold 1001 RPM
  46 |  Pre-Init  |0028108739| Fan SYS_FAN_9A | Lower Critical going low  | Asserted | Reading 0 < Threshold 1001 RPM
  47 |  Pre-Init  |0028108739| Fan SYS_FAN_9B | Lower Critical going low  | Asserted | Reading 0 < Threshold 1001 RPM
  48 |  Pre-Init  |0028108739| Fan SYS_FAN_10A | Lower Critical going low  | Asserted | Reading 0 < Threshold 1001 RPM
  49 |  Pre-Init  |0028108745| System Event END_OF_POST | OEM System boot event | Asserted
  4a |  Pre-Init  |0028108746| System Boot Initiated SYSRESTARTCAUSE | System Restart | Asserted
  4b |  Pre-Init  |0028108802| Fan SYS_FAN_10A | Lower Critical going low  | Deasserted | Reading 7917 < Threshold 1001 RPM
  4c |  Pre-Init  |0028108802| Fan SYS_FAN_10B | Lower Critical going low  | Deasserted | Reading 10101 < Threshold 1001 RPM
  4d |  Pre-Init  |0028108803| Cooling Device CPU1_PUMP_RPM_0 | Lower Critical going low  | Deasserted | Reading 5278 < Threshold 1001 RPM
  4e |  Pre-Init  |0028108803| Cooling Device CPU1_PUMP_RPM_1 | Lower Critical going low  | Deasserted | Reading 12831 < Threshold 1001 RPM
  4f |  Pre-Init  |0028108804| Fan SYS_FAN_0A | Lower Critical going low  | Deasserted | Reading 12831 < Threshold 1001 RPM
  50 |  Pre-Init  |0028108804| Fan SYS_FAN_0B | Lower Critical going low  | Deasserted | Reading 13013 < Threshold 1001 RPM
  51 |  Pre-Init  |0028108804| Fan SYS_FAN_1A | Lower Critical going low  | Deasserted | Reading 14196 < Threshold 1001 RPM
  52 |  Pre-Init  |0028108804| Fan SYS_FAN_1B | Lower Critical going low  | Deasserted | Reading 14196 < Threshold 1001 RPM
  53 |  Pre-Init  |0028108805| Fan SYS_FAN_2A | Lower Critical going low  | Deasserted | Reading 13104 < Threshold 1001 RPM
  54 |  Pre-Init  |0028108805| Fan SYS_FAN_2B | Lower Critical going low  | Deasserted | Reading 13468 < Threshold 1001 RPM
  55 |  Pre-Init  |0028108805| Fan SYS_FAN_3A | Lower Critical going low  | Deasserted | Reading 14196 < Threshold 1001 RPM
  56 |  Pre-Init  |0028108805| Fan SYS_FAN_3B | Lower Critical going low  | Deasserted | Reading 14196 < Threshold 1001 RPM
  57 |  Pre-Init  |0028108805| Fan SYS_FAN_4A | Lower Critical going low  | Deasserted | Reading 14014 < Threshold 1001 RPM
  58 |  Pre-Init  |0028108805| Fan SYS_FAN_4B | Lower Critical going low  | Deasserted | Reading 13923 < Threshold 1001 RPM
  59 |  Pre-Init  |0028108806| Fan SYS_FAN_5A | Lower Critical going low  | Deasserted | Reading 14287 < Threshold 1001 RPM
  5a |  Pre-Init  |0028108806| Fan SYS_FAN_5B | Lower Critical going low  | Deasserted | Reading 14287 < Threshold 1001 RPM
  5b |  Pre-Init  |0028108806| Fan SYS_FAN_6A | Lower Critical going low  | Deasserted | Reading 14287 < Threshold 1001 RPM
  5c |  Pre-Init  |0028108806| Fan SYS_FAN_6B | Lower Critical going low  | Deasserted | Reading 14287 < Threshold 1001 RPM
  5d |  Pre-Init  |0028108806| Fan SYS_FAN_7A | Lower Critical going low  | Deasserted | Reading 12831 < Threshold 1001 RPM
  5e |  Pre-Init  |0028108806| Fan SYS_FAN_7B | Lower Critical going low  | Deasserted | Reading 12831 < Threshold 1001 RPM
  5f |  Pre-Init  |0028108807| Fan SYS_FAN_8A | Lower Critical going low  | Deasserted | Reading 13286 < Threshold 1001 RPM
  60 |  Pre-Init  |0028108807| Fan SYS_FAN_8B | Lower Critical going low  | Deasserted | Reading 13286 < Threshold 1001 RPM
  61 |  Pre-Init  |0028108807| Fan SYS_FAN_9A | Lower Critical going low  | Deasserted | Reading 12922 < Threshold 1001 RPM
  62 |  Pre-Init  |0028108807| Fan SYS_FAN_9B | Lower Critical going low  | Deasserted | Reading 12922 < Threshold 1001 RPM
  63 |  Pre-Init  |0028108808| Cooling Device CPU0_PUMP_RPM_0 | Lower Critical going low  | Deasserted | Reading 12922 < Threshold 1001 RPM
  64 |  Pre-Init  |0028108808| Cooling Device CPU0_PUMP_RPM_1 | Lower Critical going low  | Deasserted | Reading 12922 < Threshold 1001 RPM
  65 |  Pre-Init  |0028108928| System ACPI Power State ACPI_POWER_STATE | S5/G2: soft-off | Asserted
  66 |  Pre-Init  |0028108928| Microcontroller/Coprocessor #0x16 | Transition to Power Off | Asserted
  67 |  Pre-Init  |0028108929| Power Unit PWR_UNIT_STATUS | Power off/down | Asserted
  68 |  Pre-Init  |0028108929| Cooling Device CPU0_PUMP_RPM_0 | Lower Critical going low  | Asserted | Reading 0 < Threshold 1001 RPM
  69 | 01/01/2000 | 00:39:14 | Management Subsystem Health BMC_INIT | Controller access degraded or unavailable | Deasserted
  6a | 01/01/2000 | 00:39:15 | Cooling Device CPU0_PUMP_RPM_0 | Lower Critical going low  | Asserted | Reading 0 < Threshold 1001 RPM
  6b | 01/01/2000 | 00:39:15 | Processor BMC_CPU_Util | Upper Non-critical going high | Asserted | Reading 93 > Threshold 85 percent
  6c | 01/01/2000 | 00:39:31 | System ACPI Power State ACPI_POWER_STATE | S0/G0: working | Asserted
  6d | 01/01/2000 | 00:39:32 | Cooling Device CPU0_PUMP_RPM_1 | Lower Critical going low  | Asserted | Reading 0 < Threshold 1001 RPM
  6e | 01/01/2000 | 00:39:33 | Cooling Device CPU1_PUMP_RPM_0 | Lower Critical going low  | Asserted | Reading 0 < Threshold 1001 RPM
  6f | 01/01/2000 | 00:39:33 | Cooling Device CPU1_PUMP_RPM_1 | Lower Critical going low  | Asserted | Reading 0 < Threshold 1001 RPM
  70 | 01/01/2000 | 00:39:33 | Microcontroller/Coprocessor #0x16 | Transition to Running | Asserted
  71 | 01/01/2000 | 00:39:33 | Fan SYS_FAN_8A | Lower Critical going low  | Asserted | Reading 0 < Threshold 1001 RPM
  72 | 01/01/2000 | 00:39:33 | Fan SYS_FAN_8B | Lower Critical going low  | Asserted | Reading 0 < Threshold 1001 RPM
  73 | 01/01/2000 | 00:40:07 | OEM record d0 | 000001 | 010000000000
  74 | 01/01/2000 | 00:40:13 | Fan SYS_FAN_10B | Lower Critical going low  | Asserted | Reading 0 < Threshold 1001 RPM
  75 | 01/01/2000 | 00:40:48 | Fan SYS_FAN_0A | Lower Critical going low  | Asserted | Reading 0 < Threshold 1001 RPM
  76 | 01/01/2000 | 00:40:48 | Fan SYS_FAN_0B | Lower Critical going low  | Asserted | Reading 0 < Threshold 1001 RPM
  77 | 01/01/2000 | 00:40:48 | Fan SYS_FAN_1A | Lower Critical going low  | Asserted | Reading 0 < Threshold 1001 RPM
  78 | 01/01/2000 | 00:40:48 | Fan SYS_FAN_1B | Lower Critical going low  | Asserted | Reading 0 < Threshold 1001 RPM
  79 | 01/01/2000 | 00:40:48 | Fan SYS_FAN_2A | Lower Critical going low  | Asserted | Reading 0 < Threshold 1001 RPM
  7a | 01/01/2000 | 00:40:48 | Fan SYS_FAN_2B | Lower Critical going low  | Asserted | Reading 0 < Threshold 1001 RPM
  7b | 01/01/2000 | 00:40:49 | Fan SYS_FAN_3A | Lower Critical going low  | Asserted | Reading 0 < Threshold 1001 RPM
  7c | 01/01/2000 | 00:40:49 | Fan SYS_FAN_3B | Lower Critical going low  | Asserted | Reading 0 < Threshold 1001 RPM
  7d | 01/01/2000 | 00:40:49 | Fan SYS_FAN_4A | Lower Critical going low  | Asserted | Reading 0 < Threshold 1001 RPM
  7e | 01/01/2000 | 00:40:49 | Fan SYS_FAN_4B | Lower Critical going low  | Asserted | Reading 0 < Threshold 1001 RPM
  7f | 01/01/2000 | 00:40:49 | Fan SYS_FAN_5A | Lower Critical going low  | Asserted | Reading 0 < Threshold 1001 RPM
  80 | 01/01/2000 | 00:40:49 | Fan SYS_FAN_5B | Lower Critical going low  | Asserted | Reading 0 < Threshold 1001 RPM
  81 | 01/01/2000 | 00:40:49 | Fan SYS_FAN_6A | Lower Critical going low  | Asserted | Reading 0 < Threshold 1001 RPM
  82 | 01/01/2000 | 00:40:49 | Fan SYS_FAN_6B | Lower Critical going low  | Asserted | Reading 0 < Threshold 1001 RPM
  83 | 01/01/2000 | 00:40:50 | Fan SYS_FAN_7A | Lower Critical going low  | Asserted | Reading 0 < Threshold 1001 RPM
  84 | 01/01/2000 | 00:40:50 | Fan SYS_FAN_7B | Lower Critical going low  | Asserted | Reading 0 < Threshold 1001 RPM
  85 | 01/01/2000 | 00:40:50 | Fan SYS_FAN_9A | Lower Critical going low  | Asserted | Reading 0 < Threshold 1001 RPM
  86 | 01/01/2000 | 00:40:50 | Fan SYS_FAN_9B | Lower Critical going low  | Asserted | Reading 0 < Threshold 1001 RPM
  87 | 01/01/2000 | 00:40:50 | Fan SYS_FAN_10A | Lower Critical going low  | Asserted | Reading 0 < Threshold 1001 RPM
  88 | 01/01/2000 | 00:40:56 | Processor BMC_CPU_Util | Upper Non-critical going low  | Asserted | Reading 46 < Threshold 85 percent
  89 | 01/01/2000 | 00:44:29 | Management Subsystem Health BMC_INIT | Controller access degraded or unavailable | Deasserted
  8a | 01/01/2000 | 00:44:30 | Cooling Device CPU0_PUMP_RPM_0 | Lower Critical going low  | Asserted | Reading 0 < Threshold 1001 RPM
  8b | 01/01/2000 | 00:44:30 | Processor BMC_CPU_Util | Upper Non-critical going high | Asserted | Reading 92 > Threshold 85 percent
  8c | 01/01/2000 | 00:44:31 | System ACPI Power State ACPI_POWER_STATE | S0/G0: working | Asserted
  8d | 01/01/2000 | 00:44:32 | Cooling Device CPU0_PUMP_RPM_1 | Lower Critical going low  | Asserted | Reading 0 < Threshold 1001 RPM
  8e | 01/01/2000 | 00:44:32 | Cooling Device CPU1_PUMP_RPM_0 | Lower Critical going low  | Asserted | Reading 0 < Threshold 1001 RPM
  8f | 01/01/2000 | 00:44:32 | Cooling Device CPU1_PUMP_RPM_1 | Lower Critical going low  | Asserted | Reading 0 < Threshold 1001 RPM
  90 | 01/01/2000 | 00:44:33 | Microcontroller/Coprocessor #0x16 | Transition to Running | Asserted
  91 | 01/01/2000 | 00:44:33 | Fan SYS_FAN_8A | Lower Critical going low  | Asserted | Reading 0 < Threshold 1001 RPM
  92 | 01/01/2000 | 00:44:33 | Fan SYS_FAN_8B | Lower Critical going low  | Asserted | Reading 0 < Threshold 1001 RPM
  93 | 01/01/2000 | 00:45:11 | Fan SYS_FAN_10B | Lower Critical going low  | Asserted | Reading 0 < Threshold 1001 RPM
  94 | 01/01/2000 | 00:45:22 | OEM record d0 | 000001 | 010000000000
  95 | 01/01/2000 | 00:45:40 | Power Unit PWR_UNIT_STATUS | Power off/down | Asserted
  96 | 01/01/2000 | 00:47:20 | Management Subsystem Health BMC_INIT | Controller access degraded or unavailable | Deasserted
  97 | 01/01/2000 | 00:47:21 | Unknown H20_CABLE_BROKEN | Predictive Failure Asserted | Asserted
  98 | 01/01/2000 | 00:47:21 | Unknown H20_LEAK | Predictive Failure Asserted | Asserted
  99 | 01/01/2000 | 00:47:21 | Cooling Device CPU0_PUMP_RPM_0 | Lower Critical going low  | Asserted | Reading 0 < Threshold 1001 RPM
  9a | 01/01/2000 | 00:47:21 | Processor BMC_CPU_Util | Upper Non-critical going high | Asserted | Reading 92 > Threshold 85 percent
  9b | 01/01/2000 | 00:47:36 | System ACPI Power State ACPI_POWER_STATE | S0/G0: working | Asserted
  9c | 01/01/2000 | 00:47:38 | Cooling Device CPU0_PUMP_RPM_1 | Lower Critical going low  | Asserted | Reading 0 < Threshold 1001 RPM
  9d | 01/01/2000 | 00:47:38 | Cooling Device CPU1_PUMP_RPM_0 | Lower Critical going low  | Asserted | Reading 0 < Threshold 1001 RPM
  9e | 01/01/2000 | 00:47:38 | Cooling Device CPU1_PUMP_RPM_1 | Lower Critical going low  | Asserted | Reading 0 < Threshold 1001 RPM
  9f | 01/01/2000 | 00:47:38 | Microcontroller/Coprocessor #0x16 | Transition to Running | Asserted
  a0 | 01/01/2000 | 00:47:38 | Fan SYS_FAN_8A | Lower Critical going low  | Asserted | Reading 0 < Threshold 1001 RPM
  a1 | 01/01/2000 | 00:47:39 | Fan SYS_FAN_8B | Lower Critical going low  | Asserted | Reading 0 < Threshold 1001 RPM
  a2 | 01/01/2000 | 00:48:12 | OEM record d0 | 000001 | 010000000000
  a3 | 01/01/2000 | 00:48:18 | Fan SYS_FAN_10B | Lower Critical going low  | Asserted | Reading 0 < Threshold 1001 RPM
  a4 | 01/01/2000 | 00:48:53 | Fan SYS_FAN_0A | Lower Critical going low  | Asserted | Reading 0 < Threshold 1001 RPM
  a5 | 01/01/2000 | 00:48:53 | Fan SYS_FAN_1A | Lower Critical going low  | Asserted | Reading 0 < Threshold 1001 RPM
  a6 | 01/01/2000 | 00:48:53 | Fan SYS_FAN_1B | Lower Critical going low  | Asserted | Reading 0 < Threshold 1001 RPM
  a7 | 01/01/2000 | 00:48:53 | Fan SYS_FAN_2A | Lower Critical going low  | Asserted | Reading 0 < Threshold 1001 RPM
  a8 | 01/01/2000 | 00:48:53 | Fan SYS_FAN_2B | Lower Critical going low  | Asserted | Reading 0 < Threshold 1001 RPM
  a9 | 01/01/2000 | 00:48:54 | Fan SYS_FAN_3A | Lower Critical going low  | Asserted | Reading 0 < Threshold 1001 RPM
  aa | 01/01/2000 | 00:48:54 | Fan SYS_FAN_3B | Lower Critical going low  | Asserted | Reading 0 < Threshold 1001 RPM
  ab | 01/01/2000 | 00:48:54 | Fan SYS_FAN_4A | Lower Critical going low  | Asserted | Reading 0 < Threshold 1001 RPM
  ac | 01/01/2000 | 00:48:54 | Fan SYS_FAN_4B | Lower Critical going low  | Asserted | Reading 0 < Threshold 1001 RPM
  ad | 01/01/2000 | 00:48:54 | Fan SYS_FAN_5A | Lower Critical going low  | Asserted | Reading 0 < Threshold 1001 RPM
  ae | 01/01/2000 | 00:48:54 | Fan SYS_FAN_5B | Lower Critical going low  | Asserted | Reading 0 < Threshold 1001 RPM
  af | 01/01/2000 | 00:48:54 | Fan SYS_FAN_6A | Lower Critical going low  | Asserted | Reading 0 < Threshold 1001 RPM
  b0 | 01/01/2000 | 00:48:54 | Fan SYS_FAN_6B | Lower Critical going low  | Asserted | Reading 0 < Threshold 1001 RPM
  b1 | 01/01/2000 | 00:48:55 | Fan SYS_FAN_7A | Lower Critical going low  | Asserted | Reading 0 < Threshold 1001 RPM
  b2 | 01/01/2000 | 00:48:55 | Fan SYS_FAN_7B | Lower Critical going low  | Asserted | Reading 0 < Threshold 1001 RPM
  b3 | 01/01/2000 | 00:48:55 | Fan SYS_FAN_9A | Lower Critical going low  | Asserted | Reading 0 < Threshold 1001 RPM
  b4 | 01/01/2000 | 00:48:55 | Fan SYS_FAN_10A | Lower Critical going low  | Asserted | Reading 0 < Threshold 1001 RPM
  b5 | 01/01/2000 | 00:49:03 | Processor BMC_CPU_Util | Upper Non-critical going low  | Asserted | Reading 47 < Threshold 85 percent
  b6 | 01/01/2000 | 00:49:38 | Fan SYS_FAN_0A | Lower Critical going low  | Deasserted | Reading 11739 < Threshold 1001 RPM
  b7 | 01/01/2000 | 00:49:50 | Fan SYS_FAN_9A | Lower Critical going low  | Deasserted | Reading 8372 < Threshold 1001 RPM
  b8 | 01/01/2000 | 00:51:49 | Management Subsystem Health BMC_INIT | Controller access degraded or unavailable | Deasserted
  b9 | 01/01/2000 | 00:51:50 | Unknown H20_CABLE_BROKEN | Predictive Failure Asserted | Asserted
  ba | 01/01/2000 | 00:51:50 | Unknown H20_LEAK | Predictive Failure Asserted | Asserted
  bb | 01/01/2000 | 00:51:50 | Cooling Device CPU0_PUMP_RPM_0 | Lower Critical going low  | Asserted | Reading 0 < Threshold 1001 RPM
  bc | 01/01/2000 | 00:51:50 | Processor BMC_CPU_Util | Upper Non-critical going high | Asserted | Reading 93 > Threshold 85 percent
  bd | 01/01/2000 | 00:51:58 | System ACPI Power State ACPI_POWER_STATE | S0/G0: working | Asserted
  be | 01/01/2000 | 00:51:59 | Cooling Device CPU0_PUMP_RPM_1 | Lower Critical going low  | Asserted | Reading 0 < Threshold 1001 RPM
  bf | 01/01/2000 | 00:52:00 | Microcontroller/Coprocessor #0x16 | Transition to Running | Asserted
  c0 | 01/01/2000 | 00:52:00 | Fan SYS_FAN_8A | Lower Critical going low  | Asserted | Reading 0 < Threshold 1001 RPM
  c1 | 01/01/2000 | 00:52:00 | Fan SYS_FAN_8B | Lower Critical going low  | Asserted | Reading 0 < Threshold 1001 RPM
  c2 | 01/01/2000 | 00:52:38 | Fan SYS_FAN_10B | Lower Critical going low  | Asserted | Reading 0 < Threshold 1001 RPM
  c3 | 01/01/2000 | 00:52:41 | OEM record d0 | 000001 | 010000000000
  c4 | 01/01/2000 | 00:53:05 | System Event TIMESTAMP_SYNC | Timestamp Clock Sync | Asserted
  c5 |  Pre-Init  |0028109810| System Event TIMESTAMP_SYNC | Timestamp Clock Sync | Asserted
  c6 |  Pre-Init  |0028109819| Fan SYS_FAN_2A | Lower Critical going low  | Asserted | Reading 0 < Threshold 1001 RPM
  c7 |  Pre-Init  |0028109819| Fan SYS_FAN_2B | Lower Critical going low  | Asserted | Reading 0 < Threshold 1001 RPM
  c8 |  Pre-Init  |0028109819| Fan SYS_FAN_3A | Lower Critical going low  | Asserted | Reading 0 < Threshold 1001 RPM
  c9 |  Pre-Init  |0028109819| Fan SYS_FAN_3B | Lower Critical going low  | Asserted | Reading 0 < Threshold 1001 RPM
  ca |  Pre-Init  |0028109819| Fan SYS_FAN_4A | Lower Critical going low  | Asserted | Reading 0 < Threshold 1001 RPM
  cb |  Pre-Init  |0028109820| Fan SYS_FAN_4B | Lower Critical going low  | Asserted | Reading 0 < Threshold 1001 RPM
  cc |  Pre-Init  |0028109820| Fan SYS_FAN_5A | Lower Critical going low  | Asserted | Reading 0 < Threshold 1001 RPM
  cd |  Pre-Init  |0028109820| Fan SYS_FAN_5B | Lower Critical going low  | Asserted | Reading 0 < Threshold 1001 RPM
  ce |  Pre-Init  |0028109820| Fan SYS_FAN_6A | Lower Critical going low  | Asserted | Reading 0 < Threshold 1001 RPM
  cf |  Pre-Init  |0028109820| Fan SYS_FAN_6B | Lower Critical going low  | Asserted | Reading 0 < Threshold 1001 RPM
  d0 |  Pre-Init  |0028109820| Fan SYS_FAN_7A | Lower Critical going low  | Asserted | Reading 0 < Threshold 1001 RPM
  d1 |  Pre-Init  |0028109820| Fan SYS_FAN_7B | Lower Critical going low  | Asserted | Reading 0 < Threshold 1001 RPM
  d2 |  Pre-Init  |0028109821| Fan SYS_FAN_9A | Lower Critical going low  | Asserted | Reading 0 < Threshold 1001 RPM
  d3 |  Pre-Init  |0028109821| Fan SYS_FAN_10A | Lower Critical going low  | Asserted | Reading 0 < Threshold 1001 RPM
  d4 |  Pre-Init  |0028109823| Fan SYS_FAN_9A | Lower Critical going low  | Deasserted | Reading 4732 < Threshold 1001 RPM
  d5 |  Pre-Init  |0028109835| Power Unit PWR_UNIT_STATUS | Power off/down | Asserted
  d6 |  Pre-Init  |0028109835| System ACPI Power State ACPI_POWER_STATE | S5/G2: soft-off | Asserted
  d7 |  Pre-Init  |0028109836| Processor BMC_CPU_Util | Upper Non-critical going low  | Asserted | Reading 55 < Threshold 85 percent
  d8 |  Pre-Init  |0028109840| System ACPI Power State ACPI_POWER_STATE | S0/G0: working | Asserted
  d9 |  Pre-Init  |0028109874| System Event TIMESTAMP_SYNC | Timestamp Clock Sync | Asserted
  da |  Pre-Init  |0028109875| System Event TIMESTAMP_SYNC | Timestamp Clock Sync | Asserted
  db |  Pre-Init  |0028109900| Cooling Device CPU1_PUMP_RPM_0 | Lower Critical going low  | Asserted | Reading 1001 < Threshold 1001 RPM
  dc |  Pre-Init  |0028109901| Cooling Device CPU1_PUMP_RPM_1 | Lower Critical going low  | Asserted | Reading 1001 < Threshold 1001 RPM
  dd |  Pre-Init  |0028109901| Power Unit PWR_UNIT_STATUS | Power off/down | Asserted
  de |  Pre-Init  |0028109901| System ACPI Power State ACPI_POWER_STATE | S5/G2: soft-off | Asserted
  df |  Pre-Init  |0028109905| System ACPI Power State ACPI_POWER_STATE | S0/G0: working | Asserted
  e0 |  Pre-Init  |0028109906| Cooling Device CPU1_PUMP_RPM_0 | Lower Critical going low  | Deasserted | Reading 1183 < Threshold 1001 RPM
  e1 |  Pre-Init  |0028109906| Cooling Device CPU1_PUMP_RPM_1 | Lower Critical going low  | Deasserted | Reading 1183 < Threshold 1001 RPM
  e2 |  Pre-Init  |0028109933| Cooling Device CPU1_PUMP_RPM_0 | Lower Critical going low  | Asserted | Reading 910 < Threshold 1001 RPM
  e3 |  Pre-Init  |0028109933| Cooling Device CPU1_PUMP_RPM_1 | Lower Critical going low  | Asserted | Reading 1001 < Threshold 1001 RPM
  e4 |  Pre-Init  |0028109940| System Event TIMESTAMP_SYNC | Timestamp Clock Sync | Asserted
  e5 |  Pre-Init  |0028109941| System Event TIMESTAMP_SYNC | Timestamp Clock Sync | Asserted
  e6 |  Pre-Init  |0028109978| Fan SYS_FAN_1B | Lower Critical going low  | Asserted | Reading 0 < Threshold 1001 RPM
  e7 |  Pre-Init  |0028109979| Fan SYS_FAN_9A | Lower Critical going low  | Asserted | Reading 0 < Threshold 1001 RPM
  e8 |  Pre-Init  |0028109979| Fan SYS_FAN_9B | Lower Critical going low  | Asserted | Reading 0 < Threshold 1001 RPM
  e9 |  Pre-Init  |0028109992| System Boot Initiated SYSRESTARTCAUSE | System Restart | Asserted
  ea |  Pre-Init  |0028109992| System Event END_OF_POST | OEM System boot event | Asserted
  eb |  Pre-Init  |0028110047| Cooling Device CPU0_PUMP_RPM_1 | Lower Critical going low  | Deasserted | Reading 12467 < Threshold 1001 RPM
  ec |  Pre-Init  |0028110047| Cooling Device CPU1_PUMP_RPM_1 | Lower Critical going low  | Deasserted | Reading 12012 < Threshold 1001 RPM
  ed |  Pre-Init  |0028110048| Fan SYS_FAN_3A | Lower Critical going low  | Deasserted | Reading 2275 < Threshold 1001 RPM
  ee |  Pre-Init  |0028110048| Fan SYS_FAN_3B | Lower Critical going low  | Deasserted | Reading 4823 < Threshold 1001 RPM
  ef |  Pre-Init  |0028110048| Fan SYS_FAN_7A | Lower Critical going low  | Deasserted | Reading 10920 < Threshold 1001 RPM
  f0 |  Pre-Init  |0028110048| Fan SYS_FAN_7B | Lower Critical going low  | Deasserted | Reading 12012 < Threshold 1001 RPM
  f1 |  Pre-Init  |0028110049| Fan SYS_FAN_8A | Lower Critical going low  | Deasserted | Reading 5278 < Threshold 1001 RPM
  f2 |  Pre-Init  |0028110049| Fan SYS_FAN_8B | Lower Critical going low  | Deasserted | Reading 6643 < Threshold 1001 RPM
  f3 |  Pre-Init  |0028110050| Cooling Device CPU0_PUMP_RPM_0 | Lower Critical going low  | Deasserted | Reading 13741 < Threshold 1001 RPM
  f4 |  Pre-Init  |0028110050| Cooling Device CPU1_PUMP_RPM_0 | Lower Critical going low  | Deasserted | Reading 13104 < Threshold 1001 RPM
  f5 |  Pre-Init  |0028110050| Fan SYS_FAN_2A | Lower Critical going low  | Deasserted | Reading 16653 < Threshold 1001 RPM
  f6 |  Pre-Init  |0028110051| Fan SYS_FAN_2B | Lower Critical going low  | Deasserted | Reading 16744 < Threshold 1001 RPM
  f7 |  Pre-Init  |0028110051| Fan SYS_FAN_9A | Lower Critical going low  | Deasserted | Reading 13377 < Threshold 1001 RPM
  f8 |  Pre-Init  |0028110051| Fan SYS_FAN_9B | Lower Critical going low  | Deasserted | Reading 13377 < Threshold 1001 RPM
  f9 |  Pre-Init  |0028110098| Fan SYS_FAN_0A | Lower Critical going low  | Asserted | Reading 0 < Threshold 1001 RPM
  fa |  Pre-Init  |0028110098| Fan SYS_FAN_0B | Lower Critical going low  | Asserted | Reading 0 < Threshold 1001 RPM
19:58:50.66 Total Bmc Log Abnormal Message = 1
19:58:50.66 Fault Message = 1
19:58:50.66 Warning Message = 0
19:58:50.66 Failed Message = 0
19:58:50.66 ##############################################################
19:58:50.66 Section: Bmc Sel Clear
19:58:50.66 Send = ipmitool sel clear
19:58:50.66 Rece = 
Clearing SEL.  Please allow a few seconds to erase.
19:58:50.81 TestChk => PASS: Bmc Sel Clear
19:58:53.06 ##############################################################
Cannonball BFT: PASS
19:58:54.27 Send = shutdown now
19:58:54.27 Rece = 
