                                
                                
Station: localhost.localdomain
Date   : 2000-01-01 14:20:04
Version: V0.0.00(BFT1-EVT)
                                
14:20:04.44 ##############################################################
14:20:04.45 Section: Program BMC MAC and FRU
14:20:04.45 Send = ipmitool raw 0x06 0x52 0x0D 0xA0 0x00 0x1C 0x00 0x14 0x0D 0x4F 0x51 0x2A 0x79 0x00 0x00 0x14 0x0D 0x4F 0x51 0x2A 0x7A 0x00 0x00
14:20:04.45 Rece = 

14:20:04.48 Send = ipmitool mc reset cold
14:20:04.48 Rece = 
Sent cold reset command to MC
14:20:39.54 Send = ipmitool lan print 1
14:20:39.54 Rece = 
Set in Progress         : Set Complete
Auth Type Support       : MD5
Auth Type Enable        : Callback : MD5 
                        : User     : MD5 
                        : Operator : MD5 
                        : Admin    : MD5 
                        : OEM      : MD5 
IP Address Source       : DHCP Address
IP Address              : 0.0.0.0
Subnet Mask             : 0.0.0.0
MAC Address             : 14:0d:4f:51:2a:79
SNMP Community String   : AMI
IP Header               : TTL=0x40 Flags=0x40 Precedence=0x00 TOS=0x10
BMC ARP Control         : ARP Responses Enabled, Gratuitous ARP Disabled
Gratituous ARP Intrvl   : 0.0 seconds
Default Gateway IP      : 0.0.0.0
Default Gateway MAC     : 00:00:00:00:00:00
Backup Gateway IP       : 0.0.0.0
Backup Gateway MAC      : 00:00:00:00:00:00
802.1q VLAN ID          : Disabled
802.1q VLAN Priority    : 0
RMCP+ Cipher Suites     : 0,1,2,3,6,7,8,11,12,15,16,17
Cipher Suite Priv Max   : caaaaaaaaaaaXXX
                        :     X=Cipher Suite Unused
                        :     c=CALLBACK
                        :     u=USER
                        :     o=OPERATOR
                        :     a=ADMIN
                        :     O=OEM
14:20:39.74 Send = ipmitool lan print 8
14:20:39.74 Rece = 
Set in Progress         : Set Complete
Auth Type Support       : MD5 
Auth Type Enable        : Callback : MD5 
                        : User     : MD5 
                        : Operator : MD5 
                        : Admin    : MD5 
                        : OEM      : MD5 
IP Address Source       : DHCP Address
IP Address              : 0.0.0.0
Subnet Mask             : 0.0.0.0
MAC Address             : 14:0d:4f:51:2a:7a
SNMP Community String   : AMI
IP Header               : TTL=0x40 Flags=0x40 Precedence=0x00 TOS=0x10
BMC ARP Control         : ARP Responses Enabled, Gratuitous ARP Disabled
Gratituous ARP Intrvl   : 0.0 seconds
Default Gateway IP      : 0.0.0.0
Default Gateway MAC     : 00:00:00:00:00:00
Backup Gateway IP       : 0.0.0.0
Backup Gateway MAC      : 00:00:00:00:00:00
802.1q VLAN ID          : Disabled
802.1q VLAN Priority    : 0
RMCP+ Cipher Suites     : 0,1,2,3,6,7,8,11,12,15,16,17
Cipher Suite Priv Max   : caaaaaaaaaaaXXX
                        :     X=Cipher Suite Unused
                        :     c=CALLBACK
                        :     u=USER
                        :     o=OPERATOR
                        :     a=ADMIN
                        :     O=OEM
14:20:39.86 Send = ipmitool raw 0x0a 0x12 0x00 0x00 0x00 0x01 0x00 0x00 0x00 0x00 0x00 0x00 0xff
14:20:39.86 Rece = 
 08
14:20:39.90 Send = ipmitool raw 0x0a 0x12 0x01 0x00 0x00 0x01 0x00 0x00 0x00 0x00 0x01 0x00 0xFE 0xC1 0x82 0x00 0x00 0xBD
14:20:39.90 Rece = 
 0d
14:20:39.95 Send = ipmitool raw 0x0a 0x11 0x00 0x00 0x00 0x08
14:20:39.95 Rece = 
 08 01 00 00 00 00 00 00 ff
14:20:39.97 Send = ipmitool raw 0x0a 0x11 0x01 0x00 0x00 0x0D
14:20:39.97 Rece = 
 0d 01 00 00 00 00 01 00 fe c1 82 00 00 bd

14:20:40.00 Tester => OK: Program BMC MAC and FRU
14:20:40.01 ##############################################################
14:20:40.01 Section: USB Check
14:20:40.01 Send = /root/CBFT/tools/storage-tool-64 -pciid 8086:a1af -usbpath 0:2:1.0 -devicecount 1 -action info
14:20:40.01 Rece = 
Storage test tool
Version 2.5 Copyright Flextronics Penang

Device info for /dev/sg0
  Removable
  Host#=0
  Bus#=0
  SCSI Id#=0
  LUN#=0
  Type=0
  Size=15502147584 bytes, 14784.0 MiB, 15.50 GB
  Block device=/dev/sda
  Vendor=Kingston
  Product=DataTraveler 3.0
  Revision=PMAP
  Serial number=9B41D4E08409
  Controller=Intel Corporation Lewisburg USB 3.0 xHCI Controller
  Controller PCI vendorID:deviceID=8086:a1af
  Controller PCI path=0000:00:14.0
  Controller USB path=0:2:1.0
  Controller SCSI path=0:0:0:0
****************************
*** Device count matches ***
****************************
14:20:40.20 Send = /root/CBFT/tools/storage-tool-64 -pciid 8086:a1af -usbpath 0:3:1.0 -devicecount 1 -action info
14:20:40.20 Rece = 
Storage test tool
Version 2.5 Copyright Flextronics Penang

Device info for /dev/sg1
  Removable
  Host#=1
  Bus#=0
  SCSI Id#=0
  LUN#=0
  Type=0
  Size=15502147584 bytes, 14784.0 MiB, 15.50 GB
  Block device=/dev/sdb
  Vendor=Kingston
  Product=DataTraveler 3.0
  Revision=PMAP
  Serial number=4B0184D054C9
  Controller=Intel Corporation Lewisburg USB 3.0 xHCI Controller
  Controller PCI vendorID:deviceID=8086:a1af
  Controller PCI path=0000:00:14.0
  Controller USB path=0:3:1.0
  Controller SCSI path=0:0:0:0
****************************
*** Device count matches ***
****************************
14:20:40.38 Send = /root/CBFT/tools/storage-tool-64 -pciid 8086:a1af -usbpath 0:4:1.0 -devicecount 1 -action info
14:20:40.38 Rece = 
Storage test tool
Version 2.5 Copyright Flextronics Penang

Device info for /dev/sg2
  Removable
  Host#=2
  Bus#=0
  SCSI Id#=0
  LUN#=0
  Type=0
  Size=15502147584 bytes, 14784.0 MiB, 15.50 GB
  Block device=/dev/sdc
  Vendor=Kingston
  Product=DataTraveler 3.0
  Revision=PMAP
  Serial number=0B01244014D9
  Controller=Intel Corporation Lewisburg USB 3.0 xHCI Controller
  Controller PCI vendorID:deviceID=8086:a1af
  Controller PCI path=0000:00:14.0
  Controller USB path=0:4:1.0
  Controller SCSI path=0:0:0:0
****************************
*** Device count matches ***
****************************
14:20:40.54 Tester Chk => OK: USB Verify
14:20:40.54 ##############################################################
14:20:40.54 Subsection: Interpose1_Storage1_Ctrl Speed and Width Check
14:20:40.54 Send = lspci -s 18:00.0 -vvn
14:20:40.54 Rece = 
18:00.0 0180: 1c36:1031 (prog-if 02)
	Subsystem: 0102:abce
	Control: I/O- Mem+ BusMaster+ SpecCycle- MemWINV- VGASnoop- ParErr- Stepping- SERR+ FastB2B- DisINTx-
	Status: Cap+ 66MHz- UDF- FastB2B- ParErr- DEVSEL=fast >TAbort- <TAbort- <MAbort- >SERR- <PERR- INTx-
	Latency: 0, Cache Line Size: 32 bytes
	Interrupt: pin A routed to IRQ 11
	NUMA node: 0
	Region 0: Memory at b8004000 (64-bit, non-prefetchable) [size=16K]
	Region 4: Memory at b0000000 (32-bit, non-prefetchable) [size=64M]
	Region 5: Memory at b6000000 (32-bit, non-prefetchable) [size=32M]
	Capabilities: [40] Power Management version 3
		Flags: PMEClk- DSI- D1- D2- AuxCurrent=375mA PME(D0+,D1-,D2-,D3hot-,D3cold-)
		Status: D0 NoSoftRst- PME-Enable- DSel=0 DScale=0 PME-
	Capabilities: [70] Express (v2) Endpoint, MSI 00
		DevCap:	MaxPayload 256 bytes, PhantFunc 0, Latency L0s <1us, L1 <8us
			ExtTag- AttnBtn- AttnInd- PwrInd- RBE+ FLReset+ SlotPowerLimit 75.000W
		DevCtl:	Report errors: Correctable- Non-Fatal- Fatal- Unsupported-
			RlxdOrd+ ExtTag- PhantFunc- AuxPwr- NoSnoop+ FLReset-
			MaxPayload 256 bytes, MaxReadReq 512 bytes
		DevSta:	CorrErr- UncorrErr- FatalErr- UnsuppReq- AuxPwr- TransPend-
		LnkCap:	Port #0, Speed 8GT/s, Width x8, ASPM not supported, Exit Latency L0s <1us, L1 <64us
			ClockPM- Surprise- LLActRep- BwNot- ASPMOptComp+
		LnkCtl:	ASPM Disabled; RCB 64 bytes Disabled- CommClk+
			ExtSynch- ClockPM- AutWidDis- BWInt- AutBWInt-
		LnkSta:	Speed 8GT/s, Width x8, TrErr- Train- SlotClk+ DLActive- BWMgmt- ABWMgmt-
		DevCap2: Completion Timeout: Range ABCD, TimeoutDis+, LTR-, OBFF Not Supported
		DevCtl2: Completion Timeout: 50us to 50ms, TimeoutDis-, LTR-, OBFF Disabled
		LnkCtl2: Target Link Speed: 8GT/s, EnterCompliance- SpeedDis-
			 Transmit Margin: Normal Operating Range, EnterModifiedCompliance- ComplianceSOS-
			 Compliance De-emphasis: -6dB
		LnkSta2: Current De-emphasis Level: -3.5dB, EqualizationComplete+, EqualizationPhase1+
			 EqualizationPhase2+, EqualizationPhase3+, LinkEqualizationRequest-
	Capabilities: [b0] MSI-X: Enable- Count=64 Masked-
		Vector table: BAR=0 offset=00002000
		PBA: BAR=0 offset=00003000
	Capabilities: [c0] Vital Product Data
		Product Name: Annapurna Labs Alpine AL5+
		Read-only fields:
			[PN] Part number: N08AP2VFN018A
			[SN] Serial number: A715048544
			[EC] Engineering changes: 1D
			[V0] Vendor specific: FF
			[V1] Vendor specific: FF:FF:FF:FF:FF:FF
			[V2] Vendor specific: F0:23:B9:A0:0D:5C
			[V3] Vendor specific: FF:FF:FF:FF:FF:FF
			[V4] Vendor specific: F0:23:B9:A0:0D:5D
		End
	Capabilities: [100 v1] Alternative Routing-ID Interpretation (ARI)
		ARICap:	MFVC- ACS-, Next Function: 1
		ARICtl:	MFVC- ACS-, Function Group: 0
	Capabilities: [140 v1] Device Serial Number 9a-bc-de-f0-12-34-56-78
	Capabilities: [150 v1] #19
	Capabilities: [178 v1] Transaction Processing Hints
		Device specific mode supported
		No steering table available
	Capabilities: [200 v2] Advanced Error Reporting
		UESta:	DLP- SDES- TLP- FCP- CmpltTO- CmpltAbrt- UnxCmplt- RxOF- MalfTLP- ECRC- UnsupReq- ACSViol-
		UEMsk:	DLP- SDES- TLP- FCP- CmpltTO- CmpltAbrt- UnxCmplt- RxOF- MalfTLP- ECRC- UnsupReq- ACSViol-
		UESvrt:	DLP+ SDES+ TLP- FCP+ CmpltTO- CmpltAbrt- UnxCmplt- RxOF+ MalfTLP+ ECRC- UnsupReq- ACSViol-
		CESta:	RxErr- BadTLP- BadDLLP- Rollover- Timeout- NonFatalErr-
		CEMsk:	RxErr- BadTLP- BadDLLP- Rollover- Timeout- NonFatalErr+
		AERCap:	First Error Pointer: 00, GenCap+ CGenEn- ChkCap+ ChkEn-

14:20:40.57 PASS: Interpose1_Storage1_Ctrl PCIe link speed 8
14:20:40.57 PASS: Interpose1_Storage1_Ctrl PCIe link Width is 8
14:20:40.57 Subsection: Interpose1_Storage2_Ctrl Speed and Width Check
14:20:40.58 Send = lspci -s 18:00.1 -vvn
14:20:40.58 Rece = 
18:00.1 0180: 1c36:1031 (prog-if 02)
	Subsystem: 0102:abce
	Control: I/O- Mem+ BusMaster+ SpecCycle- MemWINV- VGASnoop- ParErr- Stepping- SERR+ FastB2B- DisINTx-
	Status: Cap+ 66MHz- UDF- FastB2B- ParErr- DEVSEL=fast >TAbort- <TAbort- <MAbort- >SERR- <PERR- INTx-
	Latency: 0, Cache Line Size: 32 bytes
	Interrupt: pin A routed to IRQ 11
	NUMA node: 0
	Region 0: Memory at b8000000 (64-bit, non-prefetchable) [size=16K]
	Capabilities: [40] Power Management version 3
		Flags: PMEClk- DSI- D1- D2- AuxCurrent=375mA PME(D0+,D1-,D2-,D3hot-,D3cold-)
		Status: D0 NoSoftRst- PME-Enable- DSel=0 DScale=0 PME-
	Capabilities: [70] Express (v2) Endpoint, MSI 00
		DevCap:	MaxPayload 256 bytes, PhantFunc 0, Latency L0s <1us, L1 <8us
			ExtTag- AttnBtn- AttnInd- PwrInd- RBE+ FLReset+ SlotPowerLimit 75.000W
		DevCtl:	Report errors: Correctable- Non-Fatal- Fatal- Unsupported-
			RlxdOrd+ ExtTag- PhantFunc- AuxPwr- NoSnoop+ FLReset-
			MaxPayload 256 bytes, MaxReadReq 512 bytes
		DevSta:	CorrErr- UncorrErr- FatalErr- UnsuppReq- AuxPwr- TransPend-
		LnkCap:	Port #0, Speed 8GT/s, Width x8, ASPM not supported, Exit Latency L0s <1us, L1 <64us
			ClockPM- Surprise- LLActRep- BwNot- ASPMOptComp+
		LnkCtl:	ASPM Disabled; RCB 64 bytes Disabled- CommClk+
			ExtSynch- ClockPM- AutWidDis- BWInt- AutBWInt-
		LnkSta:	Speed 8GT/s, Width x8, TrErr- Train- SlotClk+ DLActive- BWMgmt- ABWMgmt-
		DevCap2: Completion Timeout: Range ABCD, TimeoutDis+, LTR-, OBFF Not Supported
		DevCtl2: Completion Timeout: 50us to 50ms, TimeoutDis-, LTR-, OBFF Disabled
		LnkSta2: Current De-emphasis Level: -3.5dB, EqualizationComplete-, EqualizationPhase1-
			 EqualizationPhase2-, EqualizationPhase3-, LinkEqualizationRequest-
	Capabilities: [b0] MSI-X: Enable- Count=64 Masked-
		Vector table: BAR=0 offset=00002000
		PBA: BAR=0 offset=00003000
	Capabilities: [c0] Vital Product Data
		Product Name: Annapurna Labs Alpine AL5+
		Read-only fields:
			[PN] Part number: N08AP2VFN018A
			[SN] Serial number: A715048544
			[EC] Engineering changes: 1D
			[V0] Vendor specific: FF
			[V1] Vendor specific: FF:FF:FF:FF:FF:FF
			[V2] Vendor specific: F0:23:B9:A0:0D:5C
			[V3] Vendor specific: FF:FF:FF:FF:FF:FF
			[V4] Vendor specific: F0:23:B9:A0:0D:5D
		End
	Capabilities: [100 v1] Alternative Routing-ID Interpretation (ARI)
		ARICap:	MFVC- ACS-, Next Function: 2
		ARICtl:	MFVC- ACS-, Function Group: 0
	Capabilities: [140 v1] Device Serial Number 9a-bc-de-f0-12-34-56-78
	Capabilities: [150 v1] #19
	Capabilities: [178 v1] Transaction Processing Hints
		Device specific mode supported
		No steering table available
	Capabilities: [200 v2] Advanced Error Reporting
		UESta:	DLP- SDES- TLP- FCP- CmpltTO- CmpltAbrt- UnxCmplt- RxOF- MalfTLP- ECRC- UnsupReq- ACSViol-
		UEMsk:	DLP- SDES- TLP- FCP- CmpltTO- CmpltAbrt- UnxCmplt- RxOF- MalfTLP- ECRC- UnsupReq- ACSViol-
		UESvrt:	DLP+ SDES+ TLP- FCP+ CmpltTO- CmpltAbrt- UnxCmplt- RxOF+ MalfTLP+ ECRC- UnsupReq- ACSViol-
		CESta:	RxErr- BadTLP- BadDLLP- Rollover- Timeout- NonFatalErr-
		CEMsk:	RxErr- BadTLP- BadDLLP- Rollover- Timeout- NonFatalErr+
		AERCap:	First Error Pointer: 00, GenCap+ CGenEn- ChkCap+ ChkEn-

14:20:40.61 PASS: Interpose1_Storage2_Ctrl PCIe link speed 8
14:20:40.61 PASS: Interpose1_Storage2_Ctrl PCIe link Width is 8
14:20:40.61 Subsection: Interpose1_Ethernet_Ctrl Speed and Width Check
14:20:40.61 Send = lspci -s 18:00.2 -vvn
14:20:40.61 Rece = 
18:00.2 0200: 1c36:1001
	Subsystem: 0102:abce
	Control: I/O- Mem- BusMaster- SpecCycle- MemWINV- VGASnoop- ParErr- Stepping- SERR+ FastB2B- DisINTx-
	Status: Cap+ 66MHz- UDF- FastB2B- ParErr- DEVSEL=fast >TAbort- <TAbort- <MAbort- >SERR- <PERR- INTx-
	Interrupt: pin A routed to IRQ 11
	NUMA node: 0
	Region 5: Memory at b4000000 (32-bit, non-prefetchable) [disabled] [size=32M]
	Capabilities: [40] Power Management version 3
		Flags: PMEClk- DSI- D1- D2- AuxCurrent=375mA PME(D0+,D1-,D2-,D3hot-,D3cold-)
		Status: D0 NoSoftRst- PME-Enable- DSel=0 DScale=0 PME-
	Capabilities: [70] Express (v2) Endpoint, MSI 00
		DevCap:	MaxPayload 256 bytes, PhantFunc 0, Latency L0s <1us, L1 <8us
			ExtTag- AttnBtn- AttnInd- PwrInd- RBE+ FLReset+ SlotPowerLimit 75.000W
		DevCtl:	Report errors: Correctable- Non-Fatal- Fatal- Unsupported-
			RlxdOrd+ ExtTag- PhantFunc- AuxPwr- NoSnoop+ FLReset-
			MaxPayload 256 bytes, MaxReadReq 512 bytes
		DevSta:	CorrErr- UncorrErr- FatalErr- UnsuppReq- AuxPwr- TransPend-
		LnkCap:	Port #0, Speed 8GT/s, Width x8, ASPM not supported, Exit Latency L0s <1us, L1 <64us
			ClockPM- Surprise- LLActRep- BwNot- ASPMOptComp+
		LnkCtl:	ASPM Disabled; RCB 64 bytes Disabled- CommClk+
			ExtSynch- ClockPM- AutWidDis- BWInt- AutBWInt-
		LnkSta:	Speed 8GT/s, Width x8, TrErr- Train- SlotClk+ DLActive- BWMgmt- ABWMgmt-
		DevCap2: Completion Timeout: Range ABCD, TimeoutDis+, LTR-, OBFF Not Supported
		DevCtl2: Completion Timeout: 50us to 50ms, TimeoutDis-, LTR-, OBFF Disabled
		LnkSta2: Current De-emphasis Level: -3.5dB, EqualizationComplete-, EqualizationPhase1-
			 EqualizationPhase2-, EqualizationPhase3-, LinkEqualizationRequest-
	Capabilities: [b0] MSI-X: Enable- Count=64 Masked-
		Vector table: BAR=5 offset=0013d000
		PBA: BAR=5 offset=0013dff0
	Capabilities: [c0] Vital Product Data
		Product Name: Annapurna Labs Alpine AL5+
		Read-only fields:
			[PN] Part number: N08AP2VFN018A
			[SN] Serial number: A715048544
			[EC] Engineering changes: 1D
			[V0] Vendor specific: FF
			[V1] Vendor specific: FF:FF:FF:FF:FF:FF
			[V2] Vendor specific: F0:23:B9:A0:0D:5C
			[V3] Vendor specific: FF:FF:FF:FF:FF:FF
			[V4] Vendor specific: F0:23:B9:A0:0D:5D
		End
	Capabilities: [100 v1] Alternative Routing-ID Interpretation (ARI)
		ARICap:	MFVC- ACS-, Next Function: 0
		ARICtl:	MFVC- ACS-, Function Group: 0
	Capabilities: [140 v1] Device Serial Number 9a-bc-de-f0-12-34-56-78
	Capabilities: [150 v1] #19
	Capabilities: [178 v1] Transaction Processing Hints
		Device specific mode supported
		No steering table available
	Capabilities: [200 v2] Advanced Error Reporting
		UESta:	DLP- SDES- TLP- FCP- CmpltTO- CmpltAbrt- UnxCmplt- RxOF- MalfTLP- ECRC- UnsupReq- ACSViol-
		UEMsk:	DLP- SDES- TLP- FCP- CmpltTO- CmpltAbrt- UnxCmplt- RxOF- MalfTLP- ECRC- UnsupReq- ACSViol-
		UESvrt:	DLP+ SDES+ TLP- FCP+ CmpltTO- CmpltAbrt- UnxCmplt- RxOF+ MalfTLP+ ECRC- UnsupReq- ACSViol-
		CESta:	RxErr- BadTLP- BadDLLP- Rollover- Timeout- NonFatalErr-
		CEMsk:	RxErr- BadTLP- BadDLLP- Rollover- Timeout- NonFatalErr+
		AERCap:	First Error Pointer: 00, GenCap+ CGenEn- ChkCap+ ChkEn-

14:20:40.63 PASS: Interpose1_Ethernet_Ctrl PCIe link speed 8
14:20:40.63 PASS: Interpose1_Ethernet_Ctrl PCIe link Width is 8
14:20:40.63 Subsection: Interpose2_Storage1_Ctrl Speed and Width Check
14:20:40.64 Send = lspci -s 19:00.0 -vvn
14:20:40.64 Rece = 
19:00.0 0180: 1c36:1031 (prog-if 02)
	Subsystem: 0102:abce
	Control: I/O- Mem+ BusMaster+ SpecCycle- MemWINV- VGASnoop- ParErr- Stepping- SERR+ FastB2B- DisINTx-
	Status: Cap+ 66MHz- UDF- FastB2B- ParErr- DEVSEL=fast >TAbort- <TAbort- <MAbort- >SERR- <PERR- INTx-
	Latency: 0, Cache Line Size: 32 bytes
	Interrupt: pin A routed to IRQ 11
	NUMA node: 0
	Region 0: Memory at ac004000 (64-bit, non-prefetchable) [size=16K]
	Region 4: Memory at a4000000 (32-bit, non-prefetchable) [size=64M]
	Region 5: Memory at aa000000 (32-bit, non-prefetchable) [size=32M]
	Capabilities: [40] Power Management version 3
		Flags: PMEClk- DSI- D1- D2- AuxCurrent=375mA PME(D0+,D1-,D2-,D3hot-,D3cold-)
		Status: D0 NoSoftRst- PME-Enable- DSel=0 DScale=0 PME-
	Capabilities: [70] Express (v2) Endpoint, MSI 00
		DevCap:	MaxPayload 256 bytes, PhantFunc 0, Latency L0s <1us, L1 <8us
			ExtTag- AttnBtn- AttnInd- PwrInd- RBE+ FLReset+ SlotPowerLimit 75.000W
		DevCtl:	Report errors: Correctable- Non-Fatal- Fatal- Unsupported-
			RlxdOrd+ ExtTag- PhantFunc- AuxPwr- NoSnoop+ FLReset-
			MaxPayload 256 bytes, MaxReadReq 512 bytes
		DevSta:	CorrErr- UncorrErr- FatalErr- UnsuppReq- AuxPwr- TransPend-
		LnkCap:	Port #0, Speed 8GT/s, Width x8, ASPM not supported, Exit Latency L0s <1us, L1 <64us
			ClockPM- Surprise- LLActRep- BwNot- ASPMOptComp+
		LnkCtl:	ASPM Disabled; RCB 64 bytes Disabled- CommClk+
			ExtSynch- ClockPM- AutWidDis- BWInt- AutBWInt-
		LnkSta:	Speed 8GT/s, Width x8, TrErr- Train- SlotClk+ DLActive- BWMgmt- ABWMgmt-
		DevCap2: Completion Timeout: Range ABCD, TimeoutDis+, LTR-, OBFF Not Supported
		DevCtl2: Completion Timeout: 50us to 50ms, TimeoutDis-, LTR-, OBFF Disabled
		LnkCtl2: Target Link Speed: 8GT/s, EnterCompliance- SpeedDis-
			 Transmit Margin: Normal Operating Range, EnterModifiedCompliance- ComplianceSOS-
			 Compliance De-emphasis: -6dB
		LnkSta2: Current De-emphasis Level: -3.5dB, EqualizationComplete+, EqualizationPhase1+
			 EqualizationPhase2+, EqualizationPhase3+, LinkEqualizationRequest-
	Capabilities: [b0] MSI-X: Enable- Count=64 Masked-
		Vector table: BAR=0 offset=00002000
		PBA: BAR=0 offset=00003000
	Capabilities: [c0] Vital Product Data
		Product Name: Annapurna Labs Alpine AL5+
		Read-only fields:
			[PN] Part number: N08AP2VFN018A
			[SN] Serial number: A716000269
			[EC] Engineering changes: 1D
			[V0] Vendor specific: FF
			[V1] Vendor specific: FF:FF:FF:FF:FF:FF
			[V2] Vendor specific: F0:23:B9:A1:D9:08
			[V3] Vendor specific: FF:FF:FF:FF:FF:FF
			[V4] Vendor specific: F0:23:B9:A1:D9:09
		End
	Capabilities: [100 v1] Alternative Routing-ID Interpretation (ARI)
		ARICap:	MFVC- ACS-, Next Function: 1
		ARICtl:	MFVC- ACS-, Function Group: 0
	Capabilities: [140 v1] Device Serial Number 9a-bc-de-f0-12-34-56-78
	Capabilities: [150 v1] #19
	Capabilities: [178 v1] Transaction Processing Hints
		Device specific mode supported
		No steering table available
	Capabilities: [200 v2] Advanced Error Reporting
		UESta:	DLP- SDES- TLP- FCP- CmpltTO- CmpltAbrt- UnxCmplt- RxOF- MalfTLP- ECRC- UnsupReq- ACSViol-
		UEMsk:	DLP- SDES- TLP- FCP- CmpltTO- CmpltAbrt- UnxCmplt- RxOF- MalfTLP- ECRC- UnsupReq- ACSViol-
		UESvrt:	DLP+ SDES+ TLP- FCP+ CmpltTO- CmpltAbrt- UnxCmplt- RxOF+ MalfTLP+ ECRC- UnsupReq- ACSViol-
		CESta:	RxErr- BadTLP- BadDLLP- Rollover- Timeout- NonFatalErr-
		CEMsk:	RxErr- BadTLP- BadDLLP- Rollover- Timeout- NonFatalErr+
		AERCap:	First Error Pointer: 00, GenCap+ CGenEn- ChkCap+ ChkEn-

14:20:40.66 PASS: Interpose2_Storage1_Ctrl PCIe link speed 8
14:20:40.66 PASS: Interpose2_Storage1_Ctrl PCIe link Width is 8
14:20:40.66 Subsection: Interpose2_Storage2_Ctrl Speed and Width Check
14:20:40.66 Send = lspci -s 19:00.1 -vvn
14:20:40.66 Rece = 
19:00.1 0180: 1c36:1031 (prog-if 02)
	Subsystem: 0102:abce
	Control: I/O- Mem+ BusMaster+ SpecCycle- MemWINV- VGASnoop- ParErr- Stepping- SERR+ FastB2B- DisINTx-
	Status: Cap+ 66MHz- UDF- FastB2B- ParErr- DEVSEL=fast >TAbort- <TAbort- <MAbort- >SERR- <PERR- INTx-
	Latency: 0, Cache Line Size: 32 bytes
	Interrupt: pin A routed to IRQ 11
	NUMA node: 0
	Region 0: Memory at ac000000 (64-bit, non-prefetchable) [size=16K]
	Capabilities: [40] Power Management version 3
		Flags: PMEClk- DSI- D1- D2- AuxCurrent=375mA PME(D0+,D1-,D2-,D3hot-,D3cold-)
		Status: D0 NoSoftRst- PME-Enable- DSel=0 DScale=0 PME-
	Capabilities: [70] Express (v2) Endpoint, MSI 00
		DevCap:	MaxPayload 256 bytes, PhantFunc 0, Latency L0s <1us, L1 <8us
			ExtTag- AttnBtn- AttnInd- PwrInd- RBE+ FLReset+ SlotPowerLimit 75.000W
		DevCtl:	Report errors: Correctable- Non-Fatal- Fatal- Unsupported-
			RlxdOrd+ ExtTag- PhantFunc- AuxPwr- NoSnoop+ FLReset-
			MaxPayload 256 bytes, MaxReadReq 512 bytes
		DevSta:	CorrErr- UncorrErr- FatalErr- UnsuppReq- AuxPwr- TransPend-
		LnkCap:	Port #0, Speed 8GT/s, Width x8, ASPM not supported, Exit Latency L0s <1us, L1 <64us
			ClockPM- Surprise- LLActRep- BwNot- ASPMOptComp+
		LnkCtl:	ASPM Disabled; RCB 64 bytes Disabled- CommClk+
			ExtSynch- ClockPM- AutWidDis- BWInt- AutBWInt-
		LnkSta:	Speed 8GT/s, Width x8, TrErr- Train- SlotClk+ DLActive- BWMgmt- ABWMgmt-
		DevCap2: Completion Timeout: Range ABCD, TimeoutDis+, LTR-, OBFF Not Supported
		DevCtl2: Completion Timeout: 50us to 50ms, TimeoutDis-, LTR-, OBFF Disabled
		LnkSta2: Current De-emphasis Level: -3.5dB, EqualizationComplete-, EqualizationPhase1-
			 EqualizationPhase2-, EqualizationPhase3-, LinkEqualizationRequest-
	Capabilities: [b0] MSI-X: Enable- Count=64 Masked-
		Vector table: BAR=0 offset=00002000
		PBA: BAR=0 offset=00003000
	Capabilities: [c0] Vital Product Data
		Product Name: Annapurna Labs Alpine AL5+
		Read-only fields:
			[PN] Part number: N08AP2VFN018A
			[SN] Serial number: A716000269
			[EC] Engineering changes: 1D
			[V0] Vendor specific: FF
			[V1] Vendor specific: FF:FF:FF:FF:FF:FF
			[V2] Vendor specific: F0:23:B9:A1:D9:08
			[V3] Vendor specific: FF:FF:FF:FF:FF:FF
			[V4] Vendor specific: F0:23:B9:A1:D9:09
		End
	Capabilities: [100 v1] Alternative Routing-ID Interpretation (ARI)
		ARICap:	MFVC- ACS-, Next Function: 2
		ARICtl:	MFVC- ACS-, Function Group: 0
	Capabilities: [140 v1] Device Serial Number 9a-bc-de-f0-12-34-56-78
	Capabilities: [150 v1] #19
	Capabilities: [178 v1] Transaction Processing Hints
		Device specific mode supported
		No steering table available
	Capabilities: [200 v2] Advanced Error Reporting
		UESta:	DLP- SDES- TLP- FCP- CmpltTO- CmpltAbrt- UnxCmplt- RxOF- MalfTLP- ECRC- UnsupReq- ACSViol-
		UEMsk:	DLP- SDES- TLP- FCP- CmpltTO- CmpltAbrt- UnxCmplt- RxOF- MalfTLP- ECRC- UnsupReq- ACSViol-
		UESvrt:	DLP+ SDES+ TLP- FCP+ CmpltTO- CmpltAbrt- UnxCmplt- RxOF+ MalfTLP+ ECRC- UnsupReq- ACSViol-
		CESta:	RxErr- BadTLP- BadDLLP- Rollover- Timeout- NonFatalErr-
		CEMsk:	RxErr- BadTLP- BadDLLP- Rollover- Timeout- NonFatalErr+
		AERCap:	First Error Pointer: 00, GenCap+ CGenEn- ChkCap+ ChkEn-

14:20:40.69 PASS: Interpose2_Storage2_Ctrl PCIe link speed 8
14:20:40.69 PASS: Interpose2_Storage2_Ctrl PCIe link Width is 8
14:20:40.69 Subsection: Interpose2_Ethernet_Ctrl Speed and Width Check
14:20:40.69 Send = lspci -s 19:00.2 -vvn
14:20:40.69 Rece = 
19:00.2 0200: 1c36:1001
	Subsystem: 0102:abce
	Control: I/O- Mem- BusMaster- SpecCycle- MemWINV- VGASnoop- ParErr- Stepping- SERR+ FastB2B- DisINTx-
	Status: Cap+ 66MHz- UDF- FastB2B- ParErr- DEVSEL=fast >TAbort- <TAbort- <MAbort- >SERR- <PERR- INTx-
	Interrupt: pin A routed to IRQ 11
	NUMA node: 0
	Region 5: Memory at a8000000 (32-bit, non-prefetchable) [disabled] [size=32M]
	Capabilities: [40] Power Management version 3
		Flags: PMEClk- DSI- D1- D2- AuxCurrent=375mA PME(D0+,D1-,D2-,D3hot-,D3cold-)
		Status: D0 NoSoftRst- PME-Enable- DSel=0 DScale=0 PME-
	Capabilities: [70] Express (v2) Endpoint, MSI 00
		DevCap:	MaxPayload 256 bytes, PhantFunc 0, Latency L0s <1us, L1 <8us
			ExtTag- AttnBtn- AttnInd- PwrInd- RBE+ FLReset+ SlotPowerLimit 75.000W
		DevCtl:	Report errors: Correctable- Non-Fatal- Fatal- Unsupported-
			RlxdOrd+ ExtTag- PhantFunc- AuxPwr- NoSnoop+ FLReset-
			MaxPayload 256 bytes, MaxReadReq 512 bytes
		DevSta:	CorrErr- UncorrErr- FatalErr- UnsuppReq- AuxPwr- TransPend-
		LnkCap:	Port #0, Speed 8GT/s, Width x8, ASPM not supported, Exit Latency L0s <1us, L1 <64us
			ClockPM- Surprise- LLActRep- BwNot- ASPMOptComp+
		LnkCtl:	ASPM Disabled; RCB 64 bytes Disabled- CommClk+
			ExtSynch- ClockPM- AutWidDis- BWInt- AutBWInt-
		LnkSta:	Speed 8GT/s, Width x8, TrErr- Train- SlotClk+ DLActive- BWMgmt- ABWMgmt-
		DevCap2: Completion Timeout: Range ABCD, TimeoutDis+, LTR-, OBFF Not Supported
		DevCtl2: Completion Timeout: 50us to 50ms, TimeoutDis-, LTR-, OBFF Disabled
		LnkSta2: Current De-emphasis Level: -3.5dB, EqualizationComplete-, EqualizationPhase1-
			 EqualizationPhase2-, EqualizationPhase3-, LinkEqualizationRequest-
	Capabilities: [b0] MSI-X: Enable- Count=64 Masked-
		Vector table: BAR=5 offset=0013d000
		PBA: BAR=5 offset=0013dff0
	Capabilities: [c0] Vital Product Data
		Product Name: Annapurna Labs Alpine AL5+
		Read-only fields:
			[PN] Part number: N08AP2VFN018A
			[SN] Serial number: A716000269
			[EC] Engineering changes: 1D
			[V0] Vendor specific: FF
			[V1] Vendor specific: FF:FF:FF:FF:FF:FF
			[V2] Vendor specific: F0:23:B9:A1:D9:08
			[V3] Vendor specific: FF:FF:FF:FF:FF:FF
			[V4] Vendor specific: F0:23:B9:A1:D9:09
		End
	Capabilities: [100 v1] Alternative Routing-ID Interpretation (ARI)
		ARICap:	MFVC- ACS-, Next Function: 0
		ARICtl:	MFVC- ACS-, Function Group: 0
	Capabilities: [140 v1] Device Serial Number 9a-bc-de-f0-12-34-56-78
	Capabilities: [150 v1] #19
	Capabilities: [178 v1] Transaction Processing Hints
		Device specific mode supported
		No steering table available
	Capabilities: [200 v2] Advanced Error Reporting
		UESta:	DLP- SDES- TLP- FCP- CmpltTO- CmpltAbrt- UnxCmplt- RxOF- MalfTLP- ECRC- UnsupReq- ACSViol-
		UEMsk:	DLP- SDES- TLP- FCP- CmpltTO- CmpltAbrt- UnxCmplt- RxOF- MalfTLP- ECRC- UnsupReq- ACSViol-
		UESvrt:	DLP+ SDES+ TLP- FCP+ CmpltTO- CmpltAbrt- UnxCmplt- RxOF+ MalfTLP+ ECRC- UnsupReq- ACSViol-
		CESta:	RxErr- BadTLP- BadDLLP- Rollover- Timeout- NonFatalErr-
		CEMsk:	RxErr- BadTLP- BadDLLP- Rollover- Timeout- NonFatalErr+
		AERCap:	First Error Pointer: 00, GenCap+ CGenEn- ChkCap+ ChkEn-

14:20:40.72 PASS: Interpose2_Ethernet_Ctrl PCIe link speed 8
14:20:40.72 PASS: Interpose2_Ethernet_Ctrl PCIe link Width is 8
14:20:40.72 Subsection: Interpose3_Storage1_Ctrl Speed and Width Check
14:20:40.72 Send = lspci -s af:00.0 -vvn
14:20:40.72 Rece = 
af:00.0 0180: 1c36:1031 (prog-if 02)
	Subsystem: 0102:abce
	Control: I/O- Mem+ BusMaster+ SpecCycle- MemWINV- VGASnoop- ParErr- Stepping- SERR+ FastB2B- DisINTx-
	Status: Cap+ 66MHz- UDF- FastB2B- ParErr- DEVSEL=fast >TAbort- <TAbort- <MAbort- >SERR- <PERR- INTx-
	Latency: 0, Cache Line Size: 32 bytes
	Interrupt: pin A routed to IRQ 11
	NUMA node: 1
	Region 0: Memory at f8004000 (64-bit, non-prefetchable) [size=16K]
	Region 4: Memory at f0000000 (32-bit, non-prefetchable) [size=64M]
	Region 5: Memory at f6000000 (32-bit, non-prefetchable) [size=32M]
	Capabilities: [40] Power Management version 3
		Flags: PMEClk- DSI- D1- D2- AuxCurrent=375mA PME(D0+,D1-,D2-,D3hot-,D3cold-)
		Status: D0 NoSoftRst- PME-Enable- DSel=0 DScale=0 PME-
	Capabilities: [70] Express (v2) Endpoint, MSI 00
		DevCap:	MaxPayload 256 bytes, PhantFunc 0, Latency L0s <1us, L1 <8us
			ExtTag- AttnBtn- AttnInd- PwrInd- RBE+ FLReset+ SlotPowerLimit 75.000W
		DevCtl:	Report errors: Correctable- Non-Fatal- Fatal- Unsupported-
			RlxdOrd+ ExtTag- PhantFunc- AuxPwr- NoSnoop+ FLReset-
			MaxPayload 256 bytes, MaxReadReq 512 bytes
		DevSta:	CorrErr- UncorrErr- FatalErr- UnsuppReq- AuxPwr- TransPend-
		LnkCap:	Port #0, Speed 8GT/s, Width x8, ASPM not supported, Exit Latency L0s <1us, L1 <64us
			ClockPM- Surprise- LLActRep- BwNot- ASPMOptComp+
		LnkCtl:	ASPM Disabled; RCB 64 bytes Disabled- CommClk+
			ExtSynch- ClockPM- AutWidDis- BWInt- AutBWInt-
		LnkSta:	Speed 8GT/s, Width x8, TrErr- Train- SlotClk+ DLActive- BWMgmt- ABWMgmt-
		DevCap2: Completion Timeout: Range ABCD, TimeoutDis+, LTR-, OBFF Not Supported
		DevCtl2: Completion Timeout: 50us to 50ms, TimeoutDis-, LTR-, OBFF Disabled
		LnkCtl2: Target Link Speed: 8GT/s, EnterCompliance- SpeedDis-
			 Transmit Margin: Normal Operating Range, EnterModifiedCompliance- ComplianceSOS-
			 Compliance De-emphasis: -6dB
		LnkSta2: Current De-emphasis Level: -3.5dB, EqualizationComplete+, EqualizationPhase1+
			 EqualizationPhase2+, EqualizationPhase3+, LinkEqualizationRequest-
	Capabilities: [b0] MSI-X: Enable- Count=64 Masked-
		Vector table: BAR=0 offset=00002000
		PBA: BAR=0 offset=00003000
	Capabilities: [c0] Vital Product Data
		Product Name: Annapurna Labs Alpine AL5+
		Read-only fields:
			[PN] Part number: N08AP2VFN018A
			[SN] Serial number: A715048199
			[EC] Engineering changes: 1D
			[V0] Vendor specific: FF
			[V1] Vendor specific: FF:FF:FF:FF:FF:FF
			[V2] Vendor specific: 14:4F:D7:0F:FD:A2
			[V3] Vendor specific: FF:FF:FF:FF:FF:FF
			[V4] Vendor specific: 14:4F:D7:0F:FD:A3
		End
	Capabilities: [100 v1] Alternative Routing-ID Interpretation (ARI)
		ARICap:	MFVC- ACS-, Next Function: 1
		ARICtl:	MFVC- ACS-, Function Group: 0
	Capabilities: [140 v1] Device Serial Number 9a-bc-de-f0-12-34-56-78
	Capabilities: [150 v1] #19
	Capabilities: [178 v1] Transaction Processing Hints
		Device specific mode supported
		No steering table available
	Capabilities: [200 v2] Advanced Error Reporting
		UESta:	DLP- SDES- TLP- FCP- CmpltTO- CmpltAbrt- UnxCmplt- RxOF- MalfTLP- ECRC- UnsupReq- ACSViol-
		UEMsk:	DLP- SDES- TLP- FCP- CmpltTO- CmpltAbrt- UnxCmplt- RxOF- MalfTLP- ECRC- UnsupReq- ACSViol-
		UESvrt:	DLP+ SDES+ TLP- FCP+ CmpltTO- CmpltAbrt- UnxCmplt- RxOF+ MalfTLP+ ECRC- UnsupReq- ACSViol-
		CESta:	RxErr- BadTLP- BadDLLP- Rollover- Timeout- NonFatalErr-
		CEMsk:	RxErr- BadTLP- BadDLLP- Rollover- Timeout- NonFatalErr+
		AERCap:	First Error Pointer: 00, GenCap+ CGenEn- ChkCap+ ChkEn-

14:20:40.75 PASS: Interpose3_Storage1_Ctrl PCIe link speed 8
14:20:40.75 PASS: Interpose3_Storage1_Ctrl PCIe link Width is 8
14:20:40.75 Subsection: Interpose3_Storage2_Ctrl Speed and Width Check
14:20:40.76 Send = lspci -s af:00.1 -vvn
14:20:40.76 Rece = 
af:00.1 0180: 1c36:1031 (prog-if 02)
	Subsystem: 0102:abce
	Control: I/O- Mem+ BusMaster+ SpecCycle- MemWINV- VGASnoop- ParErr- Stepping- SERR+ FastB2B- DisINTx-
	Status: Cap+ 66MHz- UDF- FastB2B- ParErr- DEVSEL=fast >TAbort- <TAbort- <MAbort- >SERR- <PERR- INTx-
	Latency: 0, Cache Line Size: 32 bytes
	Interrupt: pin A routed to IRQ 11
	NUMA node: 1
	Region 0: Memory at f8000000 (64-bit, non-prefetchable) [size=16K]
	Capabilities: [40] Power Management version 3
		Flags: PMEClk- DSI- D1- D2- AuxCurrent=375mA PME(D0+,D1-,D2-,D3hot-,D3cold-)
		Status: D0 NoSoftRst- PME-Enable- DSel=0 DScale=0 PME-
	Capabilities: [70] Express (v2) Endpoint, MSI 00
		DevCap:	MaxPayload 256 bytes, PhantFunc 0, Latency L0s <1us, L1 <8us
			ExtTag- AttnBtn- AttnInd- PwrInd- RBE+ FLReset+ SlotPowerLimit 75.000W
		DevCtl:	Report errors: Correctable- Non-Fatal- Fatal- Unsupported-
			RlxdOrd+ ExtTag- PhantFunc- AuxPwr- NoSnoop+ FLReset-
			MaxPayload 256 bytes, MaxReadReq 512 bytes
		DevSta:	CorrErr- UncorrErr- FatalErr- UnsuppReq- AuxPwr- TransPend-
		LnkCap:	Port #0, Speed 8GT/s, Width x8, ASPM not supported, Exit Latency L0s <1us, L1 <64us
			ClockPM- Surprise- LLActRep- BwNot- ASPMOptComp+
		LnkCtl:	ASPM Disabled; RCB 64 bytes Disabled- CommClk+
			ExtSynch- ClockPM- AutWidDis- BWInt- AutBWInt-
		LnkSta:	Speed 8GT/s, Width x8, TrErr- Train- SlotClk+ DLActive- BWMgmt- ABWMgmt-
		DevCap2: Completion Timeout: Range ABCD, TimeoutDis+, LTR-, OBFF Not Supported
		DevCtl2: Completion Timeout: 50us to 50ms, TimeoutDis-, LTR-, OBFF Disabled
		LnkSta2: Current De-emphasis Level: -3.5dB, EqualizationComplete-, EqualizationPhase1-
			 EqualizationPhase2-, EqualizationPhase3-, LinkEqualizationRequest-
	Capabilities: [b0] MSI-X: Enable- Count=64 Masked-
		Vector table: BAR=0 offset=00002000
		PBA: BAR=0 offset=00003000
	Capabilities: [c0] Vital Product Data
		Product Name: Annapurna Labs Alpine AL5+
		Read-only fields:
			[PN] Part number: N08AP2VFN018A
			[SN] Serial number: A715048199
			[EC] Engineering changes: 1D
			[V0] Vendor specific: FF
			[V1] Vendor specific: FF:FF:FF:FF:FF:FF
			[V2] Vendor specific: 14:4F:D7:0F:FD:A2
			[V3] Vendor specific: FF:FF:FF:FF:FF:FF
			[V4] Vendor specific: 14:4F:D7:0F:FD:A3
		End
	Capabilities: [100 v1] Alternative Routing-ID Interpretation (ARI)
		ARICap:	MFVC- ACS-, Next Function: 2
		ARICtl:	MFVC- ACS-, Function Group: 0
	Capabilities: [140 v1] Device Serial Number 9a-bc-de-f0-12-34-56-78
	Capabilities: [150 v1] #19
	Capabilities: [178 v1] Transaction Processing Hints
		Device specific mode supported
		No steering table available
	Capabilities: [200 v2] Advanced Error Reporting
		UESta:	DLP- SDES- TLP- FCP- CmpltTO- CmpltAbrt- UnxCmplt- RxOF- MalfTLP- ECRC- UnsupReq- ACSViol-
		UEMsk:	DLP- SDES- TLP- FCP- CmpltTO- CmpltAbrt- UnxCmplt- RxOF- MalfTLP- ECRC- UnsupReq- ACSViol-
		UESvrt:	DLP+ SDES+ TLP- FCP+ CmpltTO- CmpltAbrt- UnxCmplt- RxOF+ MalfTLP+ ECRC- UnsupReq- ACSViol-
		CESta:	RxErr- BadTLP- BadDLLP- Rollover- Timeout- NonFatalErr-
		CEMsk:	RxErr- BadTLP- BadDLLP- Rollover- Timeout- NonFatalErr+
		AERCap:	First Error Pointer: 00, GenCap+ CGenEn- ChkCap+ ChkEn-

14:20:40.79 PASS: Interpose3_Storage2_Ctrl PCIe link speed 8
14:20:40.79 PASS: Interpose3_Storage2_Ctrl PCIe link Width is 8
14:20:40.79 Subsection: Interpose3_Ethernet_Ctrl Speed and Width Check
14:20:40.79 Send = lspci -s af:00.2 -vvn
14:20:40.79 Rece = 
af:00.2 0200: 1c36:1001
	Subsystem: 0102:abce
	Control: I/O- Mem- BusMaster- SpecCycle- MemWINV- VGASnoop- ParErr- Stepping- SERR+ FastB2B- DisINTx-
	Status: Cap+ 66MHz- UDF- FastB2B- ParErr- DEVSEL=fast >TAbort- <TAbort- <MAbort- >SERR- <PERR- INTx-
	Interrupt: pin A routed to IRQ 11
	NUMA node: 1
	Region 5: Memory at f4000000 (32-bit, non-prefetchable) [disabled] [size=32M]
	Capabilities: [40] Power Management version 3
		Flags: PMEClk- DSI- D1- D2- AuxCurrent=375mA PME(D0+,D1-,D2-,D3hot-,D3cold-)
		Status: D0 NoSoftRst- PME-Enable- DSel=0 DScale=0 PME-
	Capabilities: [70] Express (v2) Endpoint, MSI 00
		DevCap:	MaxPayload 256 bytes, PhantFunc 0, Latency L0s <1us, L1 <8us
			ExtTag- AttnBtn- AttnInd- PwrInd- RBE+ FLReset+ SlotPowerLimit 75.000W
		DevCtl:	Report errors: Correctable- Non-Fatal- Fatal- Unsupported-
			RlxdOrd+ ExtTag- PhantFunc- AuxPwr- NoSnoop+ FLReset-
			MaxPayload 256 bytes, MaxReadReq 512 bytes
		DevSta:	CorrErr- UncorrErr- FatalErr- UnsuppReq- AuxPwr- TransPend-
		LnkCap:	Port #0, Speed 8GT/s, Width x8, ASPM not supported, Exit Latency L0s <1us, L1 <64us
			ClockPM- Surprise- LLActRep- BwNot- ASPMOptComp+
		LnkCtl:	ASPM Disabled; RCB 64 bytes Disabled- CommClk+
			ExtSynch- ClockPM- AutWidDis- BWInt- AutBWInt-
		LnkSta:	Speed 8GT/s, Width x8, TrErr- Train- SlotClk+ DLActive- BWMgmt- ABWMgmt-
		DevCap2: Completion Timeout: Range ABCD, TimeoutDis+, LTR-, OBFF Not Supported
		DevCtl2: Completion Timeout: 50us to 50ms, TimeoutDis-, LTR-, OBFF Disabled
		LnkSta2: Current De-emphasis Level: -3.5dB, EqualizationComplete-, EqualizationPhase1-
			 EqualizationPhase2-, EqualizationPhase3-, LinkEqualizationRequest-
	Capabilities: [b0] MSI-X: Enable- Count=64 Masked-
		Vector table: BAR=5 offset=0013d000
		PBA: BAR=5 offset=0013dff0
	Capabilities: [c0] Vital Product Data
		Product Name: Annapurna Labs Alpine AL5+
		Read-only fields:
			[PN] Part number: N08AP2VFN018A
			[SN] Serial number: A715048199
			[EC] Engineering changes: 1D
			[V0] Vendor specific: FF
			[V1] Vendor specific: FF:FF:FF:FF:FF:FF
			[V2] Vendor specific: 14:4F:D7:0F:FD:A2
			[V3] Vendor specific: FF:FF:FF:FF:FF:FF
			[V4] Vendor specific: 14:4F:D7:0F:FD:A3
		End
	Capabilities: [100 v1] Alternative Routing-ID Interpretation (ARI)
		ARICap:	MFVC- ACS-, Next Function: 0
		ARICtl:	MFVC- ACS-, Function Group: 0
	Capabilities: [140 v1] Device Serial Number 9a-bc-de-f0-12-34-56-78
	Capabilities: [150 v1] #19
	Capabilities: [178 v1] Transaction Processing Hints
		Device specific mode supported
		No steering table available
	Capabilities: [200 v2] Advanced Error Reporting
		UESta:	DLP- SDES- TLP- FCP- CmpltTO- CmpltAbrt- UnxCmplt- RxOF- MalfTLP- ECRC- UnsupReq- ACSViol-
		UEMsk:	DLP- SDES- TLP- FCP- CmpltTO- CmpltAbrt- UnxCmplt- RxOF- MalfTLP- ECRC- UnsupReq- ACSViol-
		UESvrt:	DLP+ SDES+ TLP- FCP+ CmpltTO- CmpltAbrt- UnxCmplt- RxOF+ MalfTLP+ ECRC- UnsupReq- ACSViol-
		CESta:	RxErr- BadTLP- BadDLLP- Rollover- Timeout- NonFatalErr-
		CEMsk:	RxErr- BadTLP- BadDLLP- Rollover- Timeout- NonFatalErr+
		AERCap:	First Error Pointer: 00, GenCap+ CGenEn- ChkCap+ ChkEn-

14:20:40.82 PASS: Interpose3_Ethernet_Ctrl PCIe link speed 8
14:20:40.82 PASS: Interpose3_Ethernet_Ctrl PCIe link Width is 8
14:20:40.82 Subsection: Interpose4_Storage1_Ctrl Speed and Width Check
14:20:40.82 Send = lspci -s b0:00.0 -vvn
14:20:40.82 Rece = 
b0:00.0 0180: 1c36:1031 (prog-if 02)
	Subsystem: 0102:abce
	Control: I/O- Mem+ BusMaster+ SpecCycle- MemWINV- VGASnoop- ParErr- Stepping- SERR+ FastB2B- DisINTx-
	Status: Cap+ 66MHz- UDF- FastB2B- ParErr- DEVSEL=fast >TAbort- <TAbort- <MAbort- >SERR- <PERR- INTx-
	Latency: 0, Cache Line Size: 32 bytes
	Interrupt: pin A routed to IRQ 11
	NUMA node: 1
	Region 0: Memory at ec004000 (64-bit, non-prefetchable) [size=16K]
	Region 4: Memory at e4000000 (32-bit, non-prefetchable) [size=64M]
	Region 5: Memory at ea000000 (32-bit, non-prefetchable) [size=32M]
	Capabilities: [40] Power Management version 3
		Flags: PMEClk- DSI- D1- D2- AuxCurrent=375mA PME(D0+,D1-,D2-,D3hot-,D3cold-)
		Status: D0 NoSoftRst- PME-Enable- DSel=0 DScale=0 PME-
	Capabilities: [70] Express (v2) Endpoint, MSI 00
		DevCap:	MaxPayload 256 bytes, PhantFunc 0, Latency L0s <1us, L1 <8us
			ExtTag- AttnBtn- AttnInd- PwrInd- RBE+ FLReset+ SlotPowerLimit 75.000W
		DevCtl:	Report errors: Correctable- Non-Fatal- Fatal- Unsupported-
			RlxdOrd+ ExtTag- PhantFunc- AuxPwr- NoSnoop+ FLReset-
			MaxPayload 256 bytes, MaxReadReq 512 bytes
		DevSta:	CorrErr- UncorrErr- FatalErr- UnsuppReq- AuxPwr- TransPend-
		LnkCap:	Port #0, Speed 8GT/s, Width x8, ASPM not supported, Exit Latency L0s <1us, L1 <64us
			ClockPM- Surprise- LLActRep- BwNot- ASPMOptComp+
		LnkCtl:	ASPM Disabled; RCB 64 bytes Disabled- CommClk+
			ExtSynch- ClockPM- AutWidDis- BWInt- AutBWInt-
		LnkSta:	Speed 8GT/s, Width x8, TrErr- Train- SlotClk+ DLActive- BWMgmt- ABWMgmt-
		DevCap2: Completion Timeout: Range ABCD, TimeoutDis+, LTR-, OBFF Not Supported
		DevCtl2: Completion Timeout: 50us to 50ms, TimeoutDis-, LTR-, OBFF Disabled
		LnkCtl2: Target Link Speed: 8GT/s, EnterCompliance- SpeedDis-
			 Transmit Margin: Normal Operating Range, EnterModifiedCompliance- ComplianceSOS-
			 Compliance De-emphasis: -6dB
		LnkSta2: Current De-emphasis Level: -3.5dB, EqualizationComplete+, EqualizationPhase1+
			 EqualizationPhase2+, EqualizationPhase3+, LinkEqualizationRequest-
	Capabilities: [b0] MSI-X: Enable- Count=64 Masked-
		Vector table: BAR=0 offset=00002000
		PBA: BAR=0 offset=00003000
	Capabilities: [c0] Vital Product Data
		Product Name: Annapurna Labs Alpine AL5+
		Read-only fields:
			[PN] Part number: N08AP2VFN018A
			[SN] Serial number: A716000206
			[EC] Engineering changes: 1D
			[V0] Vendor specific: FF
			[V1] Vendor specific: FF:FF:FF:FF:FF:FF
			[V2] Vendor specific: F0:23:B9:A1:D8:96
			[V3] Vendor specific: FF:FF:FF:FF:FF:FF
			[V4] Vendor specific: F0:23:B9:A1:D8:97
		End
	Capabilities: [100 v1] Alternative Routing-ID Interpretation (ARI)
		ARICap:	MFVC- ACS-, Next Function: 1
		ARICtl:	MFVC- ACS-, Function Group: 0
	Capabilities: [140 v1] Device Serial Number 9a-bc-de-f0-12-34-56-78
	Capabilities: [150 v1] #19
	Capabilities: [178 v1] Transaction Processing Hints
		Device specific mode supported
		No steering table available
	Capabilities: [200 v2] Advanced Error Reporting
		UESta:	DLP- SDES- TLP- FCP- CmpltTO- CmpltAbrt- UnxCmplt- RxOF- MalfTLP- ECRC- UnsupReq- ACSViol-
		UEMsk:	DLP- SDES- TLP- FCP- CmpltTO- CmpltAbrt- UnxCmplt- RxOF- MalfTLP- ECRC- UnsupReq- ACSViol-
		UESvrt:	DLP+ SDES+ TLP- FCP+ CmpltTO- CmpltAbrt- UnxCmplt- RxOF+ MalfTLP+ ECRC- UnsupReq- ACSViol-
		CESta:	RxErr- BadTLP- BadDLLP- Rollover- Timeout- NonFatalErr-
		CEMsk:	RxErr- BadTLP- BadDLLP- Rollover- Timeout- NonFatalErr+
		AERCap:	First Error Pointer: 00, GenCap+ CGenEn- ChkCap+ ChkEn-

14:20:40.85 PASS: Interpose4_Storage1_Ctrl PCIe link speed 8
14:20:40.85 PASS: Interpose4_Storage1_Ctrl PCIe link Width is 8
14:20:40.85 Subsection: Interpose4_Storage2_Ctrl Speed and Width Check
14:20:40.85 Send = lspci -s b0:00.1 -vvn
14:20:40.85 Rece = 
b0:00.1 0180: 1c36:1031 (prog-if 02)
	Subsystem: 0102:abce
	Control: I/O- Mem+ BusMaster+ SpecCycle- MemWINV- VGASnoop- ParErr- Stepping- SERR+ FastB2B- DisINTx-
	Status: Cap+ 66MHz- UDF- FastB2B- ParErr- DEVSEL=fast >TAbort- <TAbort- <MAbort- >SERR- <PERR- INTx-
	Latency: 0, Cache Line Size: 32 bytes
	Interrupt: pin A routed to IRQ 11
	NUMA node: 1
	Region 0: Memory at ec000000 (64-bit, non-prefetchable) [size=16K]
	Capabilities: [40] Power Management version 3
		Flags: PMEClk- DSI- D1- D2- AuxCurrent=375mA PME(D0+,D1-,D2-,D3hot-,D3cold-)
		Status: D0 NoSoftRst- PME-Enable- DSel=0 DScale=0 PME-
	Capabilities: [70] Express (v2) Endpoint, MSI 00
		DevCap:	MaxPayload 256 bytes, PhantFunc 0, Latency L0s <1us, L1 <8us
			ExtTag- AttnBtn- AttnInd- PwrInd- RBE+ FLReset+ SlotPowerLimit 75.000W
		DevCtl:	Report errors: Correctable- Non-Fatal- Fatal- Unsupported-
			RlxdOrd+ ExtTag- PhantFunc- AuxPwr- NoSnoop+ FLReset-
			MaxPayload 256 bytes, MaxReadReq 512 bytes
		DevSta:	CorrErr- UncorrErr- FatalErr- UnsuppReq- AuxPwr- TransPend-
		LnkCap:	Port #0, Speed 8GT/s, Width x8, ASPM not supported, Exit Latency L0s <1us, L1 <64us
			ClockPM- Surprise- LLActRep- BwNot- ASPMOptComp+
		LnkCtl:	ASPM Disabled; RCB 64 bytes Disabled- CommClk+
			ExtSynch- ClockPM- AutWidDis- BWInt- AutBWInt-
		LnkSta:	Speed 8GT/s, Width x8, TrErr- Train- SlotClk+ DLActive- BWMgmt- ABWMgmt-
		DevCap2: Completion Timeout: Range ABCD, TimeoutDis+, LTR-, OBFF Not Supported
		DevCtl2: Completion Timeout: 50us to 50ms, TimeoutDis-, LTR-, OBFF Disabled
		LnkSta2: Current De-emphasis Level: -3.5dB, EqualizationComplete-, EqualizationPhase1-
			 EqualizationPhase2-, EqualizationPhase3-, LinkEqualizationRequest-
	Capabilities: [b0] MSI-X: Enable- Count=64 Masked-
		Vector table: BAR=0 offset=00002000
		PBA: BAR=0 offset=00003000
	Capabilities: [c0] Vital Product Data
		Product Name: Annapurna Labs Alpine AL5+
		Read-only fields:
			[PN] Part number: N08AP2VFN018A
			[SN] Serial number: A716000206
			[EC] Engineering changes: 1D
			[V0] Vendor specific: FF
			[V1] Vendor specific: FF:FF:FF:FF:FF:FF
			[V2] Vendor specific: F0:23:B9:A1:D8:96
			[V3] Vendor specific: FF:FF:FF:FF:FF:FF
			[V4] Vendor specific: F0:23:B9:A1:D8:97
		End
	Capabilities: [100 v1] Alternative Routing-ID Interpretation (ARI)
		ARICap:	MFVC- ACS-, Next Function: 2
		ARICtl:	MFVC- ACS-, Function Group: 0
	Capabilities: [140 v1] Device Serial Number 9a-bc-de-f0-12-34-56-78
	Capabilities: [150 v1] #19
	Capabilities: [178 v1] Transaction Processing Hints
		Device specific mode supported
		No steering table available
	Capabilities: [200 v2] Advanced Error Reporting
		UESta:	DLP- SDES- TLP- FCP- CmpltTO- CmpltAbrt- UnxCmplt- RxOF- MalfTLP- ECRC- UnsupReq- ACSViol-
		UEMsk:	DLP- SDES- TLP- FCP- CmpltTO- CmpltAbrt- UnxCmplt- RxOF- MalfTLP- ECRC- UnsupReq- ACSViol-
		UESvrt:	DLP+ SDES+ TLP- FCP+ CmpltTO- CmpltAbrt- UnxCmplt- RxOF+ MalfTLP+ ECRC- UnsupReq- ACSViol-
		CESta:	RxErr- BadTLP- BadDLLP- Rollover- Timeout- NonFatalErr-
		CEMsk:	RxErr- BadTLP- BadDLLP- Rollover- Timeout- NonFatalErr+
		AERCap:	First Error Pointer: 00, GenCap+ CGenEn- ChkCap+ ChkEn-

14:20:40.88 PASS: Interpose4_Storage2_Ctrl PCIe link speed 8
14:20:40.88 PASS: Interpose4_Storage2_Ctrl PCIe link Width is 8
14:20:40.88 Subsection: Interpose4_Ethernet_Ctrl Speed and Width Check
14:20:40.88 Send = lspci -s b0:00.2 -vvn
14:20:40.88 Rece = 
b0:00.2 0200: 1c36:1001
	Subsystem: 0102:abce
	Control: I/O- Mem- BusMaster- SpecCycle- MemWINV- VGASnoop- ParErr- Stepping- SERR+ FastB2B- DisINTx-
	Status: Cap+ 66MHz- UDF- FastB2B- ParErr- DEVSEL=fast >TAbort- <TAbort- <MAbort- >SERR- <PERR- INTx-
	Interrupt: pin A routed to IRQ 11
	NUMA node: 1
	Region 5: Memory at e8000000 (32-bit, non-prefetchable) [disabled] [size=32M]
	Capabilities: [40] Power Management version 3
		Flags: PMEClk- DSI- D1- D2- AuxCurrent=375mA PME(D0+,D1-,D2-,D3hot-,D3cold-)
		Status: D0 NoSoftRst- PME-Enable- DSel=0 DScale=0 PME-
	Capabilities: [70] Express (v2) Endpoint, MSI 00
		DevCap:	MaxPayload 256 bytes, PhantFunc 0, Latency L0s <1us, L1 <8us
			ExtTag- AttnBtn- AttnInd- PwrInd- RBE+ FLReset+ SlotPowerLimit 75.000W
		DevCtl:	Report errors: Correctable- Non-Fatal- Fatal- Unsupported-
			RlxdOrd+ ExtTag- PhantFunc- AuxPwr- NoSnoop+ FLReset-
			MaxPayload 256 bytes, MaxReadReq 512 bytes
		DevSta:	CorrErr- UncorrErr- FatalErr- UnsuppReq- AuxPwr- TransPend-
		LnkCap:	Port #0, Speed 8GT/s, Width x8, ASPM not supported, Exit Latency L0s <1us, L1 <64us
			ClockPM- Surprise- LLActRep- BwNot- ASPMOptComp+
		LnkCtl:	ASPM Disabled; RCB 64 bytes Disabled- CommClk+
			ExtSynch- ClockPM- AutWidDis- BWInt- AutBWInt-
		LnkSta:	Speed 8GT/s, Width x8, TrErr- Train- SlotClk+ DLActive- BWMgmt- ABWMgmt-
		DevCap2: Completion Timeout: Range ABCD, TimeoutDis+, LTR-, OBFF Not Supported
		DevCtl2: Completion Timeout: 50us to 50ms, TimeoutDis-, LTR-, OBFF Disabled
		LnkSta2: Current De-emphasis Level: -3.5dB, EqualizationComplete-, EqualizationPhase1-
			 EqualizationPhase2-, EqualizationPhase3-, LinkEqualizationRequest-
	Capabilities: [b0] MSI-X: Enable- Count=64 Masked-
		Vector table: BAR=5 offset=0013d000
		PBA: BAR=5 offset=0013dff0
	Capabilities: [c0] Vital Product Data
		Product Name: Annapurna Labs Alpine AL5+
		Read-only fields:
			[PN] Part number: N08AP2VFN018A
			[SN] Serial number: A716000206
			[EC] Engineering changes: 1D
			[V0] Vendor specific: FF
			[V1] Vendor specific: FF:FF:FF:FF:FF:FF
			[V2] Vendor specific: F0:23:B9:A1:D8:96
			[V3] Vendor specific: FF:FF:FF:FF:FF:FF
			[V4] Vendor specific: F0:23:B9:A1:D8:97
		End
	Capabilities: [100 v1] Alternative Routing-ID Interpretation (ARI)
		ARICap:	MFVC- ACS-, Next Function: 0
		ARICtl:	MFVC- ACS-, Function Group: 0
	Capabilities: [140 v1] Device Serial Number 9a-bc-de-f0-12-34-56-78
	Capabilities: [150 v1] #19
	Capabilities: [178 v1] Transaction Processing Hints
		Device specific mode supported
		No steering table available
	Capabilities: [200 v2] Advanced Error Reporting
		UESta:	DLP- SDES- TLP- FCP- CmpltTO- CmpltAbrt- UnxCmplt- RxOF- MalfTLP- ECRC- UnsupReq- ACSViol-
		UEMsk:	DLP- SDES- TLP- FCP- CmpltTO- CmpltAbrt- UnxCmplt- RxOF- MalfTLP- ECRC- UnsupReq- ACSViol-
		UESvrt:	DLP+ SDES+ TLP- FCP+ CmpltTO- CmpltAbrt- UnxCmplt- RxOF+ MalfTLP+ ECRC- UnsupReq- ACSViol-
		CESta:	RxErr- BadTLP- BadDLLP- Rollover- Timeout- NonFatalErr-
		CEMsk:	RxErr- BadTLP- BadDLLP- Rollover- Timeout- NonFatalErr+
		AERCap:	First Error Pointer: 00, GenCap+ CGenEn- ChkCap+ ChkEn-

14:20:40.90 PASS: Interpose4_Ethernet_Ctrl PCIe link speed 8
14:20:40.90 PASS: Interpose4_Ethernet_Ctrl PCIe link Width is 8
14:20:40.90 Tester Chk => OK: PCIe Devices Link Speed and Width Verified
14:20:40.90 ##############################################################
14:20:40.90 Subsection: ButterFly1_Ethernet_Ctrl1 Speed and Width Check
14:20:40.91 Send = lspci -s 3b:00.0 -vvn
14:20:40.91 Rece = 
3b:00.0 0200: 1c36:8889
	Subsystem: 0102:abce
	Control: I/O- Mem- BusMaster- SpecCycle- MemWINV- VGASnoop- ParErr- Stepping- SERR+ FastB2B- DisINTx-
	Status: Cap+ 66MHz- UDF- FastB2B- ParErr- DEVSEL=fast >TAbort- <TAbort- <MAbort- >SERR- <PERR- INTx-
	Interrupt: pin A routed to IRQ 11
	NUMA node: 0
	Region 0: Memory at c6004000 (64-bit, non-prefetchable) [disabled] [size=16K]
	Region 4: Memory at bc000000 (32-bit, non-prefetchable) [disabled] [size=64M]
	Region 5: Memory at c4000000 (32-bit, non-prefetchable) [disabled] [size=32M]
	Capabilities: [40] Power Management version 3
		Flags: PMEClk- DSI- D1- D2- AuxCurrent=375mA PME(D0+,D1-,D2-,D3hot-,D3cold-)
		Status: D0 NoSoftRst- PME-Enable- DSel=0 DScale=0 PME-
	Capabilities: [70] Express (v2) Endpoint, MSI 00
		DevCap:	MaxPayload 256 bytes, PhantFunc 0, Latency L0s <1us, L1 <8us
			ExtTag- AttnBtn- AttnInd- PwrInd- RBE+ FLReset+ SlotPowerLimit 75.000W
		DevCtl:	Report errors: Correctable- Non-Fatal- Fatal- Unsupported-
			RlxdOrd+ ExtTag- PhantFunc- AuxPwr- NoSnoop+ FLReset-
			MaxPayload 256 bytes, MaxReadReq 512 bytes
		DevSta:	CorrErr- UncorrErr- FatalErr- UnsuppReq- AuxPwr- TransPend-
		LnkCap:	Port #0, Speed 8GT/s, Width x8, ASPM not supported, Exit Latency L0s <1us, L1 <64us
			ClockPM- Surprise- LLActRep- BwNot- ASPMOptComp+
		LnkCtl:	ASPM Disabled; RCB 64 bytes Disabled- CommClk+
			ExtSynch- ClockPM- AutWidDis- BWInt- AutBWInt-
		LnkSta:	Speed 8GT/s, Width x8, TrErr- Train- SlotClk+ DLActive- BWMgmt- ABWMgmt-
		DevCap2: Completion Timeout: Range ABCD, TimeoutDis+, LTR-, OBFF Not Supported
		DevCtl2: Completion Timeout: 50us to 50ms, TimeoutDis-, LTR-, OBFF Disabled
		LnkCtl2: Target Link Speed: 8GT/s, EnterCompliance- SpeedDis-
			 Transmit Margin: Normal Operating Range, EnterModifiedCompliance- ComplianceSOS-
			 Compliance De-emphasis: -6dB
		LnkSta2: Current De-emphasis Level: -3.5dB, EqualizationComplete+, EqualizationPhase1+
			 EqualizationPhase2+, EqualizationPhase3+, LinkEqualizationRequest-
	Capabilities: [b0] MSI-X: Enable- Count=64 Masked-
		Vector table: BAR=5 offset=0005d000
		PBA: BAR=5 offset=0005dff0
	Capabilities: [c0] Vital Product Data
		Product Name: Annapurna Labs Alpine AL5+
		Read-only fields:
			[PN] Part number: N08AP6VFN008A
			[SN] Serial number: A721001517
			[EC] Engineering changes: 1E
			[V0] Vendor specific: 22
			[V1] Vendor specific: F0:23:B9:A3:6D:8B
			[V2] Vendor specific: F0:23:B9:A3:6D:8C
			[V3] Vendor specific: F0:23:B9:A3:6D:8D
			[V4] Vendor specific: F0:23:B9:A3:6D:8E
		End
	Capabilities: [100 v1] Alternative Routing-ID Interpretation (ARI)
		ARICap:	MFVC- ACS-, Next Function: 1
		ARICtl:	MFVC- ACS-, Function Group: 0
	Capabilities: [140 v1] Device Serial Number 9a-bc-de-f0-12-34-56-78
	Capabilities: [150 v1] #19
	Capabilities: [178 v1] Transaction Processing Hints
		Device specific mode supported
		No steering table available
	Capabilities: [200 v2] Advanced Error Reporting
		UESta:	DLP- SDES- TLP- FCP- CmpltTO- CmpltAbrt- UnxCmplt- RxOF- MalfTLP- ECRC- UnsupReq- ACSViol-
		UEMsk:	DLP- SDES- TLP- FCP- CmpltTO- CmpltAbrt- UnxCmplt- RxOF- MalfTLP- ECRC- UnsupReq- ACSViol-
		UESvrt:	DLP+ SDES+ TLP- FCP+ CmpltTO- CmpltAbrt- UnxCmplt- RxOF+ MalfTLP+ ECRC- UnsupReq- ACSViol-
		CESta:	RxErr- BadTLP- BadDLLP- Rollover- Timeout- NonFatalErr-
		CEMsk:	RxErr- BadTLP- BadDLLP- Rollover- Timeout- NonFatalErr+
		AERCap:	First Error Pointer: 00, GenCap+ CGenEn- ChkCap+ ChkEn-

14:20:40.93 PASS: ButterFly1_Ethernet_Ctrl1 PCIe link speed 8
14:20:40.93 PASS: ButterFly1_Ethernet_Ctrl1 PCIe link Width is 8
14:20:40.93 Subsection: ButterFly1_Ethernet_Ctrl2 Speed and Width Check
14:20:40.94 Send = lspci -s 3b:00.1 -vvn
14:20:40.94 Rece = 
3b:00.1 0200: 1c36:8889
	Subsystem: 0102:abce
	Control: I/O- Mem- BusMaster- SpecCycle- MemWINV- VGASnoop- ParErr- Stepping- SERR+ FastB2B- DisINTx-
	Status: Cap+ 66MHz- UDF- FastB2B- ParErr- DEVSEL=fast >TAbort- <TAbort- <MAbort- >SERR- <PERR- INTx-
	Interrupt: pin A routed to IRQ 11
	NUMA node: 0
	Region 0: Memory at c6000000 (64-bit, non-prefetchable) [disabled] [size=16K]
	Region 5: Memory at c2000000 (32-bit, non-prefetchable) [disabled] [size=32M]
	Capabilities: [40] Power Management version 3
		Flags: PMEClk- DSI- D1- D2- AuxCurrent=375mA PME(D0+,D1-,D2-,D3hot-,D3cold-)
		Status: D0 NoSoftRst- PME-Enable- DSel=0 DScale=0 PME-
	Capabilities: [70] Express (v2) Endpoint, MSI 00
		DevCap:	MaxPayload 256 bytes, PhantFunc 0, Latency L0s <1us, L1 <8us
			ExtTag- AttnBtn- AttnInd- PwrInd- RBE+ FLReset+ SlotPowerLimit 75.000W
		DevCtl:	Report errors: Correctable- Non-Fatal- Fatal- Unsupported-
			RlxdOrd+ ExtTag- PhantFunc- AuxPwr- NoSnoop+ FLReset-
			MaxPayload 256 bytes, MaxReadReq 512 bytes
		DevSta:	CorrErr- UncorrErr- FatalErr- UnsuppReq- AuxPwr- TransPend-
		LnkCap:	Port #0, Speed 8GT/s, Width x8, ASPM not supported, Exit Latency L0s <1us, L1 <64us
			ClockPM- Surprise- LLActRep- BwNot- ASPMOptComp+
		LnkCtl:	ASPM Disabled; RCB 64 bytes Disabled- CommClk+
			ExtSynch- ClockPM- AutWidDis- BWInt- AutBWInt-
		LnkSta:	Speed 8GT/s, Width x8, TrErr- Train- SlotClk+ DLActive- BWMgmt- ABWMgmt-
		DevCap2: Completion Timeout: Range ABCD, TimeoutDis+, LTR-, OBFF Not Supported
		DevCtl2: Completion Timeout: 50us to 50ms, TimeoutDis-, LTR-, OBFF Disabled
		LnkSta2: Current De-emphasis Level: -3.5dB, EqualizationComplete-, EqualizationPhase1-
			 EqualizationPhase2-, EqualizationPhase3-, LinkEqualizationRequest-
	Capabilities: [b0] MSI-X: Enable- Count=64 Masked-
		Vector table: BAR=5 offset=0025d000
		PBA: BAR=5 offset=0025dff0
	Capabilities: [c0] Vital Product Data
		Product Name: Annapurna Labs Alpine AL5+
		Read-only fields:
			[PN] Part number: N08AP6VFN008A
			[SN] Serial number: A721001517
			[EC] Engineering changes: 1E
			[V0] Vendor specific: 22
			[V1] Vendor specific: F0:23:B9:A3:6D:8B
			[V2] Vendor specific: F0:23:B9:A3:6D:8C
			[V3] Vendor specific: F0:23:B9:A3:6D:8D
			[V4] Vendor specific: F0:23:B9:A3:6D:8E
		End
	Capabilities: [100 v1] Alternative Routing-ID Interpretation (ARI)
		ARICap:	MFVC- ACS-, Next Function: 2
		ARICtl:	MFVC- ACS-, Function Group: 0
	Capabilities: [140 v1] Device Serial Number 9a-bc-de-f0-12-34-56-78
	Capabilities: [150 v1] #19
	Capabilities: [178 v1] Transaction Processing Hints
		Device specific mode supported
		No steering table available
	Capabilities: [200 v2] Advanced Error Reporting
		UESta:	DLP- SDES- TLP- FCP- CmpltTO- CmpltAbrt- UnxCmplt- RxOF- MalfTLP- ECRC- UnsupReq- ACSViol-
		UEMsk:	DLP- SDES- TLP- FCP- CmpltTO- CmpltAbrt- UnxCmplt- RxOF- MalfTLP- ECRC- UnsupReq- ACSViol-
		UESvrt:	DLP+ SDES+ TLP- FCP+ CmpltTO- CmpltAbrt- UnxCmplt- RxOF+ MalfTLP+ ECRC- UnsupReq- ACSViol-
		CESta:	RxErr- BadTLP- BadDLLP- Rollover- Timeout- NonFatalErr-
		CEMsk:	RxErr- BadTLP- BadDLLP- Rollover- Timeout- NonFatalErr+
		AERCap:	First Error Pointer: 00, GenCap+ CGenEn- ChkCap+ ChkEn-

14:20:40.97 PASS: ButterFly1_Ethernet_Ctrl2 PCIe link speed 8
14:20:40.97 PASS: ButterFly1_Ethernet_Ctrl2 PCIe link Width is 8
14:20:40.97 Subsection: ButterFly1_Ethernet_Ctrl3 Speed and Width Check
14:20:40.97 Send = lspci -s 3b:00.2 -vvn
14:20:40.97 Rece = 
3b:00.2 0200: 1c36:1001
	Subsystem: 0102:abce
	Control: I/O- Mem- BusMaster- SpecCycle- MemWINV- VGASnoop- ParErr- Stepping- SERR+ FastB2B- DisINTx-
	Status: Cap+ 66MHz- UDF- FastB2B- ParErr- DEVSEL=fast >TAbort- <TAbort- <MAbort- >SERR- <PERR- INTx-
	Interrupt: pin A routed to IRQ 11
	NUMA node: 0
	Region 5: Memory at c0000000 (32-bit, non-prefetchable) [disabled] [size=32M]
	Capabilities: [40] Power Management version 3
		Flags: PMEClk- DSI- D1- D2- AuxCurrent=375mA PME(D0+,D1-,D2-,D3hot-,D3cold-)
		Status: D0 NoSoftRst- PME-Enable- DSel=0 DScale=0 PME-
	Capabilities: [70] Express (v2) Endpoint, MSI 00
		DevCap:	MaxPayload 256 bytes, PhantFunc 0, Latency L0s <1us, L1 <8us
			ExtTag- AttnBtn- AttnInd- PwrInd- RBE+ FLReset+ SlotPowerLimit 75.000W
		DevCtl:	Report errors: Correctable- Non-Fatal- Fatal- Unsupported-
			RlxdOrd+ ExtTag- PhantFunc- AuxPwr- NoSnoop+ FLReset-
			MaxPayload 256 bytes, MaxReadReq 512 bytes
		DevSta:	CorrErr- UncorrErr- FatalErr- UnsuppReq- AuxPwr- TransPend-
		LnkCap:	Port #0, Speed 8GT/s, Width x8, ASPM not supported, Exit Latency L0s <1us, L1 <64us
			ClockPM- Surprise- LLActRep- BwNot- ASPMOptComp+
		LnkCtl:	ASPM Disabled; RCB 64 bytes Disabled- CommClk+
			ExtSynch- ClockPM- AutWidDis- BWInt- AutBWInt-
		LnkSta:	Speed 8GT/s, Width x8, TrErr- Train- SlotClk+ DLActive- BWMgmt- ABWMgmt-
		DevCap2: Completion Timeout: Range ABCD, TimeoutDis+, LTR-, OBFF Not Supported
		DevCtl2: Completion Timeout: 50us to 50ms, TimeoutDis-, LTR-, OBFF Disabled
		LnkSta2: Current De-emphasis Level: -3.5dB, EqualizationComplete-, EqualizationPhase1-
			 EqualizationPhase2-, EqualizationPhase3-, LinkEqualizationRequest-
	Capabilities: [b0] MSI-X: Enable- Count=64 Masked-
		Vector table: BAR=5 offset=0013d000
		PBA: BAR=5 offset=0013dff0
	Capabilities: [c0] Vital Product Data
		Product Name: Annapurna Labs Alpine AL5+
		Read-only fields:
			[PN] Part number: N08AP6VFN008A
			[SN] Serial number: A721001517
			[EC] Engineering changes: 1E
			[V0] Vendor specific: 22
			[V1] Vendor specific: F0:23:B9:A3:6D:8B
			[V2] Vendor specific: F0:23:B9:A3:6D:8C
			[V3] Vendor specific: F0:23:B9:A3:6D:8D
			[V4] Vendor specific: F0:23:B9:A3:6D:8E
		End
	Capabilities: [100 v1] Alternative Routing-ID Interpretation (ARI)
		ARICap:	MFVC- ACS-, Next Function: 0
		ARICtl:	MFVC- ACS-, Function Group: 0
	Capabilities: [140 v1] Device Serial Number 9a-bc-de-f0-12-34-56-78
	Capabilities: [150 v1] #19
	Capabilities: [178 v1] Transaction Processing Hints
		Device specific mode supported
		No steering table available
	Capabilities: [200 v2] Advanced Error Reporting
		UESta:	DLP- SDES- TLP- FCP- CmpltTO- CmpltAbrt- UnxCmplt- RxOF- MalfTLP- ECRC- UnsupReq- ACSViol-
		UEMsk:	DLP- SDES- TLP- FCP- CmpltTO- CmpltAbrt- UnxCmplt- RxOF- MalfTLP- ECRC- UnsupReq- ACSViol-
		UESvrt:	DLP+ SDES+ TLP- FCP+ CmpltTO- CmpltAbrt- UnxCmplt- RxOF+ MalfTLP+ ECRC- UnsupReq- ACSViol-
		CESta:	RxErr- BadTLP- BadDLLP- Rollover- Timeout- NonFatalErr-
		CEMsk:	RxErr- BadTLP- BadDLLP- Rollover- Timeout- NonFatalErr+
		AERCap:	First Error Pointer: 00, GenCap+ CGenEn- ChkCap+ ChkEn-

14:20:41.00 PASS: ButterFly1_Ethernet_Ctrl3 PCIe link speed 8
14:20:41.00 PASS: ButterFly1_Ethernet_Ctrl3 PCIe link Width is 8
14:20:41.00 Subsection: ButterFly1_Ethernet_Ctrl1 Speed and Width Check
14:20:41.00 Send = lspci -s 3c:00.0 -vvn
14:20:41.00 Rece = 

