                                
                                
Station: localhost.localdomain
Date   : 2000-01-01 08:34:08
Version: V0.0.00(BFT1-EVT)
                                
08:34:08.32 ##############################################################
08:34:08.32 Section: USB Check
08:34:08.33 Send = /root/CBFT/tools/storage-tool-64 -pciid 8086:a1af -usbpath 0:2:1.0 -devicecount 1 -action info
08:34:08.33 Rece = 
Storage test tool
Version 2.5 Copyright Flextronics Penang

Device info for /dev/sg0
  Removable
  Host#=0
  Bus#=0
  SCSI Id#=0
  LUN#=0
  Type=0
  Size=15502147584 bytes, 14784.0 MiB, 15.50 GB
  Block device=/dev/sda
  Vendor=Kingston
  Product=DataTraveler 3.0
  Revision=PMAP
  Serial number=9B41D4E08409
  Controller=Intel Corporation Lewisburg USB 3.0 xHCI Controller
  Controller PCI vendorID:deviceID=8086:a1af
  Controller PCI path=0000:00:14.0
  Controller USB path=0:2:1.0
  Controller SCSI path=0:0:0:0
****************************
*** Device count matches ***
****************************
08:34:08.50 Send = /root/CBFT/tools/storage-tool-64 -pciid 8086:a1af -usbpath 0:3:1.0 -devicecount 1 -action info
08:34:08.50 Rece = 
Storage test tool
Version 2.5 Copyright Flextronics Penang

Device info for /dev/sg1
  Removable
  Host#=1
  Bus#=0
  SCSI Id#=0
  LUN#=0
  Type=0
  Size=15502147584 bytes, 14784.0 MiB, 15.50 GB
  Block device=/dev/sdb
  Vendor=Kingston
  Product=DataTraveler 3.0
  Revision=PMAP
  Serial number=9B41D4E08409
  Controller=Intel Corporation Lewisburg USB 3.0 xHCI Controller
  Controller PCI vendorID:deviceID=8086:a1af
  Controller PCI path=0000:00:14.0
  Controller USB path=0:3:1.0
  Controller SCSI path=0:0:0:0
****************************
*** Device count matches ***
****************************
08:34:08.67 Send = /root/CBFT/tools/storage-tool-64 -pciid 8086:a1af -usbpath 0:4:1.0 -devicecount 1 -action info
08:34:08.67 Rece = 
Storage test tool
Version 2.5 Copyright Flextronics Penang

Device info for /dev/sg2
  Removable
  Host#=2
  Bus#=0
  SCSI Id#=0
  LUN#=0
  Type=0
  Size=15502147584 bytes, 14784.0 MiB, 15.50 GB
  Block device=/dev/sdc
  Vendor=Kingston
  Product=DataTraveler 3.0
  Revision=PMAP
  Serial number=1BC164F06459
  Controller=Intel Corporation Lewisburg USB 3.0 xHCI Controller
  Controller PCI vendorID:deviceID=8086:a1af
  Controller PCI path=0000:00:14.0
  Controller USB path=0:4:1.0
  Controller SCSI path=0:0:0:0
****************************
*** Device count matches ***
****************************
08:34:08.84 Tester Chk => OK: USB Verify
08:34:08.84 ##############################################################
08:34:08.84 Subsection: Interpose1_Storage1_Ctrl Speed and Width Check
08:34:08.84 Send = lspci -s 18:00.0 -vvn
08:34:08.84 Rece = 
18:00.0 0180: 1c36:1031 (prog-if 02)
	Subsystem: 0102:abce
	Control: I/O- Mem+ BusMaster+ SpecCycle- MemWINV- VGASnoop- ParErr- Stepping- SERR+ FastB2B- DisINTx-
	Status: Cap+ 66MHz- UDF- FastB2B- ParErr- DEVSEL=fast >TAbort- <TAbort- <MAbort- >SERR- <PERR- INTx-
	Latency: 0, Cache Line Size: 32 bytes
	Interrupt: pin A routed to IRQ 11
	NUMA node: 0
	Region 0: Memory at 7a004000 (64-bit, non-prefetchable) [size=16K]
	Region 4: Memory at 70000000 (32-bit, non-prefetchable) [size=64M]
	Region 5: Memory at 78000000 (32-bit, non-prefetchable) [size=32M]
	Capabilities: [40] Power Management version 3
		Flags: PMEClk- DSI- D1- D2- AuxCurrent=375mA PME(D0+,D1-,D2-,D3hot-,D3cold-)
		Status: D0 NoSoftRst- PME-Enable- DSel=0 DScale=0 PME-
	Capabilities: [70] Express (v2) Endpoint, MSI 00
		DevCap:	MaxPayload 256 bytes, PhantFunc 0, Latency L0s <1us, L1 <8us
			ExtTag- AttnBtn- AttnInd- PwrInd- RBE+ FLReset+ SlotPowerLimit 75.000W
		DevCtl:	Report errors: Correctable- Non-Fatal- Fatal- Unsupported-
			RlxdOrd+ ExtTag- PhantFunc- AuxPwr- NoSnoop+ FLReset-
			MaxPayload 256 bytes, MaxReadReq 512 bytes
		DevSta:	CorrErr- UncorrErr- FatalErr- UnsuppReq- AuxPwr- TransPend-
		LnkCap:	Port #0, Speed 8GT/s, Width x8, ASPM not supported, Exit Latency L0s <1us, L1 <64us
			ClockPM- Surprise- LLActRep- BwNot- ASPMOptComp+
		LnkCtl:	ASPM Disabled; RCB 64 bytes Disabled- CommClk+
			ExtSynch- ClockPM- AutWidDis- BWInt- AutBWInt-
		LnkSta:	Speed 8GT/s, Width x8, TrErr- Train- SlotClk+ DLActive- BWMgmt- ABWMgmt-
		DevCap2: Completion Timeout: Range ABCD, TimeoutDis+, LTR-, OBFF Not Supported
		DevCtl2: Completion Timeout: 50us to 50ms, TimeoutDis-, LTR-, OBFF Disabled
		LnkCtl2: Target Link Speed: 8GT/s, EnterCompliance- SpeedDis-
			 Transmit Margin: Normal Operating Range, EnterModifiedCompliance- ComplianceSOS-
			 Compliance De-emphasis: -6dB
		LnkSta2: Current De-emphasis Level: -3.5dB, EqualizationComplete+, EqualizationPhase1+
			 EqualizationPhase2+, EqualizationPhase3+, LinkEqualizationRequest-
	Capabilities: [b0] MSI-X: Enable- Count=64 Masked-
		Vector table: BAR=0 offset=00002000
		PBA: BAR=0 offset=00003000
	Capabilities: [c0] Vital Product Data
		Product Name: Annapurna Labs Alpine AL5+
		Read-only fields:
			[PN] Part number: N08AP2VFN018A
			[SN] Serial number: A716000269
			[EC] Engineering changes: 1D
			[V0] Vendor specific: FF
			[V1] Vendor specific: FF:FF:FF:FF:FF:FF
			[V2] Vendor specific: F0:23:B9:A1:D9:08
			[V3] Vendor specific: FF:FF:FF:FF:FF:FF
			[V4] Vendor specific: F0:23:B9:A1:D9:09
		End
	Capabilities: [100 v1] Alternative Routing-ID Interpretation (ARI)
		ARICap:	MFVC- ACS-, Next Function: 1
		ARICtl:	MFVC- ACS-, Function Group: 0
	Capabilities: [140 v1] Device Serial Number 9a-bc-de-f0-12-34-56-78
	Capabilities: [150 v1] #19
	Capabilities: [178 v1] Transaction Processing Hints
		Device specific mode supported
		No steering table available
	Capabilities: [200 v2] Advanced Error Reporting
		UESta:	DLP- SDES- TLP- FCP- CmpltTO- CmpltAbrt- UnxCmplt- RxOF- MalfTLP- ECRC- UnsupReq- ACSViol-
		UEMsk:	DLP- SDES- TLP- FCP- CmpltTO- CmpltAbrt- UnxCmplt- RxOF- MalfTLP- ECRC- UnsupReq- ACSViol-
		UESvrt:	DLP+ SDES+ TLP- FCP+ CmpltTO- CmpltAbrt- UnxCmplt- RxOF+ MalfTLP+ ECRC- UnsupReq- ACSViol-
		CESta:	RxErr- BadTLP- BadDLLP- Rollover- Timeout- NonFatalErr-
		CEMsk:	RxErr- BadTLP- BadDLLP- Rollover- Timeout- NonFatalErr+
		AERCap:	First Error Pointer: 00, GenCap+ CGenEn- ChkCap+ ChkEn-

08:34:08.87 PASS: Interpose1_Storage1_Ctrl PCIe link speed 8
08:34:08.88 PASS: Interpose1_Storage1_Ctrl PCIe link Width is 8
08:34:08.88 Subsection: Interpose1_Storage2_Ctrl Speed and Width Check
08:34:08.88 Send = lspci -s 18:00.1 -vvn
08:34:08.88 Rece = 
18:00.1 0180: 1c36:1031 (prog-if 02)
	Subsystem: 0102:abce
	Control: I/O- Mem+ BusMaster+ SpecCycle- MemWINV- VGASnoop- ParErr- Stepping- SERR+ FastB2B- DisINTx-
	Status: Cap+ 66MHz- UDF- FastB2B- ParErr- DEVSEL=fast >TAbort- <TAbort- <MAbort- >SERR- <PERR- INTx-
	Latency: 0, Cache Line Size: 32 bytes
	Interrupt: pin A routed to IRQ 11
	NUMA node: 0
	Region 0: Memory at 7a000000 (64-bit, non-prefetchable) [size=16K]
	Region 4: Memory at 6c000000 (32-bit, non-prefetchable) [size=64M]
	Region 5: Memory at 76000000 (32-bit, non-prefetchable) [size=32M]
	Capabilities: [40] Power Management version 3
		Flags: PMEClk- DSI- D1- D2- AuxCurrent=375mA PME(D0+,D1-,D2-,D3hot-,D3cold-)
		Status: D0 NoSoftRst- PME-Enable- DSel=0 DScale=0 PME-
	Capabilities: [70] Express (v2) Endpoint, MSI 00
		DevCap:	MaxPayload 256 bytes, PhantFunc 0, Latency L0s <1us, L1 <8us
			ExtTag- AttnBtn- AttnInd- PwrInd- RBE+ FLReset+ SlotPowerLimit 75.000W
		DevCtl:	Report errors: Correctable- Non-Fatal- Fatal- Unsupported-
			RlxdOrd+ ExtTag- PhantFunc- AuxPwr- NoSnoop+ FLReset-
			MaxPayload 256 bytes, MaxReadReq 512 bytes
		DevSta:	CorrErr- UncorrErr- FatalErr- UnsuppReq- AuxPwr- TransPend-
		LnkCap:	Port #0, Speed 8GT/s, Width x8, ASPM not supported, Exit Latency L0s <1us, L1 <64us
			ClockPM- Surprise- LLActRep- BwNot- ASPMOptComp+
		LnkCtl:	ASPM Disabled; RCB 64 bytes Disabled- CommClk+
			ExtSynch- ClockPM- AutWidDis- BWInt- AutBWInt-
		LnkSta:	Speed 8GT/s, Width x8, TrErr- Train- SlotClk+ DLActive- BWMgmt- ABWMgmt-
		DevCap2: Completion Timeout: Range ABCD, TimeoutDis+, LTR-, OBFF Not Supported
		DevCtl2: Completion Timeout: 50us to 50ms, TimeoutDis-, LTR-, OBFF Disabled
		LnkSta2: Current De-emphasis Level: -3.5dB, EqualizationComplete-, EqualizationPhase1-
			 EqualizationPhase2-, EqualizationPhase3-, LinkEqualizationRequest-
	Capabilities: [b0] MSI-X: Enable- Count=64 Masked-
		Vector table: BAR=0 offset=00002000
		PBA: BAR=0 offset=00003000
	Capabilities: [c0] Vital Product Data
		Product Name: Annapurna Labs Alpine AL5+
		Read-only fields:
			[PN] Part number: N08AP2VFN018A
			[SN] Serial number: A716000269
			[EC] Engineering changes: 1D
			[V0] Vendor specific: FF
			[V1] Vendor specific: FF:FF:FF:FF:FF:FF
			[V2] Vendor specific: F0:23:B9:A1:D9:08
			[V3] Vendor specific: FF:FF:FF:FF:FF:FF
			[V4] Vendor specific: F0:23:B9:A1:D9:09
		End
	Capabilities: [100 v1] Alternative Routing-ID Interpretation (ARI)
		ARICap:	MFVC- ACS-, Next Function: 2
		ARICtl:	MFVC- ACS-, Function Group: 0
	Capabilities: [140 v1] Device Serial Number 9a-bc-de-f0-12-34-56-78
	Capabilities: [150 v1] #19
	Capabilities: [178 v1] Transaction Processing Hints
		Device specific mode supported
		No steering table available
	Capabilities: [200 v2] Advanced Error Reporting
		UESta:	DLP- SDES- TLP- FCP- CmpltTO- CmpltAbrt- UnxCmplt- RxOF- MalfTLP- ECRC- UnsupReq- ACSViol-
		UEMsk:	DLP- SDES- TLP- FCP- CmpltTO- CmpltAbrt- UnxCmplt- RxOF- MalfTLP- ECRC- UnsupReq- ACSViol-
		UESvrt:	DLP+ SDES+ TLP- FCP+ CmpltTO- CmpltAbrt- UnxCmplt- RxOF+ MalfTLP+ ECRC- UnsupReq- ACSViol-
		CESta:	RxErr- BadTLP- BadDLLP- Rollover- Timeout- NonFatalErr-
		CEMsk:	RxErr- BadTLP- BadDLLP- Rollover- Timeout- NonFatalErr+
		AERCap:	First Error Pointer: 00, GenCap+ CGenEn- ChkCap+ ChkEn-

08:34:08.91 PASS: Interpose1_Storage2_Ctrl PCIe link speed 8
08:34:08.91 PASS: Interpose1_Storage2_Ctrl PCIe link Width is 8
08:34:08.91 Subsection: Interpose1_Ethernet_Ctrl Speed and Width Check
08:34:08.91 Send = lspci -s 18:00.2 -vvn
08:34:08.91 Rece = 
18:00.2 0200: 1c36:1001
	Subsystem: 0102:abce
	Control: I/O- Mem- BusMaster- SpecCycle- MemWINV- VGASnoop- ParErr- Stepping- SERR+ FastB2B- DisINTx-
	Status: Cap+ 66MHz- UDF- FastB2B- ParErr- DEVSEL=fast >TAbort- <TAbort- <MAbort- >SERR- <PERR- INTx-
	Interrupt: pin A routed to IRQ 11
	NUMA node: 0
	Region 5: Memory at 74000000 (32-bit, non-prefetchable) [disabled] [size=32M]
	Capabilities: [40] Power Management version 3
		Flags: PMEClk- DSI- D1- D2- AuxCurrent=375mA PME(D0+,D1-,D2-,D3hot-,D3cold-)
		Status: D0 NoSoftRst- PME-Enable- DSel=0 DScale=0 PME-
	Capabilities: [70] Express (v2) Endpoint, MSI 00
		DevCap:	MaxPayload 256 bytes, PhantFunc 0, Latency L0s <1us, L1 <8us
			ExtTag- AttnBtn- AttnInd- PwrInd- RBE+ FLReset+ SlotPowerLimit 75.000W
		DevCtl:	Report errors: Correctable- Non-Fatal- Fatal- Unsupported-
			RlxdOrd+ ExtTag- PhantFunc- AuxPwr- NoSnoop+ FLReset-
			MaxPayload 256 bytes, MaxReadReq 512 bytes
		DevSta:	CorrErr- UncorrErr- FatalErr- UnsuppReq- AuxPwr- TransPend-
		LnkCap:	Port #0, Speed 8GT/s, Width x8, ASPM not supported, Exit Latency L0s <1us, L1 <64us
			ClockPM- Surprise- LLActRep- BwNot- ASPMOptComp+
		LnkCtl:	ASPM Disabled; RCB 64 bytes Disabled- CommClk+
			ExtSynch- ClockPM- AutWidDis- BWInt- AutBWInt-
		LnkSta:	Speed 8GT/s, Width x8, TrErr- Train- SlotClk+ DLActive- BWMgmt- ABWMgmt-
		DevCap2: Completion Timeout: Range ABCD, TimeoutDis+, LTR-, OBFF Not Supported
		DevCtl2: Completion Timeout: 50us to 50ms, TimeoutDis-, LTR-, OBFF Disabled
		LnkSta2: Current De-emphasis Level: -3.5dB, EqualizationComplete-, EqualizationPhase1-
			 EqualizationPhase2-, EqualizationPhase3-, LinkEqualizationRequest-
	Capabilities: [b0] MSI-X: Enable- Count=64 Masked-
		Vector table: BAR=5 offset=0013d000
		PBA: BAR=5 offset=0013dff0
	Capabilities: [c0] Vital Product Data
		Product Name: Annapurna Labs Alpine AL5+
		Read-only fields:
			[PN] Part number: N08AP2VFN018A
			[SN] Serial number: A716000269
			[EC] Engineering changes: 1D
			[V0] Vendor specific: FF
			[V1] Vendor specific: FF:FF:FF:FF:FF:FF
			[V2] Vendor specific: F0:23:B9:A1:D9:08
			[V3] Vendor specific: FF:FF:FF:FF:FF:FF
			[V4] Vendor specific: F0:23:B9:A1:D9:09
		End
	Capabilities: [100 v1] Alternative Routing-ID Interpretation (ARI)
		ARICap:	MFVC- ACS-, Next Function: 0
		ARICtl:	MFVC- ACS-, Function Group: 0
	Capabilities: [140 v1] Device Serial Number 9a-bc-de-f0-12-34-56-78
	Capabilities: [150 v1] #19
	Capabilities: [178 v1] Transaction Processing Hints
		Device specific mode supported
		No steering table available
	Capabilities: [200 v2] Advanced Error Reporting
		UESta:	DLP- SDES- TLP- FCP- CmpltTO- CmpltAbrt- UnxCmplt- RxOF- MalfTLP- ECRC- UnsupReq- ACSViol-
		UEMsk:	DLP- SDES- TLP- FCP- CmpltTO- CmpltAbrt- UnxCmplt- RxOF- MalfTLP- ECRC- UnsupReq- ACSViol-
		UESvrt:	DLP+ SDES+ TLP- FCP+ CmpltTO- CmpltAbrt- UnxCmplt- RxOF+ MalfTLP+ ECRC- UnsupReq- ACSViol-
		CESta:	RxErr- BadTLP- BadDLLP- Rollover- Timeout- NonFatalErr-
		CEMsk:	RxErr- BadTLP- BadDLLP- Rollover- Timeout- NonFatalErr+
		AERCap:	First Error Pointer: 00, GenCap+ CGenEn- ChkCap+ ChkEn-

08:34:08.94 PASS: Interpose1_Ethernet_Ctrl PCIe link speed 8
08:34:08.94 PASS: Interpose1_Ethernet_Ctrl PCIe link Width is 8
08:34:08.94 Subsection: Interpose2_Storage1_Ctrl Speed and Width Check
08:34:08.94 Send = lspci -s 19:00.0 -vvn
08:34:08.94 Rece = 
19:00.0 0180: 1c36:1031 (prog-if 02)
	Subsystem: 0102:abce
	Control: I/O- Mem+ BusMaster+ SpecCycle- MemWINV- VGASnoop- ParErr- Stepping- SERR+ FastB2B- DisINTx-
	Status: Cap+ 66MHz- UDF- FastB2B- ParErr- DEVSEL=fast >TAbort- <TAbort- <MAbort- >SERR- <PERR- INTx-
	Latency: 0, Cache Line Size: 32 bytes
	Interrupt: pin A routed to IRQ 11
	NUMA node: 0
	Region 0: Memory at 6a004000 (64-bit, non-prefetchable) [size=16K]
	Region 4: Memory at 60000000 (32-bit, non-prefetchable) [size=64M]
	Region 5: Memory at 68000000 (32-bit, non-prefetchable) [size=32M]
	Capabilities: [40] Power Management version 3
		Flags: PMEClk- DSI- D1- D2- AuxCurrent=375mA PME(D0+,D1-,D2-,D3hot-,D3cold-)
		Status: D0 NoSoftRst- PME-Enable- DSel=0 DScale=0 PME-
	Capabilities: [70] Express (v2) Endpoint, MSI 00
		DevCap:	MaxPayload 256 bytes, PhantFunc 0, Latency L0s <1us, L1 <8us
			ExtTag- AttnBtn- AttnInd- PwrInd- RBE+ FLReset+ SlotPowerLimit 75.000W
		DevCtl:	Report errors: Correctable- Non-Fatal- Fatal- Unsupported-
			RlxdOrd+ ExtTag- PhantFunc- AuxPwr- NoSnoop+ FLReset-
			MaxPayload 256 bytes, MaxReadReq 512 bytes
		DevSta:	CorrErr- UncorrErr- FatalErr- UnsuppReq- AuxPwr- TransPend-
		LnkCap:	Port #0, Speed 8GT/s, Width x8, ASPM not supported, Exit Latency L0s <1us, L1 <64us
			ClockPM- Surprise- LLActRep- BwNot- ASPMOptComp+
		LnkCtl:	ASPM Disabled; RCB 64 bytes Disabled- CommClk+
			ExtSynch- ClockPM- AutWidDis- BWInt- AutBWInt-
		LnkSta:	Speed 8GT/s, Width x8, TrErr- Train- SlotClk+ DLActive- BWMgmt- ABWMgmt-
		DevCap2: Completion Timeout: Range ABCD, TimeoutDis+, LTR-, OBFF Not Supported
		DevCtl2: Completion Timeout: 50us to 50ms, TimeoutDis-, LTR-, OBFF Disabled
		LnkCtl2: Target Link Speed: 8GT/s, EnterCompliance- SpeedDis-
			 Transmit Margin: Normal Operating Range, EnterModifiedCompliance- ComplianceSOS-
			 Compliance De-emphasis: -6dB
		LnkSta2: Current De-emphasis Level: -3.5dB, EqualizationComplete+, EqualizationPhase1+
			 EqualizationPhase2+, EqualizationPhase3+, LinkEqualizationRequest-
	Capabilities: [b0] MSI-X: Enable- Count=64 Masked-
		Vector table: BAR=0 offset=00002000
		PBA: BAR=0 offset=00003000
	Capabilities: [c0] Vital Product Data
		Product Name: Annapurna Labs Alpine AL5+
		Read-only fields:
			[PN] Part number: N08AP2VFN018A
			[SN] Serial number: A715048544
			[EC] Engineering changes: 1D
			[V0] Vendor specific: FF
			[V1] Vendor specific: FF:FF:FF:FF:FF:FF
			[V2] Vendor specific: F0:23:B9:A0:0D:5C
			[V3] Vendor specific: FF:FF:FF:FF:FF:FF
			[V4] Vendor specific: F0:23:B9:A0:0D:5D
		End
	Capabilities: [100 v1] Alternative Routing-ID Interpretation (ARI)
		ARICap:	MFVC- ACS-, Next Function: 1
		ARICtl:	MFVC- ACS-, Function Group: 0
	Capabilities: [140 v1] Device Serial Number 9a-bc-de-f0-12-34-56-78
	Capabilities: [150 v1] #19
	Capabilities: [178 v1] Transaction Processing Hints
		Device specific mode supported
		No steering table available
	Capabilities: [200 v2] Advanced Error Reporting
		UESta:	DLP- SDES- TLP- FCP- CmpltTO- CmpltAbrt- UnxCmplt- RxOF- MalfTLP- ECRC- UnsupReq- ACSViol-
		UEMsk:	DLP- SDES- TLP- FCP- CmpltTO- CmpltAbrt- UnxCmplt- RxOF- MalfTLP- ECRC- UnsupReq- ACSViol-
		UESvrt:	DLP+ SDES+ TLP- FCP+ CmpltTO- CmpltAbrt- UnxCmplt- RxOF+ MalfTLP+ ECRC- UnsupReq- ACSViol-
		CESta:	RxErr- BadTLP- BadDLLP- Rollover- Timeout- NonFatalErr-
		CEMsk:	RxErr- BadTLP- BadDLLP- Rollover- Timeout- NonFatalErr+
		AERCap:	First Error Pointer: 00, GenCap+ CGenEn- ChkCap+ ChkEn-

08:34:08.97 PASS: Interpose2_Storage1_Ctrl PCIe link speed 8
08:34:08.97 PASS: Interpose2_Storage1_Ctrl PCIe link Width is 8
08:34:08.97 Subsection: Interpose2_Storage2_Ctrl Speed and Width Check
08:34:08.98 Send = lspci -s 19:00.1 -vvn
08:34:08.98 Rece = 
19:00.1 0180: 1c36:1031 (prog-if 02)
	Subsystem: 0102:abce
	Control: I/O- Mem+ BusMaster+ SpecCycle- MemWINV- VGASnoop- ParErr- Stepping- SERR+ FastB2B- DisINTx-
	Status: Cap+ 66MHz- UDF- FastB2B- ParErr- DEVSEL=fast >TAbort- <TAbort- <MAbort- >SERR- <PERR- INTx-
	Latency: 0, Cache Line Size: 32 bytes
	Interrupt: pin A routed to IRQ 11
	NUMA node: 0
	Region 0: Memory at 6a000000 (64-bit, non-prefetchable) [size=16K]
	Region 4: Memory at 5c000000 (32-bit, non-prefetchable) [size=64M]
	Region 5: Memory at 66000000 (32-bit, non-prefetchable) [size=32M]
	Capabilities: [40] Power Management version 3
		Flags: PMEClk- DSI- D1- D2- AuxCurrent=375mA PME(D0+,D1-,D2-,D3hot-,D3cold-)
		Status: D0 NoSoftRst- PME-Enable- DSel=0 DScale=0 PME-
	Capabilities: [70] Express (v2) Endpoint, MSI 00
		DevCap:	MaxPayload 256 bytes, PhantFunc 0, Latency L0s <1us, L1 <8us
			ExtTag- AttnBtn- AttnInd- PwrInd- RBE+ FLReset+ SlotPowerLimit 75.000W
		DevCtl:	Report errors: Correctable- Non-Fatal- Fatal- Unsupported-
			RlxdOrd+ ExtTag- PhantFunc- AuxPwr- NoSnoop+ FLReset-
			MaxPayload 256 bytes, MaxReadReq 512 bytes
		DevSta:	CorrErr- UncorrErr- FatalErr- UnsuppReq- AuxPwr- TransPend-
		LnkCap:	Port #0, Speed 8GT/s, Width x8, ASPM not supported, Exit Latency L0s <1us, L1 <64us
			ClockPM- Surprise- LLActRep- BwNot- ASPMOptComp+
		LnkCtl:	ASPM Disabled; RCB 64 bytes Disabled- CommClk+
			ExtSynch- ClockPM- AutWidDis- BWInt- AutBWInt-
		LnkSta:	Speed 8GT/s, Width x8, TrErr- Train- SlotClk+ DLActive- BWMgmt- ABWMgmt-
		DevCap2: Completion Timeout: Range ABCD, TimeoutDis+, LTR-, OBFF Not Supported
		DevCtl2: Completion Timeout: 50us to 50ms, TimeoutDis-, LTR-, OBFF Disabled
		LnkSta2: Current De-emphasis Level: -3.5dB, EqualizationComplete-, EqualizationPhase1-
			 EqualizationPhase2-, EqualizationPhase3-, LinkEqualizationRequest-
	Capabilities: [b0] MSI-X: Enable- Count=64 Masked-
		Vector table: BAR=0 offset=00002000
		PBA: BAR=0 offset=00003000
	Capabilities: [c0] Vital Product Data
		Product Name: Annapurna Labs Alpine AL5+
		Read-only fields:
			[PN] Part number: N08AP2VFN018A
			[SN] Serial number: A715048544
			[EC] Engineering changes: 1D
			[V0] Vendor specific: FF
			[V1] Vendor specific: FF:FF:FF:FF:FF:FF
			[V2] Vendor specific: F0:23:B9:A0:0D:5C
			[V3] Vendor specific: FF:FF:FF:FF:FF:FF
			[V4] Vendor specific: F0:23:B9:A0:0D:5D
		End
	Capabilities: [100 v1] Alternative Routing-ID Interpretation (ARI)
		ARICap:	MFVC- ACS-, Next Function: 2
		ARICtl:	MFVC- ACS-, Function Group: 0
	Capabilities: [140 v1] Device Serial Number 9a-bc-de-f0-12-34-56-78
	Capabilities: [150 v1] #19
	Capabilities: [178 v1] Transaction Processing Hints
		Device specific mode supported
		No steering table available
	Capabilities: [200 v2] Advanced Error Reporting
		UESta:	DLP- SDES- TLP- FCP- CmpltTO- CmpltAbrt- UnxCmplt- RxOF- MalfTLP- ECRC- UnsupReq- ACSViol-
		UEMsk:	DLP- SDES- TLP- FCP- CmpltTO- CmpltAbrt- UnxCmplt- RxOF- MalfTLP- ECRC- UnsupReq- ACSViol-
		UESvrt:	DLP+ SDES+ TLP- FCP+ CmpltTO- CmpltAbrt- UnxCmplt- RxOF+ MalfTLP+ ECRC- UnsupReq- ACSViol-
		CESta:	RxErr- BadTLP- BadDLLP- Rollover- Timeout- NonFatalErr-
		CEMsk:	RxErr- BadTLP- BadDLLP- Rollover- Timeout- NonFatalErr+
		AERCap:	First Error Pointer: 00, GenCap+ CGenEn- ChkCap+ ChkEn-

08:34:09.00 PASS: Interpose2_Storage2_Ctrl PCIe link speed 8
08:34:09.00 PASS: Interpose2_Storage2_Ctrl PCIe link Width is 8
08:34:09.01 Subsection: Interpose2_Ethernet_Ctrl Speed and Width Check
08:34:09.01 Send = lspci -s 19:00.2 -vvn
08:34:09.01 Rece = 
19:00.2 0200: 1c36:1001
	Subsystem: 0102:abce
	Control: I/O- Mem- BusMaster- SpecCycle- MemWINV- VGASnoop- ParErr- Stepping- SERR+ FastB2B- DisINTx-
	Status: Cap+ 66MHz- UDF- FastB2B- ParErr- DEVSEL=fast >TAbort- <TAbort- <MAbort- >SERR- <PERR- INTx-
	Interrupt: pin A routed to IRQ 11
	NUMA node: 0
	Region 5: Memory at 64000000 (32-bit, non-prefetchable) [disabled] [size=32M]
	Capabilities: [40] Power Management version 3
		Flags: PMEClk- DSI- D1- D2- AuxCurrent=375mA PME(D0+,D1-,D2-,D3hot-,D3cold-)
		Status: D0 NoSoftRst- PME-Enable- DSel=0 DScale=0 PME-
	Capabilities: [70] Express (v2) Endpoint, MSI 00
		DevCap:	MaxPayload 256 bytes, PhantFunc 0, Latency L0s <1us, L1 <8us
			ExtTag- AttnBtn- AttnInd- PwrInd- RBE+ FLReset+ SlotPowerLimit 75.000W
		DevCtl:	Report errors: Correctable- Non-Fatal- Fatal- Unsupported-
			RlxdOrd+ ExtTag- PhantFunc- AuxPwr- NoSnoop+ FLReset-
			MaxPayload 256 bytes, MaxReadReq 512 bytes
		DevSta:	CorrErr- UncorrErr- FatalErr- UnsuppReq- AuxPwr- TransPend-
		LnkCap:	Port #0, Speed 8GT/s, Width x8, ASPM not supported, Exit Latency L0s <1us, L1 <64us
			ClockPM- Surprise- LLActRep- BwNot- ASPMOptComp+
		LnkCtl:	ASPM Disabled; RCB 64 bytes Disabled- CommClk+
			ExtSynch- ClockPM- AutWidDis- BWInt- AutBWInt-
		LnkSta:	Speed 8GT/s, Width x8, TrErr- Train- SlotClk+ DLActive- BWMgmt- ABWMgmt-
		DevCap2: Completion Timeout: Range ABCD, TimeoutDis+, LTR-, OBFF Not Supported
		DevCtl2: Completion Timeout: 50us to 50ms, TimeoutDis-, LTR-, OBFF Disabled
		LnkSta2: Current De-emphasis Level: -3.5dB, EqualizationComplete-, EqualizationPhase1-
			 EqualizationPhase2-, EqualizationPhase3-, LinkEqualizationRequest-
	Capabilities: [b0] MSI-X: Enable- Count=64 Masked-
		Vector table: BAR=5 offset=0013d000
		PBA: BAR=5 offset=0013dff0
	Capabilities: [c0] Vital Product Data
		Product Name: Annapurna Labs Alpine AL5+
		Read-only fields:
			[PN] Part number: N08AP2VFN018A
			[SN] Serial number: A715048544
			[EC] Engineering changes: 1D
			[V0] Vendor specific: FF
			[V1] Vendor specific: FF:FF:FF:FF:FF:FF
			[V2] Vendor specific: F0:23:B9:A0:0D:5C
			[V3] Vendor specific: FF:FF:FF:FF:FF:FF
			[V4] Vendor specific: F0:23:B9:A0:0D:5D
		End
	Capabilities: [100 v1] Alternative Routing-ID Interpretation (ARI)
		ARICap:	MFVC- ACS-, Next Function: 0
		ARICtl:	MFVC- ACS-, Function Group: 0
	Capabilities: [140 v1] Device Serial Number 9a-bc-de-f0-12-34-56-78
	Capabilities: [150 v1] #19
	Capabilities: [178 v1] Transaction Processing Hints
		Device specific mode supported
		No steering table available
	Capabilities: [200 v2] Advanced Error Reporting
		UESta:	DLP- SDES- TLP- FCP- CmpltTO- CmpltAbrt- UnxCmplt- RxOF- MalfTLP- ECRC- UnsupReq- ACSViol-
		UEMsk:	DLP- SDES- TLP- FCP- CmpltTO- CmpltAbrt- UnxCmplt- RxOF- MalfTLP- ECRC- UnsupReq- ACSViol-
		UESvrt:	DLP+ SDES+ TLP- FCP+ CmpltTO- CmpltAbrt- UnxCmplt- RxOF+ MalfTLP+ ECRC- UnsupReq- ACSViol-
		CESta:	RxErr- BadTLP- BadDLLP- Rollover- Timeout- NonFatalErr-
		CEMsk:	RxErr- BadTLP- BadDLLP- Rollover- Timeout- NonFatalErr+
		AERCap:	First Error Pointer: 00, GenCap+ CGenEn- ChkCap+ ChkEn-

08:34:09.04 PASS: Interpose2_Ethernet_Ctrl PCIe link speed 8
08:34:09.04 PASS: Interpose2_Ethernet_Ctrl PCIe link Width is 8
08:34:09.04 Subsection: Interpose3_Storage1_Ctrl Speed and Width Check
08:34:09.04 Send = lspci -s af:00.0 -vvn
08:34:09.04 Rece = 
af:00.0 0180: 1c36:1031 (prog-if 02)
	Subsystem: 0102:abce
	Control: I/O- Mem+ BusMaster+ SpecCycle- MemWINV- VGASnoop- ParErr- Stepping- SERR+ FastB2B- DisINTx-
	Status: Cap+ 66MHz- UDF- FastB2B- ParErr- DEVSEL=fast >TAbort- <TAbort- <MAbort- >SERR- <PERR- INTx-
	Latency: 0, Cache Line Size: 32 bytes
	Interrupt: pin A routed to IRQ 11
	NUMA node: 1
	Region 0: Memory at de004000 (64-bit, non-prefetchable) [size=16K]
	Region 4: Memory at d4000000 (32-bit, non-prefetchable) [size=64M]
	Region 5: Memory at dc000000 (32-bit, non-prefetchable) [size=32M]
	Capabilities: [40] Power Management version 3
		Flags: PMEClk- DSI- D1- D2- AuxCurrent=375mA PME(D0+,D1-,D2-,D3hot-,D3cold-)
		Status: D0 NoSoftRst- PME-Enable- DSel=0 DScale=0 PME-
	Capabilities: [70] Express (v2) Endpoint, MSI 00
		DevCap:	MaxPayload 256 bytes, PhantFunc 0, Latency L0s <1us, L1 <8us
			ExtTag- AttnBtn- AttnInd- PwrInd- RBE+ FLReset+ SlotPowerLimit 75.000W
		DevCtl:	Report errors: Correctable- Non-Fatal- Fatal- Unsupported-
			RlxdOrd+ ExtTag- PhantFunc- AuxPwr- NoSnoop+ FLReset-
			MaxPayload 256 bytes, MaxReadReq 512 bytes
		DevSta:	CorrErr- UncorrErr- FatalErr- UnsuppReq- AuxPwr- TransPend-
		LnkCap:	Port #0, Speed 8GT/s, Width x8, ASPM not supported, Exit Latency L0s <1us, L1 <64us
			ClockPM- Surprise- LLActRep- BwNot- ASPMOptComp+
		LnkCtl:	ASPM Disabled; RCB 64 bytes Disabled- CommClk+
			ExtSynch- ClockPM- AutWidDis- BWInt- AutBWInt-
		LnkSta:	Speed 8GT/s, Width x8, TrErr- Train- SlotClk+ DLActive- BWMgmt- ABWMgmt-
		DevCap2: Completion Timeout: Range ABCD, TimeoutDis+, LTR-, OBFF Not Supported
		DevCtl2: Completion Timeout: 50us to 50ms, TimeoutDis-, LTR-, OBFF Disabled
		LnkCtl2: Target Link Speed: 8GT/s, EnterCompliance- SpeedDis-
			 Transmit Margin: Normal Operating Range, EnterModifiedCompliance- ComplianceSOS-
			 Compliance De-emphasis: -6dB
		LnkSta2: Current De-emphasis Level: -3.5dB, EqualizationComplete+, EqualizationPhase1+
			 EqualizationPhase2+, EqualizationPhase3+, LinkEqualizationRequest-
	Capabilities: [b0] MSI-X: Enable- Count=64 Masked-
		Vector table: BAR=0 offset=00002000
		PBA: BAR=0 offset=00003000
	Capabilities: [c0] Vital Product Data
		Product Name: Annapurna Labs Alpine AL5+
		Read-only fields:
			[PN] Part number: N08AP2VFN018A
			[SN] Serial number: A716000206
			[EC] Engineering changes: 1D
			[V0] Vendor specific: FF
			[V1] Vendor specific: FF:FF:FF:FF:FF:FF
			[V2] Vendor specific: F0:23:B9:A1:D8:96
			[V3] Vendor specific: FF:FF:FF:FF:FF:FF
			[V4] Vendor specific: F0:23:B9:A1:D8:97
		End
	Capabilities: [100 v1] Alternative Routing-ID Interpretation (ARI)
		ARICap:	MFVC- ACS-, Next Function: 1
		ARICtl:	MFVC- ACS-, Function Group: 0
	Capabilities: [140 v1] Device Serial Number 9a-bc-de-f0-12-34-56-78
	Capabilities: [150 v1] #19
	Capabilities: [178 v1] Transaction Processing Hints
		Device specific mode supported
		No steering table available
	Capabilities: [200 v2] Advanced Error Reporting
		UESta:	DLP- SDES- TLP- FCP- CmpltTO- CmpltAbrt- UnxCmplt- RxOF- MalfTLP- ECRC- UnsupReq- ACSViol-
		UEMsk:	DLP- SDES- TLP- FCP- CmpltTO- CmpltAbrt- UnxCmplt- RxOF- MalfTLP- ECRC- UnsupReq- ACSViol-
		UESvrt:	DLP+ SDES+ TLP- FCP+ CmpltTO- CmpltAbrt- UnxCmplt- RxOF+ MalfTLP+ ECRC- UnsupReq- ACSViol-
		CESta:	RxErr- BadTLP- BadDLLP- Rollover- Timeout- NonFatalErr-
		CEMsk:	RxErr- BadTLP- BadDLLP- Rollover- Timeout- NonFatalErr+
		AERCap:	First Error Pointer: 00, GenCap+ CGenEn- ChkCap+ ChkEn-

08:34:09.07 PASS: Interpose3_Storage1_Ctrl PCIe link speed 8
08:34:09.07 PASS: Interpose3_Storage1_Ctrl PCIe link Width is 8
08:34:09.07 Subsection: Interpose3_Storage2_Ctrl Speed and Width Check
08:34:09.07 Send = lspci -s af:00.1 -vvn
08:34:09.07 Rece = 
af:00.1 0180: 1c36:1031 (prog-if 02)
	Subsystem: 0102:abce
	Control: I/O- Mem+ BusMaster+ SpecCycle- MemWINV- VGASnoop- ParErr- Stepping- SERR+ FastB2B- DisINTx-
	Status: Cap+ 66MHz- UDF- FastB2B- ParErr- DEVSEL=fast >TAbort- <TAbort- <MAbort- >SERR- <PERR- INTx-
	Latency: 0, Cache Line Size: 32 bytes
	Interrupt: pin A routed to IRQ 11
	NUMA node: 1
	Region 0: Memory at de000000 (64-bit, non-prefetchable) [size=16K]
	Region 4: Memory at d0000000 (32-bit, non-prefetchable) [size=64M]
	Region 5: Memory at da000000 (32-bit, non-prefetchable) [size=32M]
	Capabilities: [40] Power Management version 3
		Flags: PMEClk- DSI- D1- D2- AuxCurrent=375mA PME(D0+,D1-,D2-,D3hot-,D3cold-)
		Status: D0 NoSoftRst- PME-Enable- DSel=0 DScale=0 PME-
	Capabilities: [70] Express (v2) Endpoint, MSI 00
		DevCap:	MaxPayload 256 bytes, PhantFunc 0, Latency L0s <1us, L1 <8us
			ExtTag- AttnBtn- AttnInd- PwrInd- RBE+ FLReset+ SlotPowerLimit 75.000W
		DevCtl:	Report errors: Correctable- Non-Fatal- Fatal- Unsupported-
			RlxdOrd+ ExtTag- PhantFunc- AuxPwr- NoSnoop+ FLReset-
			MaxPayload 256 bytes, MaxReadReq 512 bytes
		DevSta:	CorrErr- UncorrErr- FatalErr- UnsuppReq- AuxPwr- TransPend-
		LnkCap:	Port #0, Speed 8GT/s, Width x8, ASPM not supported, Exit Latency L0s <1us, L1 <64us
			ClockPM- Surprise- LLActRep- BwNot- ASPMOptComp+
		LnkCtl:	ASPM Disabled; RCB 64 bytes Disabled- CommClk+
			ExtSynch- ClockPM- AutWidDis- BWInt- AutBWInt-
		LnkSta:	Speed 8GT/s, Width x8, TrErr- Train- SlotClk+ DLActive- BWMgmt- ABWMgmt-
		DevCap2: Completion Timeout: Range ABCD, TimeoutDis+, LTR-, OBFF Not Supported
		DevCtl2: Completion Timeout: 50us to 50ms, TimeoutDis-, LTR-, OBFF Disabled
		LnkSta2: Current De-emphasis Level: -3.5dB, EqualizationComplete-, EqualizationPhase1-
			 EqualizationPhase2-, EqualizationPhase3-, LinkEqualizationRequest-
	Capabilities: [b0] MSI-X: Enable- Count=64 Masked-
		Vector table: BAR=0 offset=00002000
		PBA: BAR=0 offset=00003000
	Capabilities: [c0] Vital Product Data
		Product Name: Annapurna Labs Alpine AL5+
		Read-only fields:
			[PN] Part number: N08AP2VFN018A
			[SN] Serial number: A716000206
			[EC] Engineering changes: 1D
			[V0] Vendor specific: FF
			[V1] Vendor specific: FF:FF:FF:FF:FF:FF
			[V2] Vendor specific: F0:23:B9:A1:D8:96
			[V3] Vendor specific: FF:FF:FF:FF:FF:FF
			[V4] Vendor specific: F0:23:B9:A1:D8:97
		End
	Capabilities: [100 v1] Alternative Routing-ID Interpretation (ARI)
		ARICap:	MFVC- ACS-, Next Function: 2
		ARICtl:	MFVC- ACS-, Function Group: 0
	Capabilities: [140 v1] Device Serial Number 9a-bc-de-f0-12-34-56-78
	Capabilities: [150 v1] #19
	Capabilities: [178 v1] Transaction Processing Hints
		Device specific mode supported
		No steering table available
	Capabilities: [200 v2] Advanced Error Reporting
		UESta:	DLP- SDES- TLP- FCP- CmpltTO- CmpltAbrt- UnxCmplt- RxOF- MalfTLP- ECRC- UnsupReq- ACSViol-
		UEMsk:	DLP- SDES- TLP- FCP- CmpltTO- CmpltAbrt- UnxCmplt- RxOF- MalfTLP- ECRC- UnsupReq- ACSViol-
		UESvrt:	DLP+ SDES+ TLP- FCP+ CmpltTO- CmpltAbrt- UnxCmplt- RxOF+ MalfTLP+ ECRC- UnsupReq- ACSViol-
		CESta:	RxErr- BadTLP- BadDLLP- Rollover- Timeout- NonFatalErr-
		CEMsk:	RxErr- BadTLP- BadDLLP- Rollover- Timeout- NonFatalErr+
		AERCap:	First Error Pointer: 00, GenCap+ CGenEn- ChkCap+ ChkEn-

08:34:09.10 PASS: Interpose3_Storage2_Ctrl PCIe link speed 8
08:34:09.10 PASS: Interpose3_Storage2_Ctrl PCIe link Width is 8
08:34:09.10 Subsection: Interpose3_Ethernet_Ctrl Speed and Width Check
08:34:09.10 Send = lspci -s af:00.2 -vvn
08:34:09.10 Rece = 
af:00.2 0200: 1c36:1001
	Subsystem: 0102:abce
	Control: I/O- Mem- BusMaster- SpecCycle- MemWINV- VGASnoop- ParErr- Stepping- SERR+ FastB2B- DisINTx-
	Status: Cap+ 66MHz- UDF- FastB2B- ParErr- DEVSEL=fast >TAbort- <TAbort- <MAbort- >SERR- <PERR- INTx-
	Interrupt: pin A routed to IRQ 11
	NUMA node: 1
	Region 5: Memory at d8000000 (32-bit, non-prefetchable) [disabled] [size=32M]
	Capabilities: [40] Power Management version 3
		Flags: PMEClk- DSI- D1- D2- AuxCurrent=375mA PME(D0+,D1-,D2-,D3hot-,D3cold-)
		Status: D0 NoSoftRst- PME-Enable- DSel=0 DScale=0 PME-
	Capabilities: [70] Express (v2) Endpoint, MSI 00
		DevCap:	MaxPayload 256 bytes, PhantFunc 0, Latency L0s <1us, L1 <8us
			ExtTag- AttnBtn- AttnInd- PwrInd- RBE+ FLReset+ SlotPowerLimit 75.000W
		DevCtl:	Report errors: Correctable- Non-Fatal- Fatal- Unsupported-
			RlxdOrd+ ExtTag- PhantFunc- AuxPwr- NoSnoop+ FLReset-
			MaxPayload 256 bytes, MaxReadReq 512 bytes
		DevSta:	CorrErr- UncorrErr- FatalErr- UnsuppReq- AuxPwr- TransPend-
		LnkCap:	Port #0, Speed 8GT/s, Width x8, ASPM not supported, Exit Latency L0s <1us, L1 <64us
			ClockPM- Surprise- LLActRep- BwNot- ASPMOptComp+
		LnkCtl:	ASPM Disabled; RCB 64 bytes Disabled- CommClk+
			ExtSynch- ClockPM- AutWidDis- BWInt- AutBWInt-
		LnkSta:	Speed 8GT/s, Width x8, TrErr- Train- SlotClk+ DLActive- BWMgmt- ABWMgmt-
		DevCap2: Completion Timeout: Range ABCD, TimeoutDis+, LTR-, OBFF Not Supported
		DevCtl2: Completion Timeout: 50us to 50ms, TimeoutDis-, LTR-, OBFF Disabled
		LnkSta2: Current De-emphasis Level: -3.5dB, EqualizationComplete-, EqualizationPhase1-
			 EqualizationPhase2-, EqualizationPhase3-, LinkEqualizationRequest-
	Capabilities: [b0] MSI-X: Enable- Count=64 Masked-
		Vector table: BAR=5 offset=0013d000
		PBA: BAR=5 offset=0013dff0
	Capabilities: [c0] Vital Product Data
		Product Name: Annapurna Labs Alpine AL5+
		Read-only fields:
			[PN] Part number: N08AP2VFN018A
			[SN] Serial number: A716000206
			[EC] Engineering changes: 1D
			[V0] Vendor specific: FF
			[V1] Vendor specific: FF:FF:FF:FF:FF:FF
			[V2] Vendor specific: F0:23:B9:A1:D8:96
			[V3] Vendor specific: FF:FF:FF:FF:FF:FF
			[V4] Vendor specific: F0:23:B9:A1:D8:97
		End
	Capabilities: [100 v1] Alternative Routing-ID Interpretation (ARI)
		ARICap:	MFVC- ACS-, Next Function: 0
		ARICtl:	MFVC- ACS-, Function Group: 0
	Capabilities: [140 v1] Device Serial Number 9a-bc-de-f0-12-34-56-78
	Capabilities: [150 v1] #19
	Capabilities: [178 v1] Transaction Processing Hints
		Device specific mode supported
		No steering table available
	Capabilities: [200 v2] Advanced Error Reporting
		UESta:	DLP- SDES- TLP- FCP- CmpltTO- CmpltAbrt- UnxCmplt- RxOF- MalfTLP- ECRC- UnsupReq- ACSViol-
		UEMsk:	DLP- SDES- TLP- FCP- CmpltTO- CmpltAbrt- UnxCmplt- RxOF- MalfTLP- ECRC- UnsupReq- ACSViol-
		UESvrt:	DLP+ SDES+ TLP- FCP+ CmpltTO- CmpltAbrt- UnxCmplt- RxOF+ MalfTLP+ ECRC- UnsupReq- ACSViol-
		CESta:	RxErr- BadTLP- BadDLLP- Rollover- Timeout- NonFatalErr-
		CEMsk:	RxErr- BadTLP- BadDLLP- Rollover- Timeout- NonFatalErr+
		AERCap:	First Error Pointer: 00, GenCap+ CGenEn- ChkCap+ ChkEn-

08:34:09.13 PASS: Interpose3_Ethernet_Ctrl PCIe link speed 8
08:34:09.13 PASS: Interpose3_Ethernet_Ctrl PCIe link Width is 8
08:34:09.13 Subsection: Interpose4_Storage1_Ctrl Speed and Width Check
08:34:09.13 Send = lspci -s b0:00.0 -vvn
08:34:09.13 Rece = 
b0:00.0 0180: 1c36:1031 (prog-if 02)
	Subsystem: 0102:abce
	Control: I/O- Mem+ BusMaster+ SpecCycle- MemWINV- VGASnoop- ParErr- Stepping- SERR+ FastB2B- DisINTx-
	Status: Cap+ 66MHz- UDF- FastB2B- ParErr- DEVSEL=fast >TAbort- <TAbort- <MAbort- >SERR- <PERR- INTx-
	Latency: 0, Cache Line Size: 32 bytes
	Interrupt: pin A routed to IRQ 11
	NUMA node: 1
	Region 0: Memory at ce004000 (64-bit, non-prefetchable) [size=16K]
	Region 4: Memory at c4000000 (32-bit, non-prefetchable) [size=64M]
	Region 5: Memory at cc000000 (32-bit, non-prefetchable) [size=32M]
	Capabilities: [40] Power Management version 3
		Flags: PMEClk- DSI- D1- D2- AuxCurrent=375mA PME(D0+,D1-,D2-,D3hot-,D3cold-)
		Status: D0 NoSoftRst- PME-Enable- DSel=0 DScale=0 PME-
	Capabilities: [70] Express (v2) Endpoint, MSI 00
		DevCap:	MaxPayload 256 bytes, PhantFunc 0, Latency L0s <1us, L1 <8us
			ExtTag- AttnBtn- AttnInd- PwrInd- RBE+ FLReset+ SlotPowerLimit 75.000W
		DevCtl:	Report errors: Correctable- Non-Fatal- Fatal- Unsupported-
			RlxdOrd+ ExtTag- PhantFunc- AuxPwr- NoSnoop+ FLReset-
			MaxPayload 256 bytes, MaxReadReq 512 bytes
		DevSta:	CorrErr- UncorrErr- FatalErr- UnsuppReq- AuxPwr- TransPend-
		LnkCap:	Port #0, Speed 8GT/s, Width x8, ASPM not supported, Exit Latency L0s <1us, L1 <64us
			ClockPM- Surprise- LLActRep- BwNot- ASPMOptComp+
		LnkCtl:	ASPM Disabled; RCB 64 bytes Disabled- CommClk+
			ExtSynch- ClockPM- AutWidDis- BWInt- AutBWInt-
		LnkSta:	Speed 8GT/s, Width x8, TrErr- Train- SlotClk+ DLActive- BWMgmt- ABWMgmt-
		DevCap2: Completion Timeout: Range ABCD, TimeoutDis+, LTR-, OBFF Not Supported
		DevCtl2: Completion Timeout: 50us to 50ms, TimeoutDis-, LTR-, OBFF Disabled
		LnkCtl2: Target Link Speed: 8GT/s, EnterCompliance- SpeedDis-
			 Transmit Margin: Normal Operating Range, EnterModifiedCompliance- ComplianceSOS-
			 Compliance De-emphasis: -6dB
		LnkSta2: Current De-emphasis Level: -3.5dB, EqualizationComplete+, EqualizationPhase1+
			 EqualizationPhase2+, EqualizationPhase3+, LinkEqualizationRequest-
	Capabilities: [b0] MSI-X: Enable- Count=64 Masked-
		Vector table: BAR=0 offset=00002000
		PBA: BAR=0 offset=00003000
	Capabilities: [c0] Vital Product Data
		Product Name: Annapurna Labs Alpine AL5+
		Read-only fields:
			[PN] Part number: N08AP2VFN018A
			[SN] Serial number: A715048199
			[EC] Engineering changes: 1D
			[V0] Vendor specific: FF
			[V1] Vendor specific: FF:FF:FF:FF:FF:FF
			[V2] Vendor specific: 14:4F:D7:0F:FD:A2
			[V3] Vendor specific: FF:FF:FF:FF:FF:FF
			[V4] Vendor specific: 14:4F:D7:0F:FD:A3
		End
	Capabilities: [100 v1] Alternative Routing-ID Interpretation (ARI)
		ARICap:	MFVC- ACS-, Next Function: 1
		ARICtl:	MFVC- ACS-, Function Group: 0
	Capabilities: [140 v1] Device Serial Number 9a-bc-de-f0-12-34-56-78
	Capabilities: [150 v1] #19
	Capabilities: [178 v1] Transaction Processing Hints
		Device specific mode supported
		No steering table available
	Capabilities: [200 v2] Advanced Error Reporting
		UESta:	DLP- SDES- TLP- FCP- CmpltTO- CmpltAbrt- UnxCmplt- RxOF- MalfTLP- ECRC- UnsupReq- ACSViol-
		UEMsk:	DLP- SDES- TLP- FCP- CmpltTO- CmpltAbrt- UnxCmplt- RxOF- MalfTLP- ECRC- UnsupReq- ACSViol-
		UESvrt:	DLP+ SDES+ TLP- FCP+ CmpltTO- CmpltAbrt- UnxCmplt- RxOF+ MalfTLP+ ECRC- UnsupReq- ACSViol-
		CESta:	RxErr- BadTLP- BadDLLP- Rollover- Timeout- NonFatalErr-
		CEMsk:	RxErr- BadTLP- BadDLLP- Rollover- Timeout- NonFatalErr+
		AERCap:	First Error Pointer: 00, GenCap+ CGenEn- ChkCap+ ChkEn-

08:34:09.15 PASS: Interpose4_Storage1_Ctrl PCIe link speed 8
08:34:09.15 PASS: Interpose4_Storage1_Ctrl PCIe link Width is 8
08:34:09.15 Subsection: Interpose4_Storage2_Ctrl Speed and Width Check
08:34:09.15 Send = lspci -s b0:00.1 -vvn
08:34:09.15 Rece = 
b0:00.1 0180: 1c36:1031 (prog-if 02)
	Subsystem: 0102:abce
	Control: I/O- Mem+ BusMaster+ SpecCycle- MemWINV- VGASnoop- ParErr- Stepping- SERR+ FastB2B- DisINTx-
	Status: Cap+ 66MHz- UDF- FastB2B- ParErr- DEVSEL=fast >TAbort- <TAbort- <MAbort- >SERR- <PERR- INTx-
	Latency: 0, Cache Line Size: 32 bytes
	Interrupt: pin A routed to IRQ 11
	NUMA node: 1
	Region 0: Memory at ce000000 (64-bit, non-prefetchable) [size=16K]
	Region 4: Memory at c0000000 (32-bit, non-prefetchable) [size=64M]
	Region 5: Memory at ca000000 (32-bit, non-prefetchable) [size=32M]
	Capabilities: [40] Power Management version 3
		Flags: PMEClk- DSI- D1- D2- AuxCurrent=375mA PME(D0+,D1-,D2-,D3hot-,D3cold-)
		Status: D0 NoSoftRst- PME-Enable- DSel=0 DScale=0 PME-
	Capabilities: [70] Express (v2) Endpoint, MSI 00
		DevCap:	MaxPayload 256 bytes, PhantFunc 0, Latency L0s <1us, L1 <8us
			ExtTag- AttnBtn- AttnInd- PwrInd- RBE+ FLReset+ SlotPowerLimit 75.000W
		DevCtl:	Report errors: Correctable- Non-Fatal- Fatal- Unsupported-
			RlxdOrd+ ExtTag- PhantFunc- AuxPwr- NoSnoop+ FLReset-
			MaxPayload 256 bytes, MaxReadReq 512 bytes
		DevSta:	CorrErr- UncorrErr- FatalErr- UnsuppReq- AuxPwr- TransPend-
		LnkCap:	Port #0, Speed 8GT/s, Width x8, ASPM not supported, Exit Latency L0s <1us, L1 <64us
			ClockPM- Surprise- LLActRep- BwNot- ASPMOptComp+
		LnkCtl:	ASPM Disabled; RCB 64 bytes Disabled- CommClk+
			ExtSynch- ClockPM- AutWidDis- BWInt- AutBWInt-
		LnkSta:	Speed 8GT/s, Width x8, TrErr- Train- SlotClk+ DLActive- BWMgmt- ABWMgmt-
		DevCap2: Completion Timeout: Range ABCD, TimeoutDis+, LTR-, OBFF Not Supported
		DevCtl2: Completion Timeout: 50us to 50ms, TimeoutDis-, LTR-, OBFF Disabled
		LnkSta2: Current De-emphasis Level: -3.5dB, EqualizationComplete-, EqualizationPhase1-
			 EqualizationPhase2-, EqualizationPhase3-, LinkEqualizationRequest-
	Capabilities: [b0] MSI-X: Enable- Count=64 Masked-
		Vector table: BAR=0 offset=00002000
		PBA: BAR=0 offset=00003000
	Capabilities: [c0] Vital Product Data
		Product Name: Annapurna Labs Alpine AL5+
		Read-only fields:
			[PN] Part number: N08AP2VFN018A
			[SN] Serial number: A715048199
			[EC] Engineering changes: 1D
			[V0] Vendor specific: FF
			[V1] Vendor specific: FF:FF:FF:FF:FF:FF
			[V2] Vendor specific: 14:4F:D7:0F:FD:A2
			[V3] Vendor specific: FF:FF:FF:FF:FF:FF
			[V4] Vendor specific: 14:4F:D7:0F:FD:A3
		End
	Capabilities: [100 v1] Alternative Routing-ID Interpretation (ARI)
		ARICap:	MFVC- ACS-, Next Function: 2
		ARICtl:	MFVC- ACS-, Function Group: 0
	Capabilities: [140 v1] Device Serial Number 9a-bc-de-f0-12-34-56-78
	Capabilities: [150 v1] #19
	Capabilities: [178 v1] Transaction Processing Hints
		Device specific mode supported
		No steering table available
	Capabilities: [200 v2] Advanced Error Reporting
		UESta:	DLP- SDES- TLP- FCP- CmpltTO- CmpltAbrt- UnxCmplt- RxOF- MalfTLP- ECRC- UnsupReq- ACSViol-
		UEMsk:	DLP- SDES- TLP- FCP- CmpltTO- CmpltAbrt- UnxCmplt- RxOF- MalfTLP- ECRC- UnsupReq- ACSViol-
		UESvrt:	DLP+ SDES+ TLP- FCP+ CmpltTO- CmpltAbrt- UnxCmplt- RxOF+ MalfTLP+ ECRC- UnsupReq- ACSViol-
		CESta:	RxErr- BadTLP- BadDLLP- Rollover- Timeout- NonFatalErr-
		CEMsk:	RxErr- BadTLP- BadDLLP- Rollover- Timeout- NonFatalErr+
		AERCap:	First Error Pointer: 00, GenCap+ CGenEn- ChkCap+ ChkEn-

08:34:09.18 PASS: Interpose4_Storage2_Ctrl PCIe link speed 8
08:34:09.18 PASS: Interpose4_Storage2_Ctrl PCIe link Width is 8
08:34:09.18 Subsection: Interpose4_Ethernet_Ctrl Speed and Width Check
08:34:09.19 Send = lspci -s b0:00.2 -vvn
08:34:09.19 Rece = 
b0:00.2 0200: 1c36:1001
	Subsystem: 0102:abce
	Control: I/O- Mem- BusMaster- SpecCycle- MemWINV- VGASnoop- ParErr- Stepping- SERR+ FastB2B- DisINTx-
	Status: Cap+ 66MHz- UDF- FastB2B- ParErr- DEVSEL=fast >TAbort- <TAbort- <MAbort- >SERR- <PERR- INTx-
	Interrupt: pin A routed to IRQ 11
	NUMA node: 1
	Region 5: Memory at c8000000 (32-bit, non-prefetchable) [disabled] [size=32M]
	Capabilities: [40] Power Management version 3
		Flags: PMEClk- DSI- D1- D2- AuxCurrent=375mA PME(D0+,D1-,D2-,D3hot-,D3cold-)
		Status: D0 NoSoftRst- PME-Enable- DSel=0 DScale=0 PME-
	Capabilities: [70] Express (v2) Endpoint, MSI 00
		DevCap:	MaxPayload 256 bytes, PhantFunc 0, Latency L0s <1us, L1 <8us
			ExtTag- AttnBtn- AttnInd- PwrInd- RBE+ FLReset+ SlotPowerLimit 75.000W
		DevCtl:	Report errors: Correctable- Non-Fatal- Fatal- Unsupported-
			RlxdOrd+ ExtTag- PhantFunc- AuxPwr- NoSnoop+ FLReset-
			MaxPayload 256 bytes, MaxReadReq 512 bytes
		DevSta:	CorrErr- UncorrErr- FatalErr- UnsuppReq- AuxPwr- TransPend-
		LnkCap:	Port #0, Speed 8GT/s, Width x8, ASPM not supported, Exit Latency L0s <1us, L1 <64us
			ClockPM- Surprise- LLActRep- BwNot- ASPMOptComp+
		LnkCtl:	ASPM Disabled; RCB 64 bytes Disabled- CommClk+
			ExtSynch- ClockPM- AutWidDis- BWInt- AutBWInt-
		LnkSta:	Speed 8GT/s, Width x8, TrErr- Train- SlotClk+ DLActive- BWMgmt- ABWMgmt-
		DevCap2: Completion Timeout: Range ABCD, TimeoutDis+, LTR-, OBFF Not Supported
		DevCtl2: Completion Timeout: 50us to 50ms, TimeoutDis-, LTR-, OBFF Disabled
		LnkSta2: Current De-emphasis Level: -3.5dB, EqualizationComplete-, EqualizationPhase1-
			 EqualizationPhase2-, EqualizationPhase3-, LinkEqualizationRequest-
	Capabilities: [b0] MSI-X: Enable- Count=64 Masked-
		Vector table: BAR=5 offset=0013d000
		PBA: BAR=5 offset=0013dff0
	Capabilities: [c0] Vital Product Data
		Product Name: Annapurna Labs Alpine AL5+
		Read-only fields:
			[PN] Part number: N08AP2VFN018A
			[SN] Serial number: A715048199
			[EC] Engineering changes: 1D
			[V0] Vendor specific: FF
			[V1] Vendor specific: FF:FF:FF:FF:FF:FF
			[V2] Vendor specific: 14:4F:D7:0F:FD:A2
			[V3] Vendor specific: FF:FF:FF:FF:FF:FF
			[V4] Vendor specific: 14:4F:D7:0F:FD:A3
		End
	Capabilities: [100 v1] Alternative Routing-ID Interpretation (ARI)
		ARICap:	MFVC- ACS-, Next Function: 0
		ARICtl:	MFVC- ACS-, Function Group: 0
	Capabilities: [140 v1] Device Serial Number 9a-bc-de-f0-12-34-56-78
	Capabilities: [150 v1] #19
	Capabilities: [178 v1] Transaction Processing Hints
		Device specific mode supported
		No steering table available
	Capabilities: [200 v2] Advanced Error Reporting
		UESta:	DLP- SDES- TLP- FCP- CmpltTO- CmpltAbrt- UnxCmplt- RxOF- MalfTLP- ECRC- UnsupReq- ACSViol-
		UEMsk:	DLP- SDES- TLP- FCP- CmpltTO- CmpltAbrt- UnxCmplt- RxOF- MalfTLP- ECRC- UnsupReq- ACSViol-
		UESvrt:	DLP+ SDES+ TLP- FCP+ CmpltTO- CmpltAbrt- UnxCmplt- RxOF+ MalfTLP+ ECRC- UnsupReq- ACSViol-
		CESta:	RxErr- BadTLP- BadDLLP- Rollover- Timeout- NonFatalErr-
		CEMsk:	RxErr- BadTLP- BadDLLP- Rollover- Timeout- NonFatalErr+
		AERCap:	First Error Pointer: 00, GenCap+ CGenEn- ChkCap+ ChkEn-

08:34:09.22 PASS: Interpose4_Ethernet_Ctrl PCIe link speed 8
08:34:09.22 PASS: Interpose4_Ethernet_Ctrl PCIe link Width is 8
08:34:09.22 Tester Chk => OK: PCIe Devices Link Speed and Width Verified
08:34:09.22 ##############################################################
08:34:09.22 Subsection: ButterFly1_Ethernet_Ctrl1 Speed and Width Check
08:34:09.22 Send = lspci -s 3b:00.0 -vvn
08:34:09.22 Rece = 

